id_course,course_name,degree_program
1424,Mathematical Modeling in Biology,Biologia Quantitativa e Computazionale (LM)
1425,Advanced Topics in Language/Cognition,Cognitive Science - Scienze Cognitive (LM)
1426,Employment/Labour Law,"Comparative, European and International Legal Studies (L2)"
1427,Calculus 1,Informatica (L2)
1428,Fisica applicata ai Beni culturali,Beni culturali (L2)
1429,Statistics of Stochastic Processes,Biologia Quantitativa e Computazionale (LM)
1430,Strategy Theory,"Security, Intelligence and Strategic Studies (LM)"
1431,Memory studies e storia,Filologia e critica letteraria (LM)
1432,Cellular and Molecular Neurobiology,BIOTECNOLOGIE CELLULARI E MOLECOLARI (LM)
1433,Experimental Biochemistry,Biologia Quantitativa e Computazionale (LM)
1434,Behavioural Economics,Economics - Economia (LM)
1435,Legislazione e politica dei diritti,Gestione delle diversità: inclusione ed equità (GEDIE) (M1)
1436,Viticoltura biologica,Viticoltura ed Enologia (L2)
1437,Challenge 3: Hitchhikers’ guides,School of Innovation (CS)
1438,Molecular Physics,Biologia Quantitativa e Computazionale (LM)
1439,Modellazione idrologica,Ingegneria per l'ambiente e il territorio (LM)
1440,Fondamenti di elaborazione dei segnali,Informatica (L2)
1441,Complementi matematici della meccanica quantistica,Fisica (L2)
1442,Cancer Therapy,BIOTECNOLOGIE CELLULARI E MOLECOLARI (LM)
1443,Statistical Field Theory,Biologia Quantitativa e Computazionale (LM)
1444,Lab. appl.: Analisi economica del diritto penale,Giurisprudenza (LM5)
1445,Visual design,Human-Computer Interaction - Interazione Persona-Macchina (LM)
1446,Filosofia della storia,Filosofia (L2)
1447,Introduction to Computer Programming for Economics and Management,Economia e Management (L2)
1448,Archeologia e storia dell'arte greca e romana,Beni culturali (L2)
1449,Recycling and sustainable materials,Materials Engineering (LM)
1450,Sviluppo competenze,Gestione di imprese sociali (G.I.S.) (M1)
1451,"Rischio e incertezza: misura, percezione e gestione",Amministrazione Aziendale e Diritto (L2)
1452,Bioenergy,Ingegneria per l'ambiente e il territorio (LM)
1453,Ultrasound Technologies for Medical Applications,Ingegneria dell'Informazione e delle Comunicazioni (LM)
1454,Organizzazione aziendale,Economia e Management (L2)
1455,Informatica (ECDL full),Gestione Aziendale (L2)
1456,Embedded systems,Data Science (LM)
1457,Introduction to international relations theory,Studi Sulla Sicurezza Internazionale (LM)
1458,Counselling e psicoterapia,Psicologia (LM)
1459,Analisi matematica 1,Ingegneria Industriale (L2)
1460,Storia greca I,Beni culturali (L2)
1461,Letteratura francese I,Lingue moderne (L2)
1462,Storia del teatro e dello spettacolo II,Beni culturali (L2)
1463,Valutazione neuropsicologica,Psicologia (LM)
1464,Calcolo numerico,Ingegneria Industriale (L2)
1465,Mechanics and materials for engineering design,Materials Engineering (LM)
1466,Statistical reasoning,Studi Sulla Sicurezza Internazionale (LM)
1467,Statistica per la professione,Economia e legislazione d'impresa (LM)
1468,Mathematical Control Theory,MATEMATICA (LM)
1469,Scientific Programming,Biologia Quantitativa e Computazionale (LM)
1470,Experimental Methods,FISICA (LM)
1471,Economia ed organizzazione aziendale,Ingegneria Industriale (L2)
1472,Storia greca I,Studi storici e filologico-letterari (L2)
1473,Innovation Ecosystems,School of Innovation (CS)
1474,Industrial systems modeling,Management and Industrial Systems Engineering (LM)
1475,Clinica in Alternative Dispute Resolution (didattica innovativa),Giurisprudenza (LM5)
1476,Filologia latina,Studi storici e filologico-letterari (L2)
1477,Applied Immunology,BIOTECNOLOGIE CELLULARI E MOLECOLARI (LM)
1478,Architettura e tecniche per l'edilizia sostenibile,Ingegneria Civile (LM)
1479,Optimization techniques,Ingegneria dell'Informazione e delle Comunicazioni (LM)
1480,Storia medievale I - LM,Filosofia e linguaggi della modernità (LM)
1481,Probabilità e statistica,Interfacce e Tecnologie della Comunicazione (L2)
1482,Fisica tecnica,Ingegneria Edile-Architettura (LM5)
1483,Political Theory,EUROPEAN AND INTERNATIONAL STUDIES - STUDI EUROPEI E INTERNAZIONALI (LM)
1484,Neuroimaging for Data Science,Artificial Intelligence Systems (LM)
1485,Metodi quantitativi per la ricerca,Sociologia (L2)
1486,Negotiation,International Management - Management Internazionale (LM)
1487,Solid state physics II,FISICA (LM)
1488,Knowledge Graph Engineering,INFORMATICA (LM)
1489,Ecologia,Ingegneria per l'ambiente e il territorio (L2)
1490,Programmazione 2,"Ingegneria Informatica, delle Comunicazioni ed Elettronica (L2)"
1491,Primo Tirocinio,Servizio Sociale (L2)
1492,Economia ed estimo civile,Ingegneria Edile-Architettura (LM5)
1493,Economic and labour sociology,Data Science (LM)
1494,Storia moderna I,Filosofia (L2)
1495,Competenze informatiche,Servizio Sociale (L2)
1496,Biologia Molecolare,Informatica (L2)
1497,Imprenditorialità e amministrazione dei servizi sociali,"Metodologia, Organizzazione e Valutazione dei Servizi Sociali (LM)"
1498,ICT Innovation,Ingegneria dell'Informazione e delle Comunicazioni (LM)
1499,Diritto internazionale dei conflitti armati,Giurisprudenza (LM5)
1500,Quantitative research methods,Global and Local Studies (LM)
1501,Statistical models,MATEMATICA (LM)
1502,Ingegneria del Software,Informatica (L2)
1503,Analisi matematica III,Fisica (L2)
1504,Tecnologie igienico-sanitarie e energia quasi-zero,Ingegneria per l'ambiente e il territorio (LM)
1505,Statistica economica,Economia e Management (L2)
1506,Fisica generale I (secondo modulo),Matematica (L2)
1507,Risk management,Finanza (LM)
1508,Geometria e algebra lineare,"Ingegneria Informatica, delle Comunicazioni ed Elettronica (L2)"
1509,Introduzione all'economia,Amministrazione Aziendale e Diritto (L2)
1510,Algebra commutativa,Matematica (L2)
1511,Tecnica del controllo ambientale,Ingegneria Edile-Architettura (LM5)
1512,Automatic Control,Mechatronics Engineering (LM)
1513,"Seminario: Artificial Intelligence and Human Rights, hopes risks, uncertainty",Sociologia (L2)
1514,ICT Innovation - Product Design and Development,Ingegneria dell'Informazione e delle Comunicazioni (LM)
1515,Psicologia dello sviluppo per l'insegnamento,Percorso 24 CFU (CS24)
1516,Laboratorio di Strategia e Corporate Governance_,Economia e Management (L2)
1517,Innovation processes and the new production of users,School of Innovation (CS)
1518,Tecniche psicometriche e analisi dei dati,Psicologia (LM)
1519,Computational Biophysics,Biologia Quantitativa e Computazionale (LM)
1520,Anatomia umana I,Medicina e Chirurgia (LM6)
1521,"Patologia, immunologia e genomica",Medicina e Chirurgia (LM6)
1522,Letteratura spagnola I,Lingue moderne (L2)
1523,Storia delle istituzioni politiche,Filosofia (L2)
1524,Storia della banca e della finanza,Gestione Aziendale (L2)
1525,Ergotecnica edile con Laboratorio progettuale,Ingegneria Edile-Architettura (LM5)
1526,History of Western Legal Tradition - advanced course,Giurisprudenza (LM5)
1527,Advanced mechanical systems,Mechatronics Engineering (LM)
1528,Lab. appl.: Retorica degli atti giudiziari: simulazione di un processo civile,Giurisprudenza (LM5)
1529,Technisches Deutsch,Ingegneria Energetica (LM)
1530,Psicobiologia degli apprendimenti culturali,Scienze e Tecniche di Psicologia Cognitiva (L2)
1531,Introduzione alla meccanica statistica,Fisica (L2)
1532,Start-up Lab_,International Management - Management Internazionale (LM)
1533,Meccanica razionale,Ingegneria Civile (L2)
1534,Storia delle istituzioni politiche,Studi internazionali (L2)
1535,Linguistica inglese I,Lingue moderne (L2)
1536,Geometric Measure Theory,MATEMATICA (LM)
1537,Global Food Security,Studi Sulla Sicurezza Internazionale (LM)
1538,Storia contemporanea II - LM,Scienze storiche (LM)
1539,Introduzione all’analisi empirica della società,Sociologia (L2)
1540,Introduction to Machine Learning,Informatica (L2)
1541,Solarenergiesysteme,Ingegneria Energetica (LM)
1542,Statistical Models,INFORMATICA (LM)
1543,Physics 2,"Ingegneria Informatica, delle Comunicazioni ed Elettronica (L2)"
1544,Calcolatori,Informatica (L2)
1545,Programmazione 1,"Ingegneria Informatica, delle Comunicazioni ed Elettronica (L2)"
1546,Sensing and Radar Technologies,Artificial Intelligence Systems (LM)
1547,"People, Politics and the Planet",Global and Local Studies (LM)
1548,Linguistica francese I,Lingue moderne (L2)
1549,Geografia I - LT,Studi storici e filologico-letterari (L2)
1550,Tecnologie e dispositivi wireless,"Ingegneria Informatica, delle Comunicazioni ed Elettronica (L2)"
1551,Diritto della contabilità pubblica,Giurisprudenza (LM5)
1552,Processi partecipativi di governance,Global and Local Studies (LM)
1553,Neuroetica,Psicologia (LM)
1554,Knowledge and Data Integration,Biologia Quantitativa e Computazionale (LM)
1555,Geotecnica,Ingegneria Civile (LM)
1556,Protezione idraulica dei territori montani,Ingegneria per l'ambiente e il territorio (LM)
1557,Tecnica urbanistica,Ingegneria Civile (LM)
1558,Diritto costituzionale,Giurisprudenza (LM5)
1559,Agri-food marketing analysis and techniques,Agrifood Innovation Management (LM)
1560,Inquinanti emergenti e strategie di risanamento,Ingegneria per l'ambiente e il territorio (LM)
1561,Elementi di pensiero teologico,Filosofia e linguaggi della modernità (LM)
1562,Economia e misurazione aziendale,Amministrazione Aziendale e Diritto (L2)
1563,Chimica agraria e biochimica con esercitazioni,Viticoltura ed Enologia (L2)
1564,Data hiding,MATEMATICA (LM)
1565,Project course,Ingegneria dell'Informazione e delle Comunicazioni (LM)
1566,Storia contemporanea IV,Studi storici e filologico-letterari (L2)
1567,Science storytelling and its discontents: a critical view,Communication of Science and Innovation - SCICOMM (M1)
1568,Filologia italiana I,Studi storici e filologico-letterari (L2)
1569,Fisica nucleare e subnucleare,Fisica (L2)
1570,International Economic Policy,Economia e Management (L2)
1571,Cognitive Neuroscience and Neurotechnology,Human-Computer Interaction - Interazione Persona-Macchina (LM)
1572,Understanding and Communicating Law and the Life Sciences,Communication of Science and Innovation - SCICOMM (M1)
1573,Psicologia del lavoro,Scienze e Tecniche di Psicologia Cognitiva (L2)
1574,Quantum Computing,INFORMATICA (LM)
1575,Modeling and simulation of mechatronic systems,Mechatronics Engineering (LM)
1576,"Flexicurity, tutele e mercato del lavoro",Giurisprudenza (LM5)
1577,Automatic control,Mechatronics Engineering (LM)
1578,Diritto amministrativo avanzato,Giurisprudenza (LM5)
1579,BioLaw: Teaching European Law and Life Sciences (BioTell),Giurisprudenza (LM5)
1580,Finanza aziendale,Gestione Aziendale (L2)
1581,"Science, Technology and Global Affairs",EUROPEAN AND INTERNATIONAL STUDIES - STUDI EUROPEI E INTERNAZIONALI (LM)
1582,Quantum Chemistry,Biologia Quantitativa e Computazionale (LM)
1583,Economia e diritto del lavoro,Gestione Aziendale (L2)
1584,Economic and labour sociology,Sociology and social research - Sociologia e ricerca sociale (LM)
1585,Steelmaking and foundry technologies,Materials and production Engineering - Ingegneria dei materiali e della produzione (LM)
1586,Immunologia,Scienze e Tecnologie Biomolecolari (L2)
1587,Basi biologiche del comportamento sociale,Psicologia (LM)
1588,Fisica 1,Ingegneria per l'ambiente e il territorio (L2)
1589,Innovation and Business in ICT,INFORMATICA (LM)
1590,"Methods for traceability, protection and authenticity detection of agri-food products",Agrifood Innovation Management (LM)
1591,Storia della Fisica e della Matematica,Fisica (L2)
1592,Storia del diritto medievale e moderno II,Giurisprudenza (LM5)
1593,Criminologia digitale,Giurisprudenza (LM5)
1594,Linguistica tedesca I,Lingue moderne (L2)
1595,Coding Theory and Applications,MATEMATICA (LM)
1596,Crash course - Legal Foundations,Behavioural and Applied Economics - Economia Comportamentale e Applicata (LM)
1597,Comunicazione delle Scienze,Fisica (L2)
1598,Teams and Team Working in Organizations,School of Innovation (CS)
1599,Optoelectronics and quantum devices for sensing and automation,Materials Engineering (LM)
1600,Economia,Gestione Aziendale (L2)
1601,"Il diritto della sicurezza nazionale, internazionale e dell'Unione Europea",Giurisprudenza (LM5)
1602,Competenze trasversali per la carriera lavorativa,Sociologia (L2)
1603,Physics and thermodynamics of materials,Materials Engineering (LM)
1604,"Course works, project works",Communication of Science and Innovation - SCICOMM (M1)
1605,Ingegneria fluviale,Ingegneria per l'ambiente e il territorio (LM)
1606,"Experimental design and sampling plans, statistical tests and programming for the analysis of agri-food and environmental data",Agrifood Innovation Management (LM)
1607,Chimica organica,Fisica (L2)
1608,Sostenibilità in cammino,Giurisprudenza (LM5)
1609,Comparative Constitutional Law of groups and minorities,Giurisprudenza (LM5)
1610,Microeconomics,Behavioural and Applied Economics - Economia Comportamentale e Applicata (LM)
1611,Laboratorio di programmazione per sistemi mobili e tablet,Informatica (L2)
1612,Oleodinamica e pneumatica,Ingegneria Industriale (L2)
1613,Advanced Coding Theory,MATEMATICA (LM)
1614,Radar and radiolocalization,Ingegneria dell'Informazione e delle Comunicazioni (LM)
1615,Diritto e letteratura,Giurisprudenza (LM5)
1616,Crash course - Economics,Innovation Management - Management dell'innovazione (LM)
1617,Data Science in Action,School of Innovation (CS)
1618,IE: From Idea to business idea,School of Innovation (CS)
1619,Laboratorio di analisi della cultura e del turismo e sistemi informativi per il turismo,"Mediazione linguistica, turismo e culture (LM)"
1620,Storia della pedagogia,Filosofia (L2)
1621,Nuclear and subnuclear physics,FISICA (LM)
1622,Lingua straniera - Inglese (B2),Ingegneria Civile (L2)
1623,Analisi matematica 2,Ingegneria Industriale (L2)
1624,Strumenti quantitativi per la gestione,Management (LM)
1625,Medicinal Chemistry,BIOTECNOLOGIE CELLULARI E MOLECOLARI (LM)
1626,Deep learning,Mechatronics Engineering (LM)
1627,Digital social data,Sociology and social research - Sociologia e ricerca sociale (LM)
1628,Mathematical Physics - Differential Geometric Methods,MATEMATICA (LM)
1629,Fondamenti di meccanica,Ingegneria Industriale (L2)
1630,Gravitational Wave Astronomy and Multimessenger observations,FISICA (LM)
1631,Preistoria e protostoria II,Beni culturali (L2)
1632,Filologia italiana II,Beni culturali (L2)
1633,Linguistica francese II,Lingue moderne (L2)
1634,Obbligo formativo aggiuntivo (OFA),Filosofia (L2)
1635,Matematica,Economia e Management (L2)
1636,Psicologia del ciclo di vita,Psicologia (LM)
1637,International Security and Strategic Studies,"Security, Intelligence and Strategic Studies (LM)"
1638,Laboratory of Didactics of Mathematics,MATEMATICA (LM)
1639,Scientific Programming,Biologia Quantitativa e Computazionale (LM)
1640,Epistemologia delle scienze sociali,Studi internazionali (L2)
1641,Progettazione di infrastrutture idrauliche urbane,Ingegneria per l'ambiente e il territorio (LM)
1642,Sociologia dello sviluppo internazionale,Studi internazionali (L2)
1643,Sicurezza aziendale e brand protection,Giurisprudenza (LM5)
1644,Law and Ethics in Artificial Intelligence,Artificial Intelligence Systems (LM)
1645,Theoretical biomechanics,MATEMATICA (LM)
1646,Party Politics and Democracy in Europe,EUROPEAN AND INTERNATIONAL STUDIES - STUDI EUROPEI E INTERNAZIONALI (LM)
1647,Empathy and Innovation,School of Innovation (CS)
1648,Second Language level B2 (German),Studi Sulla Sicurezza Internazionale (LM)
1649,Diritto commerciale,Amministrazione Aziendale e Diritto (L2)
1650,Recognition systems,Ingegneria dell'Informazione e delle Comunicazioni (LM)
1651,Bioenergy,Ingegneria Energetica (LM)
1652,New topics in social cognition and intergroup relations,Psicologia (LM)
1653,Modern Physics,MATEMATICA (LM)
1654,Embodied cognition in theory and practice,Scienze e Tecniche di Psicologia Cognitiva (L2)
1655,Data mining,INFORMATICA (LM)
1656,Aspetti criminologici e giuridici del fenomeno mafioso (corso libero),Giurisprudenza (LM5)
1657,Project management,Management and Industrial Systems Engineering (LM)
1658,Major issues in international politics,Studi internazionali (L2)
1659,Economia della cultura e del turismo e marketing della cultura e del turismo,"Mediazione linguistica, turismo e culture (LM)"
1660,Filosofia della religione,Filosofia (L2)
1661,Matematica finanziaria,Gestione Aziendale (L2)
1662,Geometria e algebra lineare,"Ingegneria Informatica, delle Comunicazioni ed Elettronica (L2)"
1663,Molecular and Cellular Biophysics,FISICA (LM)
1664,Bio-Inspired Artificial Intelligence,Artificial Intelligence Systems (LM)
1665,Calcolo delle variazioni,Matematica (L2)
1666,Psicologia del pensiero,Interfacce e Tecnologie della Comunicazione (L2)
1667,Winter School part I - Advanced numerical methods for free-surface hydrodynamics,"Ingegneria civile, ambientale e meccanica (D1)"
1668,Biologia generale e molecolare,Medicina e Chirurgia (LM6)
1669,Introduction to Computer and Network Security,Ingegneria dell'Informazione e delle Comunicazioni (LM)
1670,Laboratory of Computer Science Education,MATEMATICA (LM)
1671,Geomatica e telerilevamento,Ingegneria per l'ambiente e il territorio (LM)
1672,Lingua e cultura russa I,"Mediazione linguistica, turismo e culture (LM)"
1673,Tensor Decomposition for Big Data Analysis,Data Science (LM)
1674,Diritto pubblico europeo,Studi internazionali (L2)
1675,Calcolo stocastico progredito,Finanza (LM)
1676,Letteratura tedesca I,Lingue moderne (L2)
1677,Fondamenti di automatica,Ingegneria Industriale (L2)
1678,Economic History,Gestione Aziendale (L2)
1679,Crash course - Introduction to Quantitative Methods,Innovation Management - Management dell'innovazione (LM)
1680,Laboratorio di psicologia delle decisioni,Previsione Sociale (M2)
1681,Diritto tributario,Giurisprudenza (LM5)
1682,Introduction to Financial Accounting,Economia e Management (L2)
1683,Storia moderna I,Studi storici e filologico-letterari (L2)
1684,Archeologia e storia dell'arte romana,Beni culturali (L2)
1685,Set theory,MATEMATICA (LM)
1686,"Etica, università e comunità",Giurisprudenza (LM5)
1687,Relazioni internazionali e diritti umani,Studi internazionali (L2)
1688,Filosofia della religione - LM,Filosofia e linguaggi della modernità (LM)
1689,Bibliografia e biblioteconomia I,Beni culturali (L2)
1690,Technical English,Ingegneria dell'Informazione e delle Comunicazioni (LM)
1691,Advanced optimization-based robot control,Mechatronics Engineering (LM)
1692,Diritto commerciale,Economia e Management (L2)
1693,Neurogenesis and Brain Regeneration,BIOTECNOLOGIE CELLULARI E MOLECOLARI (LM)
1694,Metodi per la rilevazione e l'analisi delle preferenze/scelte dei consumatori,Management della sostenibilità e del turismo (LM)
1695,Economia dell'ambiente e del territorio,Management della sostenibilità e del turismo (LM)
1696,Modelli di organizzazione per il servizio sociale,Servizio Sociale (L2)
1697,Privacy and Intellectual Property Rights,INFORMATICA (LM)
1698,Statistica matematica,Matematica (L2)
1699,Revisione aziendale 2,Economia e legislazione d'impresa (LM)
1700,Environmental measurements,Environmental Meteorology (LM)
1701,Environmental physical chemistry,Environmental Meteorology (LM)
1702,Neurophysiology of language,Psicologia (LM)
1703,Storia del pensiero medievale e premoderno,Filosofia e linguaggi della modernità (LM)
1704,Distributed robot perception,INFORMATICA (LM)
1705,Visual Communication of Science,Communication of Science and Innovation - SCICOMM (M1)
1706,Sistemi informativi,Informatica (L2)
1707,Misurazione e rendicontazione sociale e ambientale,Management della sostenibilità e del turismo (LM)
1708,Natural Language Understanding,INFORMATICA (LM)
1709,Introductory nonlinear mechanics of soft biological tissues,"Ingegneria civile, ambientale e meccanica (D1)"
1710,Corso di Presentations - I periodo (intensivo),Centro Linguistico d'Ateneo (CLA)
1711,Architettura del legno,Ingegneria Edile-Architettura (LM5)
1712,Costruzione di strade,Ingegneria Civile (LM)
1713,Programmazione e controllo,Amministrazione Aziendale e Diritto (L2)
1714,Bibliografia e biblioteconomia,Studi storici e filologico-letterari (L2)
1715,Sistema di gestione e certificazione per la qualità e l'ambiente,Management della sostenibilità e del turismo (LM)
1716,Costruzioni in legno,Ingegneria Civile (LM)
1717,Algoritmi e strutture dati,Matematica (L2)
1718,Soluzioni basate sulla natura per la sostenibilità urbana,Ingegneria per l'ambiente e il territorio (LM)
1719,Databases,Informatica (L2)
1720,Business Development Laboratory,Artificial Intelligence Systems (LM)
1721,"Contabilità, bilancio e principi contabili",Amministrazione Aziendale e Diritto (L2)
1722,Sviluppo e istituzioni: analisi comparata,Studi internazionali (L2)
1723,Lingua inglese I,Lingue moderne (L2)
1724,Ultrasound Technologies for Medical Applications,Artificial Intelligence Systems (LM)
1725,Storia dell'arte medievale I,"Letterature euroamericane, traduzione e critica letteraria (LM)"
1726,"Engineering Thermodynamics, Heat and Mass Transfer",Ingegneria Energetica (LM)
1727,Economia e misurazione aziendale,Amministrazione Aziendale e Diritto (L2)
1728,Archeologia medievale II,Beni culturali (L2)
1729,Il ruolo professionale nell'educazione,Educazione professionale (abilitante alla professione sanitaria di Educatore professionale) (L2)
1730,Virus-Cell Interaction,BIOTECNOLOGIE CELLULARI E MOLECOLARI (LM)
1731,Programmazione avanzata,Informatica (L2)
1732,Intellectual Property and Competition Law,Data Science (LM)
1733,Cellular and Molecular Neurobiology,BIOTECNOLOGIE CELLULARI E MOLECOLARI (LM)
1734,Enterprise information system,Data Science (LM)
1735,Network-based Data Analysis,Biologia Quantitativa e Computazionale (LM)
1736,Single Cell and Spatial Omics,Biologia Quantitativa e Computazionale (LM)
1737,Analisi matematica con elementi di algebra,Interfacce e Tecnologie della Comunicazione (L2)
1738,"Minorities, Regionalism and Borders in Europe",Global and Local Studies (LM)
1739,Prototyping interactive systems,Human-Computer Interaction - Interazione Persona-Macchina (LM)
1740,Modellistica ambientale,Ingegneria per l'ambiente e il territorio (LM)
1741,International sustainable development,Ingegneria per l'ambiente e il territorio (LM)
1742,Distributed systems 1,Ingegneria dell'Informazione e delle Comunicazioni (LM)
1743,Diritto civile e scienze cognitive,Giurisprudenza (LM5)
1744,District heating systems design,Ingegneria Energetica (LM)
1745,Security and states of emergency: A constitutional law perspective,Studi Sulla Sicurezza Internazionale (LM)
1746,Advanced geometry,MATEMATICA (LM)
1747,Foundations of Private Law from EU Perspective,"Comparative, European and International Legal Studies (L2)"
1748,International Economics,Economia e Management (L2)
1749,Project course,Data Science (LM)
1750,Single Cell and Spatial Omics,BIOTECNOLOGIE CELLULARI E MOLECOLARI (LM)
1751,Analisi numerica II,Matematica (L2)
1752,Gestione delle acque e dei sedimenti per lo sviluppo sostenibile,Ingegneria per l'ambiente e il territorio (LM)
1753,Social inequalities and education,Sociology and social research - Sociologia e ricerca sociale (LM)
1754,Statistical Models,INFORMATICA (LM)
1755,Storia delle dottrine politiche I,Filosofia e linguaggi della modernità (LM)
1756,Lab. appl.: Il fenomeno successorio nell'esperienza giuridica romana,Giurisprudenza (LM5)
1757,Corso di francese B2 - I periodo (estensivo),Centro Linguistico d'Ateneo (CLA)
1758,Identification of Artificial Neural Networks,MATEMATICA (LM)
1759,Consumer Behavior and Analytics,Behavioural and Applied Economics - Economia Comportamentale e Applicata (LM)
1760,"Diversità, inclusione, equità: prospettive culturali e storiche",Gestione delle diversità: inclusione ed equità (GEDIE) (M1)
1761,Computational algebra,MATEMATICA (LM)
1762,Diritto penitenziario,Giurisprudenza (LM5)
1763,Geostoria,Studi storici e filologico-letterari (L2)
1764,Quantum Machine Learning,INFORMATICA (LM)
1765,Clinical Neurology and Neuropsychology,Cognitive Science - Scienze Cognitive (LM)
1766,Composizione architettonica 2 - Laboratorio progettuale,Ingegneria Edile-Architettura (LM5)
1767,Programmazione 2,Informatica (L2)
1768,Diritto del commercio e dell'arbitrato internazionale,Giurisprudenza (LM5)
1769,Experimental Physics Laboratory at High School Level I,INFORMATICA (LM)
1770,"Individui, famiglie e società",Servizio Sociale (L2)
1771,Microbiologia generale con esercitazioni di laboratorio,Viticoltura ed Enologia (L2)
1772,Tecnologia dei cicli produttivi,Gestione Aziendale (L2)
1773,Storia e testi della letteratura italiana,Beni culturali (L2)
1774,Pensiero ebraico I - LT,Filosofia (L2)
1775,PDE - Introduction to Academic Writing,Amministrazione Aziendale e Diritto (L2)
1776,Lab. appl.: Comunicazione efficace e competenze trasversali (didattica innovativa),Giurisprudenza (LM5)
1777,"Cure palliative, Sociologia e Servizio sociale",Sociologia (L2)
1778,Storia dell'arte moderna III,Beni culturali (L2)
1779,Ergonomia cognitiva con applicazioni al benessere organizzativo,Psicologia (LM)
1780,Marketing progredito,Management (LM)
1781,Test di matematica,Gestione Aziendale (L2)
1782,Reti,Matematica (L2)
1783,Letteratura latina medievale,Studi storici e filologico-letterari (L2)
1784,Next generation networks,Ingegneria dell'Informazione e delle Comunicazioni (LM)
1785,Bio-Inspired Artificial Intelligence,INFORMATICA (LM)
1786,Storia della critica d'arte II,Beni culturali (L2)
1787,Calcolo numerico e programmazione,Ingegneria Civile (L2)
