id_course,articulation,title
705a23393d744daf87a02320a163d72b,Databases,Informatica (L2)
e7778506513f4a4a8d4eb00438211a68,Analisi matematica 1,Ingegneria Civile (L2)
61e986d2108c48ae91f46a777f9e3e1d,Econometrics,Behavioural and Applied Economics - Economia Comportamentale e Applicata (LM)
0ba6c12cef154c20904673e6ee14eeb7,Agiografia II,Beni culturali (L2)
e0e56f7616074a65a13b431b09b13966,"Signal, Image and Video",Biologia Quantitativa e Computazionale (LM)
e7efb421b7d14c6a968e6ba5fdb825b7,Immagini di futuro,Previsione Sociale (M2)
5141f1110c9c4f79a17d59e947bda473,Filologia latina - LM,Filologia e critica letteraria (LM)
52029eafb61a473989c5b07758d53c1a,Technology Strategy,International Management - Management Internazionale (LM)
fc38f6ffe8324556a14da1202b0757e9,Advanced computing architectures,Ingegneria dell'Informazione e delle Comunicazioni (LM)
ae3911489bf84801bbe50244de588f42,Visual brain and design,Human-Computer Interaction - Interazione Persona-Macchina (LM)
1c0f7daab6a94379885d5e9c5262d895,Partial differential equations,MATEMATICA (LM)
7c448f80bfb54a16a143cb840d496f77,Utilizzo di nudging nelle scienze del comportamento,Interfacce e Tecnologie della Comunicazione (L2)
dd48494920dd46f3914875e601b33902,Biodiritto,Filosofia e linguaggi della modernità (LM)
b70243156f5d419cba0f7f828455429d,Elettrotecnica,Ingegneria Civile (L2)
af5737c486ed4a1ca21e446d8c4f4aaf,Logic networks,"Ingegneria Informatica, delle Comunicazioni ed Elettronica (L2)"
3f76f188fde24dee9e062bd3aca2bd24,Seminario: Ideare e sviluppare la tesi di laurea magistrale MOVASS,"Metodologia, Organizzazione e Valutazione dei Servizi Sociali (LM)"
08b28079f6fa49b3a53195a2d1cdd636,Misurazione e rendicontazione sociale,Management (LM)
225653db407043aea1bebf5c4c290be1,Economic Policy in Global Market,Economia e Management (L2)
2c180928d32c4fe5b0b9579abe11f800,The Legal Framework of EU Policies,EUROPEAN AND INTERNATIONAL STUDIES - STUDI EUROPEI E INTERNAZIONALI (LM)
644dae4b5e9b47d495ad7ea15efd1d86,Introduction to Computer and Network Security,"Ingegneria Informatica, delle Comunicazioni ed Elettronica (L2)"
93a5ee29a1c74520acb12aec4c6d7b49,Dispacciamento dell’energia,Ingegneria Energetica (LM)
2ccfd8ef17594178885ad6c5a000699b,Diritto pubblico,Gestione Aziendale (L2)
4d28aeb4e767488997d9ca37a785bdb8,Ecoidraulica,Ingegneria per l'ambiente e il territorio (LM)
24ded0ce9f30458b8ec40c514c6b4751,International business management,International Management - Management Internazionale (LM)
7fa159bd7f0c44da9b904f675c7f9d38,Interdisciplinary laboratory: Advanced metals,Materials and production Engineering - Ingegneria dei materiali e della produzione (LM)
eafe2554d6a54b6bbc3c0af776a09977,Progettazione per comunità sostenibili,Global and Local Studies (LM)
31b2954e37b34e648dcd329bc40f90b7,Letteratura latina medievale I - LT,Studi storici e filologico-letterari (L2)
ff8c951ef53b403a8e8d9234cf63b9da,Fondamenti di elaborazione dei segnali,"Ingegneria Informatica, delle Comunicazioni ed Elettronica (L2)"
9a8849d608b54def843b2362aa367fe0,Elementi di geometria,Filosofia (L2)
af912a4119cb402fb499a8c85d157a0b,Stochastic Models,Biologia Quantitativa e Computazionale (LM)
b9830d1cbd41461b80efb6b29efbc0a1,Clinica dei disturbi cognitivi e comportamentali nelle malattie degenerative cerebrali,Psicologia (LM)
c799c6789510450f87388950cf909468,Analisi economico-finanziaria per le imprese turistiche,Management della sostenibilità e del turismo (LM)
47f4e7f9e10d4308b07aee94a8f178ec,International Economics (Basic),EUROPEAN AND INTERNATIONAL STUDIES - STUDI EUROPEI E INTERNAZIONALI (LM)
0af56c52c3b9497b925310ed04d70eb6,Fisica e modellistica dell'atmosfera,Ingegneria per l'ambiente e il territorio (LM)
470bd2c9855d475d9695974da5d973cc,Filologia romanza - LM,Filologia e critica letteraria (LM)
7ed8d4b62fc24ab5941b3bb8d1ee0c0c,Energie rinnovabili,Ingegneria per l'ambiente e il territorio (LM)
9ee2572a5cff430e952cd305c113341a,Quantitative Methods in Social Sciences (Advanced),EUROPEAN AND INTERNATIONAL STUDIES - STUDI EUROPEI E INTERNAZIONALI (LM)
7e986c60edc14dd48387987a1d5c2a42,Diritto comparato delle religioni,Giurisprudenza (LM5)
c3b897af98c04cba810ad777ff6f75bf,Data Governance,School of Innovation (CS)
f2422de8d08345d4bee7fd838978227b,Letteratura italiana II,Studi storici e filologico-letterari (L2)
dfd35dfc20394ae480ce690a90b6d683,Cognitive neuroscience of infant development,Cognitive Science - Scienze Cognitive (LM)
1e216d65f5f64444a40de576e68afa50,Economia pubblica,Economia e Management (L2)
0b879da9473d4b0e86f19fb63ec83998,"Definizioni, ruolo e potenzialità",Gestione di imprese sociali (G.I.S.) (M1)
2fad194f93b345409f1a545defad7324,Decision and Risk Analysis,Data Science (LM)
bfc2bc4a7d75450aa51fffe33996b726,Storia delle tradizioni religiose,Filosofia e linguaggi della modernità (LM)
455c65d389f04593b1ffcb5cc019e97c,Psicologia della memoria e dell'apprendimento,Scienze e Tecniche di Psicologia Cognitiva (L2)
b8ad8ea563bf4ed89e7236ed89aed3a4,Neuroscienze affettive e cliniche,Psicologia (LM)
5f8b7488d7ab4e2795a234cee5ead6bb,Storia del Cristianesimo e delle Chiese I,Studi storici e filologico-letterari (L2)
89c94d99117542bab4284116453c2e31,Bioinspired and functional materials,Materials and production Engineering - Ingegneria dei materiali e della produzione (LM)
8bbaa6ab88bf4bcc8140ce4a5689a5c6,Labour and Household Economics,Economia e Management (L2)
b14d92aa9010441cadb0dd6bcc90c221,Knowledge and Data Integration,Ingegneria dell'Informazione e delle Comunicazioni (LM)
d5a3df8fe8d14fecbc2a9210de12dc41,Plasticità e Apprendimento,Scienze e Tecniche di Psicologia Cognitiva (L2)
822da4786e5946328af79d68c4c1240f,Infrastrutture idrauliche urbane,Ingegneria per l'ambiente e il territorio (LM)
523356af220741abb6907b1e024f93ee,Storia europea e internazionale,Studi internazionali (L2)
b495df2315824f50a8431dabe110af3e,Imaging e localizzazione,Ingegneria dell'Informazione e delle Comunicazioni (LM)
089b6f6b12984df7b3569e2695179035,Filologia italiana I - LM,Filologia e critica letteraria (LM)
88f53e492d47459997d7f9782ef1128e,Storia della lingua italiana I - LT,Studi storici e filologico-letterari (L2)
f252fb0b8c754f0791a9f6862476862d,Geografia storica,Beni culturali (L2)
9efc57a6f5ad4c81b25d78102d0097a1,"Bioagrofarmaci, biofertilizzanti e tecniche innovative di gestione per una viticoltura sostenibile (eng)",Viticoltura ed Enologia (L2)
a96880c870964f20916a178ce746ec18,Psicologia dinamica,Scienze e Tecniche di Psicologia Cognitiva (L2)
6991b146761a4ff18e56e578520943c0,Quality and innovation engineering,Mechatronics Engineering (LM)
38170665fe9448de833baa2b85f9dcf3,Sociology of Law,Giurisprudenza (LM5)
b7e7a9617d484872b333cfad21acb946,Gene Therapy,BIOTECNOLOGIE CELLULARI E MOLECOLARI (LM)
be99c0e1250f4cf6ab47be3359a2874f,Idrologia,Ingegneria per l'ambiente e il territorio (L2)
68a37e81100c4fafa889c6376014eb43,Diritto privato,Gestione Aziendale (L2)
341499f19e1943adaec68e1f936e320a,Quantum theories for multiparticle systems,FISICA (LM)
1c62a9cc4e094b16abe2f932e00766b6,Cognizione animale,Scienze e Tecniche di Psicologia Cognitiva (L2)
6efc04431d384dcaa1de29688e900174,Ingegneria sanitaria,Ingegneria per l'ambiente e il territorio (L2)
e21013052ecc41f9827db335278f243b,Thesis seminar,Sociology and social research - Sociologia e ricerca sociale (LM)
1480cdfe65f34152ad275353a0ead70a,Business Sustainability Management,Innovation Management - Management dell'innovazione (LM)
3cf0a1c04b3d4001bba740804c3dc813,Functional and smart materials,Mechatronics Engineering (LM)
8805bd4ae0cb4e34b7727863f5e933ae,Storia dell'arte moderna IV,Studi storici e filologico-letterari (L2)
ac5b272a31c5485f8227235587104baf,Qualitative research methods,Global and Local Studies (LM)
0bd684521e1840a3ba884e82f3879b93,Genere e società,Sociologia (L2)
65aefb3342fc49f6bd6d53bad6f541c5,Human Computer Interaction,Informatica (L2)
4eb8abd3bf4542619a937d417f44c185,Behavioural Economics,Behavioural and Applied Economics - Economia Comportamentale e Applicata (LM)
a07bcb3629fe49eaabb55f6248713f9e,Hydropower and wind power systems,Ingegneria Energetica (LM)
f43ecc3f18d44f21864bdc753fa71fda,Machine learning,MATEMATICA (LM)
f82073333152425d979f4b375db83d0a,Financial Markets and Economic Activity,Behavioural and Applied Economics - Economia Comportamentale e Applicata (LM)
fa8f2d07593a4f968fd7e905fe510e60,Inglese giuridico B2,"Comparative, European and International Legal Studies (L2)"
84e8009eceaa4e34997dac74fd4d2db2,Global and transnational history,Global and Local Studies (LM)
7a42430959d747f9b635e5ff784c518b,Paleografia II,Studi storici e filologico-letterari (L2)
e48758fe98134f1ca57eccb53514e852,Coding Theory and Applications,MATEMATICA (LM)
de16d4fd3adf462384d663ce4944a562,Gnoseologia,Filosofia (L2)
45d4c9ec1d594467a4eddb389e37235c,Storia di una regione in Età moderna,Studi storici e filologico-letterari (L2)
a1a7a5083d4b4a918c6219d0aa62c81a,"Contabilità, bilancio e principi contabili",Gestione Aziendale (L2)
e80b27f2f04b4f47a7aca6e08524158e,International Trade and Globalisation,Amministrazione Aziendale e Diritto (L2)
74020941b78a48cca74b9b7348d6f7a0,Cultura e letteratura tedesca,Beni culturali (L2)
42df31afcb594b2b8d3383e8a2a8036c,Finanza aziendale progredito,Management (LM)
232691a421944cc58be34b7757340cb6,Mercati e intermediari finanziari progredito,MATEMATICA (LM)
567c9580eccd421dadf17d93003842d8,Quantum Machine Learning,INFORMATICA (LM)
1bd1ef89321645db80e0ea112eedafec,Interdisciplinary laboratory: Polymeric materials,Materials Engineering (LM)
343c0b18414a4a3c87ad1ef284492f46,Laboratorio di economia finanziaria_,Economia e Management (L2)
11d95bb5a7fb415c80461b9436e807ae,Sociologia delle relazioni internazionali,Sociologia (L2)
a8df84f65e6a4262ace3a72d90e59f85,International Tax Law,"Comparative, European and International Legal Studies (L2)"
d84f6b367c884c4dafd252a2f2f56174,Fondamenti di meccanica delle rocce e costruzioni in sotterraneo,Ingegneria Civile (LM)
12aad561973b49358866b6e2c2f72e19,Statistical models,Biologia Quantitativa e Computazionale (LM)
0f501b143dc944c0a6c1f80d02d3f526,Renewable Energy and Meteorology,FISICA (LM)
a4009f52283b409baff9afe0712599b7,Functions of the Peripheral Nervous System,BIOTECNOLOGIE CELLULARI E MOLECOLARI (LM)
e346fc5f64a147d1bff2bc728666b091,Sistemi giudiziari comparati,Giurisprudenza (LM5)
ed8e423e10154f7ebde3d2dd63a92c70,Interdisciplinary laboratory: Characterization techniques,Materials Engineering (LM)
26657c16236949458198264492b791d2,Istituzioni di diritto privato I,Giurisprudenza (LM5)
4a86ec41a0b3435b8882f1fd1414e60d,Neuropsicologia,Psicologia (LM)
75bc8d2db19f4772a00166735d555ed1,Mechanics and materials for engineering design,Materials and production Engineering - Ingegneria dei materiali e della produzione (LM)
c03316ce163748fa9bd0d5b320095a19,High Performance Computing for Data Science,INFORMATICA (LM)
0f9d5247a9274c7191f337895b3237d0,Istituzioni di diritto amministrativo e Legislazione ambientale,Ingegneria per l'ambiente e il territorio (L2)
f05e726db876407889ffc03d2d0848f5,Pensiero sistemico,Previsione Sociale (M2)
c75a4aa0c8414bc2b75979e493e1ae66,Devianza e controllo sociale,Servizio Sociale (L2)
8f0e395e49104c49af7dd69403af6f33,Networking,Informatica (L2)
dc666fbdb1804396892d68edc655def0,Diritto amministrativo,Amministrazione Aziendale e Diritto (L2)
090412570be844758b355654fc371b50,Fog and Cloud Computing,Ingegneria dell'Informazione e delle Comunicazioni (LM)
9168b61486844ba6a3833ae788ce29eb,Advanced Academic Writing,Finanza (LM)
3b997c715e11413eb5bef5ee9715ba4d,Advanced Commutative Algebra,MATEMATICA (LM)
b226ce8d613944d5867375e379674c06,Transnational Governance,Studi Sulla Sicurezza Internazionale (LM)
0a928855f03c418f92dfa829edd41fb6,Medical Imaging Diagnostic,Artificial Intelligence Systems (LM)
39c88a5ece094a30a5895e6ab5be87a1,Storia dell'arte moderna II,Beni culturali (L2)
5ada324b09314988b475dfde2820ee9b,Inglese giuridico C1,"Comparative, European and International Legal Studies (L2)"
11e16b556c94458a912174ab076287a5,Progettazione di sistemi elettronici,Ingegneria Industriale (L2)
fefa5da8198a44a1b8d3f7af6f2ea218,Sociologia economica e del lavoro,Studi internazionali (L2)
4925cddb5c144a93baf2ec8a37b40f59,Progettazione di impianti di trattamento delle acque,Ingegneria per l'ambiente e il territorio (LM)
0e33c7b74cbf45f0bfcca0a25ca21470,Global Markets and Security issues,Studi Sulla Sicurezza Internazionale (LM)
273462e13eb348dda5ea149e0edeb5e3,Scientific programming,Environmental Meteorology (LM)
199e5b2ac057478e897cf7aafb4bf175,Economia aziendale,Beni culturali (L2)
c9a03fdc2b484726af350e4c68c63312,Genomics,Biologia Quantitativa e Computazionale (LM)
17ba28aa41484ecea4e21c1fee5f5e50,Storia della critica d'arte I,Beni culturali (L2)
f3a20f16cb1147fcb26e456ff5d3c36b,Ethics for computer science and engineering,Ingegneria dell'Informazione e delle Comunicazioni (LM)
ade8e2f2d8f24eb28c0dfd7546408d4a,Informatica,Scienze e Tecnologie Biomolecolari (L2)
535e84d34ec2468ca38b79cf72ee9bdd,Distributed robot perception,Data Science (LM)
dc6982aef89c4ff682e2f436d3a5a6f3,Letterature comparate II,Studi storici e filologico-letterari (L2)
f58f460266a44d56b4f484b5e606ad10,Diritto tributario 2,Economia e legislazione d'impresa (LM)
7f605a4a170a4dbeb3e57534845aa796,Diritto pubblico,Amministrazione Aziendale e Diritto (L2)
d8cccacd9e1a4377a66d7502e60600c4,Storia moderna II,Filosofia (L2)
fcef7123545a4cd59f21dff348c177b9,Topografia,Ingegneria Civile (L2)
6c7cc1ed93a14bb38ace1f69fe469747,Economics_,Management (LM)
20d218dd99624be4b67f3c7dd9612dcc,Global Economic Scenarios_,Innovation Management - Management dell'innovazione (LM)
13bd6eec28424b17a333339a8924292d,Metodi di indagine in psicologia clinica,Psicologia (LM)
6fc05b3510a547998ed3a7d283716623,Thermodynamics of materials,Materials Engineering (LM)
ea5d2897b23e4ea39649c0d182e48f84,Geometria e algebra lineare,Informatica (L2)
b016e025c73c453d9476985916d99afb,Organizzazione del cantiere,Ingegneria Civile (LM)
aebea03f87f6436a98788a6b9553f312,Lifestyles and consumption practices,Sociology and social research - Sociologia e ricerca sociale (LM)
2d93979b1f754864abbf8560209186fa,Seminario: English for Academic Writing and Presentations,Sociologia (L2)
f2578a0bbb124404add48f15ead45d49,Epigenetics of Cancer,BIOTECNOLOGIE CELLULARI E MOLECOLARI (LM)
42fc118690c04170adc9a91ff74c7418,Preistoria e protostoria II,Beni culturali (L2)
7732c2932afd48c58fb9b10ae4e3ba25,Obbligo formativo aggiuntivo (OFA),Filosofia (L2)
3293cc8e7b724600877876eb33fce198,Matematica,Economia e Management (L2)
19023cbfc0024d9d8b2f2c4a89e68d0b,Psicologia del ciclo di vita,Psicologia (LM)
caf7b89c44ff42518366b74d6b780c30,Laboratory of Didactics of Mathematics,MATEMATICA (LM)
2eacd80a3f0648c8bb2e27d5e29b08b4,Research Design,Cognitive Science - Scienze Cognitive (LM)
a56ac0d958e94c27b752a29129957b13,Stochastic processes (I modulo),Biologia Quantitativa e Computazionale (LM)
5aa04c78cc4f4a6fb47b50a6468d6dfd,Epistemologia delle scienze sociali,Studi internazionali (L2)
66399b6177e64045941917e6b7d020f7,Medioevo teologico,Filosofia (L2)
b8bc5df3dfe14affba68b1781533f3ce,Seminario: Elementi di analisi dei sistemi energetici,Ingegneria per l'ambiente e il territorio (LM)
dcf81ae45119457fab79648fbf1100df,Mechatronic systems simulation,Mechatronics Engineering (LM)
38945b8f406f4514bdd915854f8610a4,Sociologia dello sviluppo internazionale,Studi internazionali (L2)
a5845b71c78a4b78a060f210d53843de,Bio-Medical Imaging,FISICA (LM)
656626bd21ce4fa6a11c397d2e7c7f9c,Economia dei sistemi agro-alimentari,Gestione Aziendale (L2)
dc219e9de4fd413aa2e8048294ae6ea7,Geometry and Linear Algebra,Informatica (L2)
6f35fcf2091b4ed4adbbc94fbd8e1949,Sicurezza aziendale e brand protection,Giurisprudenza (LM5)
cdce7bdf12b5451685468414b0405e40,Current Topics in Brain Connectivity,Cognitive Science - Scienze Cognitive (LM)
5ced18cdcfb443b29e6f6dce0bd34e90,Law and Ethics in Artificial Intelligence,Artificial Intelligence Systems (LM)
d2e8f410ef2448568adaca0519619b23,Progettazione di sistemi integrati per il recupero di materia da rifiuti urbani,Ingegneria per l'ambiente e il territorio (LM)
0269cba8ad5c4514a524382f3cf93dde,Ingegneria per lo sviluppo sostenibile internazionale. Metodi e progetto,Ingegneria per l'ambiente e il territorio (LM)
4adc0462567f4ee2b208389a732f537d,Filosofia della logica,Filosofia e linguaggi della modernità (LM)
baed872c78474aadacfb6d5ce4fe1825,Protection of materials and structures,Materials and production Engineering - Ingegneria dei materiali e della produzione (LM)
e3d95e055a174795a444416adf9be63d,Human-Machine Dialogue,Artificial Intelligence Systems (LM)
02339ac28760486a8f463b92c1ffa0ca,Theoretical biomechanics,MATEMATICA (LM)
828022a3691c49c683422f31c2f7ab4c,Elementi di meccanica,Ingegneria Industriale (L2)
5ca934a215384478bee28f5a9e679dd7,Understanding Megatrends,School of Innovation (CS)
3b8a2547ec0446d9b6a808bffb8aa1de,Research Methods in History,Sociology and social research - Sociologia e ricerca sociale (LM)
2a9c62b0559c4452aadbce0aeb6124ff,Seminario: Lime Survey per la raccolta dei dati,Sociologia (L2)
464f76ca09e74d679b0495d73559b7e7,Elementi psicologici e sociali del lavoro nei servizi sociali,"Metodologia, Organizzazione e Valutazione dei Servizi Sociali (LM)"
9ee4ce0e76274d1e95e4e46fd80cd5c2,Empathy and Innovation,School of Innovation (CS)
4806e41561154e67aa77b48ff05554d8,Second Language level B2 (German),Studi Sulla Sicurezza Internazionale (LM)
bc5763bd615e46a08acaae62b2cb20ac,Diritto commerciale,Amministrazione Aziendale e Diritto (L2)
fc086a6b75f74bca9575ccf8a434fdb1,Recognition systems,Ingegneria dell'Informazione e delle Comunicazioni (LM)
149cc81253454af28a957d9289d3f32a,Bioenergy,Ingegneria Energetica (LM)
9164abfce4c64e9d8ece792bafae0c4a,Comparative Legal Systems,"Comparative, European and International Legal Studies (L2)"
a17e5cd5756947849c09382c49abe65e,Embodied cognition in theory and practice,Scienze e Tecniche di Psicologia Cognitiva (L2)
7c6c135a0dab4054810f1f911faedb52,Impianti industriali,Ingegneria Industriale (L2)
a25d9c80b66b43c4b417b912506d17bd,Funzioni esecutive e apprendimenti: sistemi di misura e training,Psicologia (LM)
483f16c333014838bfd5d9016cfa3679,Decision and risk analysis,Management and Industrial Systems Engineering (LM)
9c82ec81a76a45f3b608b37243bcfa7f,Project management,Management and Industrial Systems Engineering (LM)
f5ae942e3c4a466a89e43dd04c8994e7,Major issues in international politics,Studi internazionali (L2)
bceaf7059ab64f99a6643e6dda1d2dae,Economia della cultura e del turismo e marketing della cultura e del turismo,"Mediazione linguistica, turismo e culture (LM)"
b699d40797344e40b8e131dd314edb4b,Filosofia della religione,Filosofia (L2)
068aa8c671d54eeba8b9de38e7bb45ae,Matematica finanziaria,Gestione Aziendale (L2)
fa79d73998ab4bb988aec832c186f7b9,"Lavoro, diversità e benessere organizzativo",Gestione delle diversità: inclusione ed equità (GEDIE) (M1)
3350ca1d48f149a789cd4f6fa3d57502,The role of international organizations in promoting peace and security,Studi Sulla Sicurezza Internazionale (LM)
12f6a77fa6ef408ca9dc630c7c77d7a1,Diritto dell'era digitale,Giurisprudenza (LM5)
ddd01641324f41cdb844bb597d4ffce2,Molecular and Cellular Biophysics,FISICA (LM)
146141fbfa1c47afbb5f159d1085208e,Evaluating public engagement with science and technology,Communication of Science and Innovation - SCICOMM (M1)
144908724f8a43d5947f0e89181deeed,Biostatistics,Biologia Quantitativa e Computazionale (LM)
5d9967af6c494b9dbe8f1700806f353e,"Organizations, human resources and innovation",Management and Industrial Systems Engineering (LM)
3707c9f3a2f34c268dc44fa42a18bee2,Distributed systems 1,INFORMATICA (LM)
609cb9fd93664ce98338c373bbeb8d84,Struttura della materia,Fisica (L2)
ae9c3f61db3f471985c95cad13e89736,Riabilitazione neurocognitiva,Psicologia (LM)
1704dd5e09d64d8cb292df7687d81823,Politica comparata,Studi internazionali (L2)
e71d278193f7418abde0722f814d0dcb,Bio-Inspired Artificial Intelligence,Artificial Intelligence Systems (LM)
7c670183509a4e8893473b4b9e6bb1c0,Casi ed esperienze di gestione delle imprese turistiche,Gestione Aziendale (L2)
4bea6e741b054c909ab1dd49f6228129,Calcolo delle variazioni,Matematica (L2)
ac50731b61fb481bbfb17a28fffadf5c,Winter School part I - Advanced numerical methods for free-surface hydrodynamics,"Ingegneria civile, ambientale e meccanica (D1)"
f2ff0936c6ad4237b3cd15ea99fe5eb1,Biologia generale e molecolare,Medicina e Chirurgia (LM6)
c2dae93f007d4c4f87edb6552249acc3,Introduction to Computer and Network Security,Ingegneria dell'Informazione e delle Comunicazioni (LM)
bb6b5c9b1698477295d8d5ce27cf8702,Laboratory of Computer Science Education,MATEMATICA (LM)
03c0aba8dee44a31aba4912acc8d6f66,Laboratorio di interfacce linguistiche,Interfacce e Tecnologie della Comunicazione (L2)
9564f75ccd1f456ebeb2a14ac48e9b56,Principles of biomaterials and medical device design,Materials and production Engineering - Ingegneria dei materiali e della produzione (LM)
ac0f2bb0737c4aaba221e7b4003a784b,Diritto pubblico europeo,Studi internazionali (L2)
4f9b2e0a82b34cd0ad9e093ab094d896,Crash course - Introduction to Quantitative Methods,Innovation Management - Management dell'innovazione (LM)
2c02f40a8e324a72ba9a809f38f7e004,Diritto tributario,Giurisprudenza (LM5)
fd2123a3786d4c7c94266a4ea121fc20,Laboratorio di fisica II (mod.B),Fisica (L2)
b68575e6dc4d4402af2c79b32d405f01,Advanced Formula SAE,Materials and production Engineering - Ingegneria dei materiali e della produzione (LM)
fecf8232a93540298f86dca4dc152849,Storia moderna I,Studi storici e filologico-letterari (L2)
cb7edbbfed0543d8bb960e77e9568f6c,Archeologia e storia dell'arte romana,Beni culturali (L2)
18c9d9f46afa49efb1153d33cb3b1c67,General Relativity and Cosmology,FISICA (LM)
3b863256d87144b6a82064bdc77f2563,"Etica, università e comunità",Giurisprudenza (LM5)
e975a1642d5c408eb989266bbafdc4f9,Geografia e progettazione strategica degli spazi turistici,"Mediazione linguistica, turismo e culture (LM)"
58db9df53e594040979ce0957771acdb,Relazioni internazionali e diritti umani,Studi internazionali (L2)
e5bf6580b5a748e195b4e641dc582517,Bibliografia e biblioteconomia I,Beni culturali (L2)
6aa694faf26b4cba907480fa2cc52d31,Technical English,Ingegneria dell'Informazione e delle Comunicazioni (LM)
8a5b11c6656045bdb2a23910edc18e02,Diritto commerciale,Economia e Management (L2)
66b05cdad22f43819b7ea444cc922342,Visual brain and design,INFORMATICA (LM)
35977e7b82c543e08e745612a079b71e,Turbulence in environmental flows,Ingegneria per l'ambiente e il territorio (LM)
bfcbba4bfa3b47a58160eb5f24b9e3b4,Neurogenesis and Brain Regeneration,BIOTECNOLOGIE CELLULARI E MOLECOLARI (LM)
0415f8a8812d44a681b8558da59ead20,Scientific computing,MATEMATICA (LM)
2695f080d8d44063bde14a939dab25dc,Metodi per la rilevazione e l'analisi delle preferenze/scelte dei consumatori,Management della sostenibilità e del turismo (LM)
6f19393cf0a64cd9a3af785b2ff005cf,German Language Workshop,EUROPEAN AND INTERNATIONAL STUDIES - STUDI EUROPEI E INTERNAZIONALI (LM)
54c8bc16561d404fa48cf0072b2c368f,Storia greca I - LM,Scienze storiche (LM)
c3e26bf610e64ccfaabf84127c398c99,Machine Learning for NLP,Cognitive Science - Scienze Cognitive (LM)
8b9272bafc1f444f8db7c1740381ce0b,Privacy and Intellectual Property Rights,INFORMATICA (LM)
91b3c47f993f418d8eb83a765a72b0b0,Environmental physical chemistry,Environmental Meteorology (LM)
a95c3f4f3b914c5dba180dca457339e4,Neurophysiology of language,Psicologia (LM)
005d1d57e9a44b7b900662094f6e9293,Distributed robot perception,INFORMATICA (LM)
7eb412a380ac42b094766b32936b542d,Politica dei servizi sociali,"Metodologia, Organizzazione e Valutazione dei Servizi Sociali (LM)"
c58ea9d1d7da44a4b2b49b8a28ea6a03,Corso di tedesco B1b - I periodo (estensivo),Centro Linguistico d'Ateneo (CLA)
2419e0f40aa441128f39c5673d3582e9,Sistemi informativi,Informatica (L2)
7b6fef0eaaa74b0a99fbc19c3fa354ca,Misurazione e rendicontazione sociale e ambientale,Management della sostenibilità e del turismo (LM)
fd429e8de09d4095bb6cb461d107bae8,Machine learning,Biologia Quantitativa e Computazionale (LM)
12ad1f0e7f0b44ffb863fdbcd18cd442,Computer vision,Artificial Intelligence Systems (LM)
b99e871b997747a3a3714f0633a9ad78,Introductory nonlinear mechanics of soft biological tissues,"Ingegneria civile, ambientale e meccanica (D1)"
fc5ba92b14394d17b4e74f841f70fc1e,Corso di Presentations - I periodo (intensivo),Centro Linguistico d'Ateneo (CLA)
014d962be1b440379955becefca4c064,Programmazione e controllo,Amministrazione Aziendale e Diritto (L2)
bd282f3c26224f5b91b4c8c87fbe1cb7,Mechanics and materials for engineering design,Materials Engineering (LM)
b1455322207e4d55a13f57b14bf29f2c,Storia contemporanea I,Beni culturali (L2)
66ca2907bb4b44aca08fc6dd068b6cfa,Disegno industriale,Ingegneria Industriale (L2)
6e397e95b8094ea1acb98cbda1319d4c,Sistema di gestione e certificazione per la qualità e l'ambiente,Management della sostenibilità e del turismo (LM)
99f6ee9d49a84c5696d309aa0d482004,Pensiero ebraico I,Filosofia e linguaggi della modernità (LM)
26f18c9b784646bab77fb7c94258a413,Algoritmi e strutture dati,Matematica (L2)
a44b896cd840459d8994709b0067d4e5,Economia e gestione aziendale,Viticoltura ed Enologia (L2)
0911fe7be9e94d4e90c96b3725ada69c,Databases,Informatica (L2)
6f74310d316045e8bde94e761fee7777,Sviluppo e istituzioni: analisi comparata,Studi internazionali (L2)
9a31709d69434be3a27b487447da1bbd,Agiografia - LM,Filologia e critica letteraria (LM)
493dcbfe58914a57b3823b6893a19bd8,International accounting,Management (LM)
ce96a7dad7ab426992dd1e9123d7901b,Introduction to Economics,Economia e Management (L2)
280dbc30d62c476cbcf36784bfe1949a,Sensing and Radar Technologies,Mechatronics Engineering (LM)
