id_course,articulation,title
600b150882de4cc8a717bca8a611a40c,Seminar: Advanced English for Global and Local Studies,Global and Local Studies (LM)
e93766fbd7d84acf8188c34b50f86a2d,Sociology of collective action,Sociology and social research - Sociologia e ricerca sociale (LM)
40ad738f9c7c421291feb69f914dad3f,Gestione integrata delle risorse idriche,Ingegneria per l'ambiente e il territorio (LM)
4f6edf5820fe40e9b7e6ec7fadb9db80,Matematica finanziaria,Matematica (L2)
b550875a10c3482c881d539893ebe2ff,Neurologia clinica,Psicologia (LM)
d616effbbaf7496296b28e149309b678,Economia sociale e organizzazioni del terzo settore,Management (LM)
bb52b9bd7e3c40519254cf3cfa0961f2,Storia medievale II,Studi storici e filologico-letterari (L2)
4f64e2a1be8f42778fab1e012f08304b,Analisi matematica 2,Ingegneria Civile (L2)
19b832ee6bda461ab4717e6b68ab223b,Laboratory of biological data mining,Data Science (LM)
5a92ef1b22c5447a9d42dca6e6704b44,Sociologia della religione,Studi internazionali (L2)
0bed0256c5ac4c81a6117c17566cf32c,Sociologia dello sviluppo internazionale,Sociologia (L2)
9ef193969a7343eabc68501fa69a2edb,Lingua e cultura cinese II,"Mediazione linguistica, turismo e culture (LM)"
4c241086a13d4b13ae8ba77600b0297a,GPU computing,Artificial Intelligence Systems (LM)
32e62dcb7dee441288641dadbed9509b,Analisi matematica 2,"Ingegneria Informatica, delle Comunicazioni ed Elettronica (L2)"
bf9b004be2f54d24896cb266b178da77,Sociologia delle relazioni internazionali,Studi internazionali (L2)
2181d3efb49140baa20d9a8bff69c7ad,Neuroscienze cognitive,Psicologia (LM)
a95003148c0545fca2d0e4082e9180a7,Advanced European Studies,EUROPEAN AND INTERNATIONAL STUDIES - STUDI EUROPEI E INTERNAZIONALI (LM)
1ed591edd4884c858ddca59bb13c4106,Etnicity and diversity,Global and Local Studies (LM)
72d48ef2c2b647a3ab8d1850001a4197,Introduction to Computer Programming (Matlab),Cognitive Science - Scienze Cognitive (LM)
f094dbb108ea4c9dbae245e2ee42dba5,Research methodology - qualitative,Human-Computer Interaction - Interazione Persona-Macchina (LM)
4b71dded6c59489cb9a1d4552909f44d,Invertebrate Neuroscience,Cognitive Science - Scienze Cognitive (LM)
1d419c3562924165b19ff156566b8991,Interdisciplinary laboratory: Ceramic materials,Materials and production Engineering - Ingegneria dei materiali e della produzione (LM)
9a7cfc71bc96421091fecfbefec1c08e,Processi di trasporto nell'ambiente,Ingegneria per l'ambiente e il territorio (LM)
b9483250b2a44df5aab063136d43a769,Breathe and innovate,School of Innovation (CS)
b1bdc6bc59cf4c3e930b630588a10f2c,Valutazione delle politiche contro la criminalità (corso libero),Giurisprudenza (LM5)
ccd56f53826a421da600b5a3a9617256,Storia del cristianesimo e delle chiese,Studi storici e filologico-letterari (L2)
ed1d1dc726964a2fa53bd7583526edda,Process engineering for environmental protection,Ingegneria Energetica (LM)
5b380182931940b48e721b1a5aa303dd,Stochastic differential equations,MATEMATICA (LM)
2385089642aa4811a32498e69464e966,Crash course - Introduction to Quantitative Methods,Behavioural and Applied Economics - Economia Comportamentale e Applicata (LM)
45eafc7eef0e425782cae6319d162e2b,Laboratorio di futuro,Previsione Sociale (M2)
0badd0bbbe824622b019b1d5511c7912,Diritto amministrativo dell'Unione Europea,Giurisprudenza (LM5)
90c74a5bb1ef487a9f8687fbbc1bc920,Storia del diritto internazionale e delle dottrine internazionalistiche,Giurisprudenza (LM5)
7d013babc9e74662aac8ecf950950b1d,Improvement in Crop Production,Agrifood Innovation Management (LM)
a14daadd9afc4a88ac74368875cbf310,Competenze informatiche,Sociologia (L2)
f69a75a4b6c9466f9fe1de40e1ae0386,Numerical methods for PDEs,MATEMATICA (LM)
e8074a0ee94446cbbf53836affffee52,Gestione delle risorse umane,Filosofia e linguaggi della modernità (LM)
30673fc0071f4666804a5a14bd9364bb,Psicologia del pensiero,Scienze e Tecniche di Psicologia Cognitiva (L2)
b8868f3cd9d94139a6abfad8507164ad,Knowledge and Data Integration,Data Science (LM)
967a0e69fc424bf5bf25cbf8472fe552,Biologia degli organismi,Scienze e Tecnologie Biomolecolari (L2)
4aa12d7528d64655bf63ce11075a9e35,Storia della filosofia antica,Studi storici e filologico-letterari (L2)
888e8632592b4050a65dd8f2c2fff226,Advanced Hands on M/EEG Analysis,Cognitive Science - Scienze Cognitive (LM)
61b6597ab0b34da183f97df0118963d4,Psicologia clinica,Scienze e Tecniche di Psicologia Cognitiva (L2)
da0db4657d0c4541bda5744aefa083c9,Diritto penale internazionale,Giurisprudenza (LM5)
8c5ea8a3bfcd4c50b4340552f6810b33,Distributed robot perception,Management and Industrial Systems Engineering (LM)
fba5f770cb254cb59773dd9f07d4ea7f,Introduction to Chinese Law,"Comparative, European and International Legal Studies (L2)"
882f6e2eae2f4b0db1974696795c4117,Storia contemporanea I,Studi storici e filologico-letterari (L2)
89edb1a534714094bdead24ca2830827,Neurolinguistics,Cognitive Science - Scienze Cognitive (LM)
2d4b4fcdf3834b53a6427bf9e71c9dc1,Filologia italiana II,Studi storici e filologico-letterari (L2)
cb7fc75262054ccab07846ad7b375887,Lifestyles and consumption practices,Global and Local Studies (LM)
f483f05d22db470ab3909a35be0487fa,Storia d'Europa,Studi storici e filologico-letterari (L2)
51c0a440b85b4604bede013de9946b4b,Laboratory of Advanced Electronics,FISICA (LM)
f8457b28dd764b73abb52e05002ab1a4,Tecnica urbanistica con Laboratorio Progettuale,Ingegneria Edile-Architettura (LM5)
a4dbf61b968e4de585c851fe3f07b4b1,Fundamental Hands on Functional Neuroimaging Analysis,Data Science (LM)
96d6afd288bf425aab0f313943356d7a,Letteratura greca,Filologia e critica letteraria (LM)
3662649df6bd405e85031d88251ed909,Personal branding,School of Innovation (CS)
75955167efb24e47816bda46e23725a4,Low-power wireless networking for the Internet of Things,Ingegneria dell'Informazione e delle Comunicazioni (LM)
271b46e694fe46cc85a5115443d69c64,Mechanical design for mechatronics,Mechatronics Engineering (LM)
ea8efda766714d338eafb97610b39731,Experimental Physics Laboratory at High School Level I,MATEMATICA (LM)
86dae9459af64e9291dc2e9af1b1ed4a,Electrochemical energy storage and Conversion,Ingegneria Energetica (LM)
f79571bf4e1d46f19ee4babc2d95fc19,Computability and computational complexity,INFORMATICA (LM)
5df59be5e5664bb7a5e90f4fdfd1f14b,Sistemi cyber-fisici wireless per radar e comunicazioni mobili,"Ingegneria Informatica, delle Comunicazioni ed Elettronica (L2)"
4554feb55b224a56858170dc58b251f5,Web architectures,INFORMATICA (LM)
2eb25c6a2b864cd1aaa80fd29b3d580b,Multisensory interactive systems,INFORMATICA (LM)
a5afae08af5f48c184d5a6e0dc082753,Tecnologia e chimica applicata con elementi di chimica,Ingegneria Edile-Architettura (LM5)
2101b527f7d94bd08db701fe651594aa,Metodologia della valutazione per i servizi sociali,"Metodologia, Organizzazione e Valutazione dei Servizi Sociali (LM)"
901126f78f5844a88368f40d454ae49f,Diritto amministrativo dell'Unione Europea,Economia e Management (L2)
25915bdf96434f2a862fbbe5f254a91b,Laboratorio di ricerca su sistemi informativi,"Organizzazione,società e tecnologia (LM)"
92568e9d3ca54277b729e004b5cad2bc,Laboratorio di pianificazione finanziaria,Gestione Aziendale (L2)
4428058d3c1c46ada7366723c1d37ce3,Automated Reasoning,Artificial Intelligence Systems (LM)
56597644fc6142069866a9a5d8fce8fe,Corso di italiano A1a - I periodo (intensivo),Centro Linguistico d'Ateneo (CLA)
1813f8c362fb48ada332c7cb913e802e,Progettazione e prototipazione di sistemi elettronici,"Ingegneria Informatica, delle Comunicazioni ed Elettronica (L2)"
c01ac080d4144d95b51ccba38ee498ad,Project management,Materials Engineering (LM)
b240e5a0198c4a4d9b77204cf88a5f7c,Consumer Behavior and Analytics,Innovation Management - Management dell'innovazione (LM)
457afd1f11d54818a5e549669ee3dc29,Storia romana I - LM,Filologia e critica letteraria (LM)
5c86cb09180242d4bcbc5485654bfe4c,Francese giuridico B2,Giurisprudenza (LM5)
40ffa19d84544a918122e3423c5dc403,Intelligent vehicles and autonomous driving,Mechatronics Engineering (LM)
cccca061c05242a29045430c525fa159,Psicologia della memoria e dell'apprendimento,Interfacce e Tecnologie della Comunicazione (L2)
1f68027d1f64490db84f5f3591d70bf2,Economia politica e aziendale,Lingue moderne (L2)
117a08227b9047609fbaa8da3d858dd9,Fisica,Informatica (L2)
3c5fec89bf2845a5a870f2cc3761d858,Storia del teatro greco,"Letterature euroamericane, traduzione e critica letteraria (LM)"
f08e4def3b784088b1713f275aea1192,Controllo di gestione progredito,Management (LM)
687e46293b144c9285acac92efae1b99,Finite elements modeling,Materials and production Engineering - Ingegneria dei materiali e della produzione (LM)
819d0e53fef04dd4936e14a47d20db18,Storia del diritto romano,Giurisprudenza (LM5)
8c9363a2525e4b5aa2d64f13276e10b1,Introduction to Robotics,Artificial Intelligence Systems (LM)
2a195499703c40d28e081918fe5379fe,Procedura penale,Giurisprudenza (LM5)
4f5a783c4769494ea98529d96dbc2631,Interdisciplinary laboratory: Advanced metals,Materials Engineering (LM)
7c76d968181446b9b3c910d366f8711e,English for International Communication,EUROPEAN AND INTERNATIONAL STUDIES - STUDI EUROPEI E INTERNAZIONALI (LM)
03b038f383254778a27299fb97adfb22,Algoritmi e strutture dati,Informatica (L2)
3ad10e90d770453fab299f52b8469f42,Filosofia dell'educazione,Filosofia e linguaggi della modernità (LM)
116903d139724e2a928cfc364220faaa,Geologia,Matematica (L2)
4f7751ae2ba3457a838da30c44f7aa66,Structural reliability and uncertainty quantification methods,Ingegneria Civile (LM)
27a22de72f0f48f98ea5b715c53c81d5,Diritto penale dell'informatica,Giurisprudenza (LM5)
c70ae6e355694e6eba2b1a802c1e6ed7,Metodologia della scienza giuridica,Giurisprudenza (LM5)
16372a5472524bb7881c1120235ec75a,Servizio sociale in pratica,Servizio Sociale (L2)
2631b4327e764f5789471a4be90805ca,Economia delle amministrazioni pubbliche (Management pubblico),Amministrazione Aziendale e Diritto (L2)
c1789732d3c34c4480d4639850d210c0,Innovation and Entrepreneurship Studies in ICT,INFORMATICA (LM)
3c8b8cc5996049c6a73c3a3f18b3ef58,Stabilità dei pendii naturali e delle costruzioni in terra,Ingegneria per l'ambiente e il territorio (LM)
683fb9edd56a43fa960285283c6e7ea0,Research Project,Ingegneria dell'Informazione e delle Comunicazioni (LM)
5ade45e2c6494da4a1e602900026b362,Metodi di Machine Learning in Neuroscienze Cliniche,Medicina e Chirurgia (LM6)
868864561c434df59477517a15ce0dcc,HPC summerschool,"Ingegneria civile, ambientale e meccanica (D1)"
20ed1dc1bbf44f218c3a8d9defbaf07c,Quantum field theory II,FISICA (LM)
6610f39371f74fc3a359bacb421596c8,Storia contemporanea II,Lingue moderne (L2)
40bfa9b4057e4db49e3f3801b7513f94,Storia della filosofia moderna e contemporanea,Filosofia e linguaggi della modernità (LM)
7fe4a186ba334b22a8be9f6bf461db00,Didattica dell'italiano L2/LS,"Letterature euroamericane, traduzione e critica letteraria (LM)"
8f85f87171444d0db031635c68845642,Open Innovation Modelling and R&D_,Innovation Management - Management dell'innovazione (LM)
eb50c5777571471d84ebbb6693ddb643,Test di matematica,Economia e Management (L2)
8b8ed8d1ec554d31b9148f8debdbf23b,Mathematical Biology,Data Science (LM)
7de011e2f299432b8d3cbadadbff2853,Regression and Classification Models,Biologia Quantitativa e Computazionale (LM)
ef6d139cd9504cef9109e61227003a74,Workshop on Financial simulation,Finanza (LM)
4c5e688ebb814b328a4b0510ca95e316,Matematica finanziaria,Economia e Management (L2)
eb8794ec9e114f28801e6c52f9805d56,International and European Union Law (Basic),EUROPEAN AND INTERNATIONAL STUDIES - STUDI EUROPEI E INTERNAZIONALI (LM)
299a109140204e078475dac495a4eaff,Global Economic Scenarios_,International Management - Management Internazionale (LM)
30351b4f2c684ae0845ce98b033ed0c6,Comparative Private Law,"Comparative, European and International Legal Studies (L2)"
c562dab08de64e3f9935c31ad3a4bd5f,Security and the Environment,Studi Sulla Sicurezza Internazionale (LM)
9dbd291c3c2d4f25bed6262e2cb58295,Lingua e traduzione tedesca e letteratura tedesca II,"Letterature euroamericane, traduzione e critica letteraria (LM)"
f804661f8a204d45bb7e831fa3ee637c,Elementi di archivistica II,Studi storici e filologico-letterari (L2)
1398c33c9109416d817c94557913e1c6,Bacterial Pathogenesis,BIOTECNOLOGIE CELLULARI E MOLECOLARI (LM)
00e3483a6e0146849b801bfe7bbb4d89,Psicologia del linguaggio e della comunicazione,Scienze e Tecniche di Psicologia Cognitiva (L2)
b91f9c13f2f74468bceaf1bf4c6e2018,Microeconomia,Informatica (L2)
1e7a0dbf33364a7e99e00f93800ae0bf,Geotecnica,Ingegneria per l'ambiente e il territorio (L2)
2d7b075a2808438f8693e79b5ad3a418,Formal methods,INFORMATICA (LM)
1b5ff1d492694bd89c8cf5c7352cd069,"Diversità, inclusione, equità: prospettive socio-psicologiche",Gestione delle diversità: inclusione ed equità (GEDIE) (M1)
d8355f9b58344e9ea9a6a9cc15d62c66,Functions of the Peripheral Nervous System,BIOTECNOLOGIE CELLULARI E MOLECOLARI (LM)
a2befe06a74f41978fc4a5e2b554a672,Services Marketing_,Innovation Management - Management dell'innovazione (LM)
482d16b3aad344baa0f0464ffcd953ea,Advanced Data Analysis,Biologia Quantitativa e Computazionale (LM)
ad37435f40ae4e5cb1832530c641d97e,Advanced social network analysis,Sociology and social research - Sociologia e ricerca sociale (LM)
c02580748f314fa985e6bf77e36e7ee2,Business Development Laboratory,Ingegneria dell'Informazione e delle Comunicazioni (LM)
3805883b54e94793a9446e22b2e0f3eb,Letteratura italiana,Lingue moderne (L2)
cd914c1604aa437583ba6c4f5e5b06fc,Design methods for industrial engineering,Mechatronics Engineering (LM)
1b0c0e8710a34db1bac5d4f75e27b2ba,Obbligo formativo aggiuntivo (OFA),Lingue moderne (L2)
7cfbee385443492187f8881ee6ffdd2f,Algebraic geometry I,MATEMATICA (LM)
617acc84464c45d493c79dbb1ed76a79,Storia dell'architettura moderna con Laboratorio,Ingegneria Edile-Architettura (LM5)
756d37739cb74bd5b655ef6513d0a1ee,Storia della musica II - LM,"Letterature euroamericane, traduzione e critica letteraria (LM)"
d8e84ac59de3408f8d2a4a345e0d25ae,Produzione e logistica progredito,Management (LM)
05dbb1ccc0e7475588010b45bc351a95,Formal Techniques for Cryptographic Protocol Analysis,MATEMATICA (LM)
9de8d36547c64c2fb1835f12df512a4b,Topics in History of Mathematics,MATEMATICA (LM)
9b4d2d8f35bf4c27b9e764af04f1db67,Diritto ecclesiastico comparato,Giurisprudenza (LM5)
d8ac1420cd104bb7ae71da1b8f7e527e,Durabilità dei materiali da costruzione,Ingegneria Civile (L2)
6f272b9fd9f94ba9a35e74bd07ee7981,Letteratura portoghese II,"Letterature euroamericane, traduzione e critica letteraria (LM)"
62ed4df062d148d2a198fc8dee8655c2,Introduzione all'ingegneria ambientale,Ingegneria per l'ambiente e il territorio (L2)
7fcda8d2e36e42248e1e6782b3ab64d9,Filologia romanza I,Lingue moderne (L2)
07fb1a925eba41e8922efe6265f2936b,Computer Programming 2,Informatica (L2)
0d343b8bb19b4eddb3c768ea90ba598e,Letterature comparate II - LM,Filologia e critica letteraria (LM)
f5d93aba7570412b84a9a147388d5b86,Studi di genere,Filosofia e linguaggi della modernità (LM)
0b4bca809d864538b13ff93ed551e545,Trasmissione e codifica di segnali digitali,"Ingegneria Informatica, delle Comunicazioni ed Elettronica (L2)"
9c0e25bc574145cbadd99288b489de45,Informatica ed elementi di programmazione II,Interfacce e Tecnologie della Comunicazione (L2)
de167cba4bc7415296af660169e35f3e,Disegno Civile + CAD,Ingegneria Civile (L2)
16232425bce74b9980b58c54ae36f6ba,Cognizione e comunicazione sociale,Interfacce e Tecnologie della Comunicazione (L2)
577150049545490b8d12cc3430e58b81,Laboratorio di analisi dei mercati,Gestione Aziendale (L2)
0192457055b24c349cd1275bb06e58f7,Condensed Matter Theory,FISICA (LM)
ee2b147192284025b3725f8548ab4e8e,Genomics Technologies,BIOTECNOLOGIE CELLULARI E MOLECOLARI (LM)
3179b4d82d8e4e5095c07ef4eaef7fb7,Strategie d'impresa_,Economia e Management (L2)
e2249e546fba48fd97fbd4298084b05d,Pitch Yourself,School of Innovation (CS)
10f9eb270d714c2f858504afc079a0a5,Geometria I,Fisica (L2)
47ab21e9cd3c4aeba48d00db266ba467,Programming,Biologia Quantitativa e Computazionale (LM)
f157d461c9334af2bc1ac2c46a017fd9,Storia del pensiero sociologico,Sociologia (L2)
82009c3bef6b4e3bae040e908fadd448,"Sistemi di gestione integrati per la qualità, la sicurezza e l'ambiente",Ingegneria per l'ambiente e il territorio (L2)
a2f7945078e443b5b9c9b99213621fa8,Protezione idraulica dei territori montani,Ingegneria per l'ambiente e il territorio (LM)
d448420aa10648deb2744da91f54230e,Storia moderna I,Beni culturali (L2)
d56d7978a36941beb5d7de886b02e777,Previsione Sociale,Previsione Sociale (M2)
77aaf182a4d64fe9b51e0c33f273b8dc,Statistics of Stochastic Processes,MATEMATICA (LM)
0c5885c17fe649eb957796615be6cb87,Eco-sustainable methods for the prevention and management of invasive alien species,Agrifood Innovation Management (LM)
e60e98bb84eb4bda802309c2bb72d4dc,Laboratorio di tecnologie delle materie plastiche,Ingegneria Industriale (L2)
f6ee38db2346442a99ba3e7d6cdc10d5,Letterature comparate LM,Filologia e critica letteraria (LM)
4376c2b990344a8aa658d5496cb22a05,Basic of Data Science,School of Innovation (CS)
f79eb22e10b043ac91c52c99e3639f33,Data mining and statistical learning,Behavioural and Applied Economics - Economia Comportamentale e Applicata (LM)
6cc4b8b13c4346b58695f52179395102,"Signal, Image and Video",Ingegneria dell'Informazione e delle Comunicazioni (LM)
6ee2e4c3060d42f1a0ca2164e03f4dbf,Storia della scienza e della tecnica,"Organizzazione,società e tecnologia (LM)"
d0378e407bc64ce1a81da558330a421c,Crash course - Economics,Behavioural and Applied Economics - Economia Comportamentale e Applicata (LM)
31076c628fff4e9c9b8996f7469f87f0,Controllo e monitoraggio delle strutture civili,Ingegneria Edile-Architettura (LM5)
b921e740d6cd499b95c7297082f04648,Multisensory interactive systems,Ingegneria dell'Informazione e delle Comunicazioni (LM)
c895ffcc16e5430a9ffc67b218de1124,Formal Verification,Artificial Intelligence Systems (LM)
c2ab9d6096cf42d69b86ce162070b128,Managing innovation Lab,Innovation Management - Management dell'innovazione (LM)
bf79cff3f1704b15b8c571b6fec8dd17,Progettazione di sistemi integrati per il recupero di materia da rifiuti urbani,Ingegneria per l'ambiente e il territorio (LM)
0c78c9d5f7494c9ca42ce47cc17e9e8a,Biologia cellulare,Informatica (L2)
a23b1c88d1d848f781d29616a55291a9,Principles of biomaterials and medical device design,Materials Engineering (LM)
5733ddd24dfb41afa83f50b752b66a68,Laboratory Life,Communication of Science and Innovation - SCICOMM (M1)
2ecf010f398749e9a6d34a58b87a5f73,Letteratura greca - LT,Beni culturali (L2)
18a1eb198b4947f0b756b25a2b298f39,Chimica Organica,Viticoltura ed Enologia (L2)
c75ca70fa3b9409495b01555ac522fe9,Diritto commerciale progredito,Management (LM)
65f3b1d342334725b61888113a81643c,Progettazione di infrastrutture idrauliche urbane,Ingegneria per l'ambiente e il territorio (LM)
c0908feb2d6248b69e63e9ce2ed3702b,Strategic Studies,EUROPEAN AND INTERNATIONAL STUDIES - STUDI EUROPEI E INTERNAZIONALI (LM)
b4550c80575743a08afce913e83200fb,Diritto delle migrazioni,Giurisprudenza (LM5)
b347c17eb0bf4fd5aa17dae16208cbab,Diritto delle istituzioni internazionali,Giurisprudenza (LM5)
ff064a792d414317a2e282cab455953b,Fisica 2,Ingegneria per l'ambiente e il territorio (L2)
a41fe8e062be462a9cce2a065db18e5c,Secondo Tirocinio,Servizio Sociale (L2)
f720c7dfb5ca44a895851038c0c9fcdf,Sensors and micro electro-mechanical systems,Mechatronics Engineering (LM)
47b7ad3cbba84465bb257a0628e661e2,Sicurezza formazione generale,Economia e Management (L2)
a6f1ea835af1487f85373479f710bfee,Electronic materials and technologies,Materials and production Engineering - Ingegneria dei materiali e della produzione (LM)
5fb471046c114b379802777eeb5eddcf,Laboratorio didattico di fisica,Ingegneria Industriale (L2)
f077ec62d2cd4b64a48844a6dbe87ec8,Sistema politico europeo,Studi internazionali (L2)
2ac75f08b74c426ba24f2c02b4dc5178,Automatic control,INFORMATICA (LM)
9a7c3d1d77414b22bc69ddd676344328,"Contabilità, bilancio e principi contabili",Economia e Management (L2)
20a99b10e80c41b5a0e02faab7a5620b,Storia medievale II - LM,Scienze storiche (LM)
8f66615aa4ce42749515aa6d7b1271ae,Winter School part II - Advanced numerical methods for hyperbolic conservation laws,"Ingegneria civile, ambientale e meccanica (D1)"
416429c8964a4b9f828ef44044cb124b,Cellular and Molecular Neurobiology,BIOTECNOLOGIE CELLULARI E MOLECOLARI (LM)
c7f6978f76b64ac496f253f56020b5a2,Marketing turistico e territoriale,Management della sostenibilità e del turismo (LM)
123e09c8d7b941c79e9ae9454f02607c,Analisi dei dati e Statistica,Amministrazione Aziendale e Diritto (L2)
8c850ff5786040e9aa0c9117d3ff9b7f,Lingua e traduzione inglese e lingue e letterature angloamericane I,"Letterature euroamericane, traduzione e critica letteraria (LM)"
dac86d9c39e244279ed76c732ee536ed,Computational linguistics,Cognitive Science - Scienze Cognitive (LM)
6012edb00c3142a79fba79d5cb7730ee,AI and Innovation,Artificial Intelligence Systems (LM)
8b0c503ee81f44b6a937f196510d0d75,Diritto delle reti di imprese,Management (LM)
6255f5176e5443a08f7de1394580ad3b,Numerical methods for environmental processes,Environmental Meteorology (LM)
d22447f38bbf4765a006a046c51a255f,Circuiti elettronici digitali,Informatica (L2)
e7e928fd9ad647e786ac0a8a44693466,Cancer Therapy,BIOTECNOLOGIE CELLULARI E MOLECOLARI (LM)
ed839c8749bd4a07892b3c5928dd5686,Cellular and Molecular Neuroscience,Cognitive Science - Scienze Cognitive (LM)
4d134d30d99240188d13ff2c1a68502e,Atmospheric chemistry and biogeochemistry,Environmental Meteorology (LM)
b544bb3386a447ba947667f9f7263639,Atmospheric radiation and remote sensing,Environmental Meteorology (LM)
1cfb9b861edf4146b3c6539626c56b51,Distributed estimation for robots and vehicles,Mechatronics Engineering (LM)
5cbae1c8fced41ccbb14c802f688ca15,Filosofia della scienza,Filosofia (L2)
5e297309e7c540c2975be8d1431c423d,Corso di italiano A1a - I periodo (estensivo),Centro Linguistico d'Ateneo (CLA)
3267b0e809064948ab85ea48ef02dfc2,Embedded systems,Mechatronics Engineering (LM)
63238f7fdfcf48ffb9f57f2b50dbb370,Learning processes and technological innovation,School of Innovation (CS)
e6a87234ec9244759a9dc6b7517ff9fb,Business analytics,School of Innovation (CS)
fd5c3caac4f74ca1ab2ce8ed0b2306db,Autonomous Software Agents,Artificial Intelligence Systems (LM)
d19a43e84d9e4113bb1a8efdc9632265,Marketing game,Economia e Management (L2)
14e2454d185a450e9ddb079a5a7ccfa2,High Performance Computing for Data Science,Ingegneria dell'Informazione e delle Comunicazioni (LM)
6d9b0148040444c384df986b05af88e4,Seminario: Theories of Meaning in the Social and the Natural World,Sociology and social research - Sociologia e ricerca sociale (LM)
093a022558f047c4b54191d49d65a369,Fisica generale I (primo modulo),Matematica (L2)
8fa48437c913460fbae576be1dcc57fe,Multimedia Data Security,INFORMATICA (LM)
e32ce6cfbf714dafb264852c044e47e6,Applied Market Analysis,Management (LM)
0a3c5cb549ce446f9b528ad728625862,Stochastic Processes,MATEMATICA (LM)
05f95278a6f9461ab323ccb91fa5468e,Calcolo delle probabilità e statistica matematica,Matematica (L2)
2f459ff566014445973c0938a4a2fefd,"Arboricoltura generale, principi di fisiologia e genetica delle piante da frutto",Viticoltura ed Enologia (L2)
bd0823e8f3884c45992dedf3c90a8831,Introduction to Human Language,Cognitive Science - Scienze Cognitive (LM)
d6d9b2ce16fc4543b74e33bfcbb16608,Power relations for creativity and innovation,School of Innovation (CS)
f475de85505c4feea5a1c413c8695653,Computer simulation for Economics,Behavioural and Applied Economics - Economia Comportamentale e Applicata (LM)
d6042c2ad25046289b40dd79a808e167,Statistica per le ricerche di mercato,Gestione Aziendale (L2)
b969cd3b3b004e3cb70f6c8e3070b436,Crash course - Introduction to Quantitative Methods,International Management - Management Internazionale (LM)
6978cd70c9c14061b0f357735bb559c3,Storia contemporanea III,Studi storici e filologico-letterari (L2)
d28bf935218d4833ad28605edaf2b5af,Filologia italiana II - LM,Filologia e critica letteraria (LM)
ad43416d41284aee90cab3a1098ea8d9,Human-Machine Dialogue,INFORMATICA (LM)
35c52d44bc204cb39b7bcb1ece5dfeac,Fondamenti di meccanica razionale,Ingegneria per l'ambiente e il territorio (L2)
64c4eb2bf5884123935eb8444a696192,Electrical Systems Engineering,Ingegneria Energetica (LM)
4f0acdd12e7f410ab8bb4268cb93b0b3,Architettura del paesaggio,Ingegneria Edile-Architettura (LM5)
57150063c9494e51aa8d0dc6c76ffcbe,Introduzione alla Programmazione per il web,Informatica (L2)
2c5a8636f263438aa6e4151f76654f44,Viticoltura 1,Viticoltura ed Enologia (L2)
f15a34ecc7964a1dbf65f2f50da295a1,"Strategia, sostenibilità e impatto",Gestione di imprese sociali (G.I.S.) (M1)
aec20ee095954547ae9357b04a6e1f5b,Reti,"Ingegneria Informatica, delle Comunicazioni ed Elettronica (L2)"
44451c4803e449699c12bc2da6a7fe30,Bayesian statistics,INFORMATICA (LM)
3d7baa9188204fbca32e27be6bd3507f,Diritto comune,Giurisprudenza (LM5)
da4aa0331f5447adb35ee8596a8cd94d,Computer Programming 2,"Ingegneria Informatica, delle Comunicazioni ed Elettronica (L2)"
9544a271b1be4963acfd8eba0fd163e7,Algoritmi e strutture dati,Informatica (L2)
bec6444ded4042aa8c8d442baa258e8c,Seminars: Science and Technology in Society,Communication of Science and Innovation - SCICOMM (M1)
97f3dd43b1204cd595eaa9d461815446,Psicologia dello sviluppo,Filosofia (L2)
47287aa0e791411eb7a2bb055020b4a8,Research methods in political science,Sociology and social research - Sociologia e ricerca sociale (LM)
19f8379ceddd46ee9b2102377569a8cd,Archeometria,Beni culturali (L2)
82a1ac95300d422895212984ba4fc889,Language and society,Sociology and social research - Sociologia e ricerca sociale (LM)
b5995462896b4ce6ad5808690e81d470,Designing and programming the Internet of Things (IoT),Data Science (LM)
3106e17b02214f4b9488be454159e8db,Telerilevamento e radar,"Ingegneria Informatica, delle Comunicazioni ed Elettronica (L2)"
