id_course,course_name,degree_program
0,Databases,Informatica (L2)
1,Analisi matematica 1,Ingegneria Civile (L2)
2,Econometrics,Behavioural and Applied Economics - Economia Comportamentale e Applicata (LM)
3,Agiografia II,Beni culturali (L2)
4,"Signal, Image and Video",Biologia Quantitativa e Computazionale (LM)
5,Immagini di futuro,Previsione Sociale (M2)
6,Filologia latina - LM,Filologia e critica letteraria (LM)
7,Technology Strategy,International Management - Management Internazionale (LM)
8,Advanced computing architectures,Ingegneria dell'Informazione e delle Comunicazioni (LM)
9,Visual brain and design,Human-Computer Interaction - Interazione Persona-Macchina (LM)
10,Partial differential equations,MATEMATICA (LM)
11,Utilizzo di nudging nelle scienze del comportamento,Interfacce e Tecnologie della Comunicazione (L2)
12,Biodiritto,Filosofia e linguaggi della modernità (LM)
13,Elettrotecnica,Ingegneria Civile (L2)
14,Logic networks,"Ingegneria Informatica, delle Comunicazioni ed Elettronica (L2)"
15,Seminario: Ideare e sviluppare la tesi di laurea magistrale MOVASS,"Metodologia, Organizzazione e Valutazione dei Servizi Sociali (LM)"
16,Misurazione e rendicontazione sociale,Management (LM)
17,Economic Policy in Global Market,Economia e Management (L2)
18,The Legal Framework of EU Policies,EUROPEAN AND INTERNATIONAL STUDIES - STUDI EUROPEI E INTERNAZIONALI (LM)
19,Introduction to Computer and Network Security,"Ingegneria Informatica, delle Comunicazioni ed Elettronica (L2)"
20,Dispacciamento dell’energia,Ingegneria Energetica (LM)
21,Diritto pubblico,Gestione Aziendale (L2)
22,Ecoidraulica,Ingegneria per l'ambiente e il territorio (LM)
23,International business management,International Management - Management Internazionale (LM)
24,Interdisciplinary laboratory: Advanced metals,Materials and production Engineering - Ingegneria dei materiali e della produzione (LM)
25,Progettazione per comunità sostenibili,Global and Local Studies (LM)
26,Letteratura latina medievale I - LT,Studi storici e filologico-letterari (L2)
27,Fondamenti di elaborazione dei segnali,"Ingegneria Informatica, delle Comunicazioni ed Elettronica (L2)"
28,Elementi di geometria,Filosofia (L2)
29,Stochastic Models,Biologia Quantitativa e Computazionale (LM)
30,Clinica dei disturbi cognitivi e comportamentali nelle malattie degenerative cerebrali,Psicologia (LM)
31,Lingua inglese livello B1,Medicina e Chirurgia (LM6)
32,Analisi economico-finanziaria per le imprese turistiche,Management della sostenibilità e del turismo (LM)
33,International Economics (Basic),EUROPEAN AND INTERNATIONAL STUDIES - STUDI EUROPEI E INTERNAZIONALI (LM)
34,Fisica e modellistica dell'atmosfera,Ingegneria per l'ambiente e il territorio (LM)
35,Filologia romanza - LM,Filologia e critica letteraria (LM)
36,Energie rinnovabili,Ingegneria per l'ambiente e il territorio (LM)
37,Quantitative Methods in Social Sciences (Advanced),EUROPEAN AND INTERNATIONAL STUDIES - STUDI EUROPEI E INTERNAZIONALI (LM)
38,Diritto comparato delle religioni,Giurisprudenza (LM5)
39,Data Governance,School of Innovation (CS)
40,Letteratura italiana II,Studi storici e filologico-letterari (L2)
41,Cognitive neuroscience of infant development,Cognitive Science - Scienze Cognitive (LM)
42,Economia pubblica,Economia e Management (L2)
43,"Definizioni, ruolo e potenzialità",Gestione di imprese sociali (G.I.S.) (M1)
44,Decision and Risk Analysis,Data Science (LM)
45,Storia delle tradizioni religiose,Filosofia e linguaggi della modernità (LM)
46,Psicologia della memoria e dell'apprendimento,Scienze e Tecniche di Psicologia Cognitiva (L2)
47,Neuroscienze affettive e cliniche,Psicologia (LM)
48,Storia del Cristianesimo e delle Chiese I,Studi storici e filologico-letterari (L2)
49,Bioinspired and functional materials,Materials and production Engineering - Ingegneria dei materiali e della produzione (LM)
50,Labour and Household Economics,Economia e Management (L2)
51,Knowledge and Data Integration,Ingegneria dell'Informazione e delle Comunicazioni (LM)
52,Plasticità e Apprendimento,Scienze e Tecniche di Psicologia Cognitiva (L2)
53,Infrastrutture idrauliche urbane,Ingegneria per l'ambiente e il territorio (LM)
54,Storia europea e internazionale,Studi internazionali (L2)
55,Imaging e localizzazione,Ingegneria dell'Informazione e delle Comunicazioni (LM)
56,Filologia italiana I - LM,Filologia e critica letteraria (LM)
57,Storia della lingua italiana I - LT,Studi storici e filologico-letterari (L2)
58,Geografia storica,Beni culturali (L2)
59,"Bioagrofarmaci, biofertilizzanti e tecniche innovative di gestione per una viticoltura sostenibile (eng)",Viticoltura ed Enologia (L2)
60,Psicologia dinamica,Scienze e Tecniche di Psicologia Cognitiva (L2)
61,Quality and innovation engineering,Mechatronics Engineering (LM)
62,Sociology of Law,Giurisprudenza (LM5)
63,Gene Therapy,BIOTECNOLOGIE CELLULARI E MOLECOLARI (LM)
64,Idrologia,Ingegneria per l'ambiente e il territorio (L2)
65,Diritto privato,Gestione Aziendale (L2)
66,Quantum theories for multiparticle systems,FISICA (LM)
67,Cognizione animale,Scienze e Tecniche di Psicologia Cognitiva (L2)
68,Ingegneria sanitaria,Ingegneria per l'ambiente e il territorio (L2)
69,Thesis seminar,Sociology and social research - Sociologia e ricerca sociale (LM)
70,Business Sustainability Management,Innovation Management - Management dell'innovazione (LM)
71,Functional and smart materials,Mechatronics Engineering (LM)
72,Storia dell'arte moderna IV,Studi storici e filologico-letterari (L2)
73,Qualitative research methods,Global and Local Studies (LM)
74,Genere e società,Sociologia (L2)
75,Human Computer Interaction,Informatica (L2)
76,Behavioural Economics,Behavioural and Applied Economics - Economia Comportamentale e Applicata (LM)
77,Hydropower and wind power systems,Ingegneria Energetica (LM)
78,Machine learning,MATEMATICA (LM)
79,Financial Markets and Economic Activity,Behavioural and Applied Economics - Economia Comportamentale e Applicata (LM)
80,Inglese giuridico B2,"Comparative, European and International Legal Studies (L2)"
81,Global and transnational history,Global and Local Studies (LM)
82,Paleografia II,Studi storici e filologico-letterari (L2)
83,Fourier Analysis,MATEMATICA (LM)
84,Gnoseologia,Filosofia (L2)
85,Storia di una regione in Età moderna,Studi storici e filologico-letterari (L2)
86,"Contabilità, bilancio e principi contabili",Gestione Aziendale (L2)
87,International Trade and Globalisation,Amministrazione Aziendale e Diritto (L2)
88,Cultura e letteratura tedesca,Beni culturali (L2)
89,Finanza aziendale progredito,Management (LM)
90,Mercati e intermediari finanziari progredito,MATEMATICA (LM)
91,Quantum Machine Learning,INFORMATICA (LM)
92,Interdisciplinary laboratory: Polymeric materials,Materials Engineering (LM)
93,Laboratorio di economia finanziaria_,Economia e Management (L2)
94,Sociologia delle relazioni internazionali,Sociologia (L2)
95,International Tax Law,"Comparative, European and International Legal Studies (L2)"
96,Fondamenti di meccanica delle rocce e costruzioni in sotterraneo,Ingegneria Civile (LM)
97,Statistical models,Biologia Quantitativa e Computazionale (LM)
98,Renewable Energy and Meteorology,FISICA (LM)
99,Functions of the Peripheral Nervous System,BIOTECNOLOGIE CELLULARI E MOLECOLARI (LM)
100,Sistemi giudiziari comparati,Giurisprudenza (LM5)
101,Interdisciplinary laboratory: Characterization techniques,Materials Engineering (LM)
102,Istituzioni di diritto privato I,Giurisprudenza (LM5)
103,Neuropsicologia,Psicologia (LM)
104,Mechanics and materials for engineering design,Materials and production Engineering - Ingegneria dei materiali e della produzione (LM)
105,High Performance Computing for Data Science,INFORMATICA (LM)
106,Istituzioni di diritto amministrativo e Legislazione ambientale,Ingegneria per l'ambiente e il territorio (L2)
107,Pensiero sistemico,Previsione Sociale (M2)
108,Devianza e controllo sociale,Servizio Sociale (L2)
109,Networking,Informatica (L2)
110,Diritto amministrativo,Amministrazione Aziendale e Diritto (L2)
111,Fog and Cloud Computing,Ingegneria dell'Informazione e delle Comunicazioni (LM)
112,Advanced Academic Writing,Finanza (LM)
113,Advanced Commutative Algebra,MATEMATICA (LM)
114,Transnational Governance,Studi Sulla Sicurezza Internazionale (LM)
115,Medical Imaging Diagnostic,Artificial Intelligence Systems (LM)
116,Storia dell'arte moderna II,Beni culturali (L2)
117,Inglese giuridico C1,"Comparative, European and International Legal Studies (L2)"
118,Progettazione di sistemi elettronici,Ingegneria Industriale (L2)
119,Sociologia economica e del lavoro,Studi internazionali (L2)
120,Progettazione di impianti di trattamento delle acque,Ingegneria per l'ambiente e il territorio (LM)
121,Global Markets and Security issues,Studi Sulla Sicurezza Internazionale (LM)
122,Scientific programming,Environmental Meteorology (LM)
123,Economia aziendale,Beni culturali (L2)
124,Genomics,Biologia Quantitativa e Computazionale (LM)
125,Storia della critica d'arte I,Beni culturali (L2)
126,Ethics for computer science and engineering,Ingegneria dell'Informazione e delle Comunicazioni (LM)
127,Informatica,Scienze e Tecnologie Biomolecolari (L2)
128,Distributed robot perception,Data Science (LM)
129,Letterature comparate II,Studi storici e filologico-letterari (L2)
130,Diritto tributario 2,Economia e legislazione d'impresa (LM)
131,Diritto pubblico,Amministrazione Aziendale e Diritto (L2)
132,Storia moderna II,Filosofia (L2)
133,Topografia,Ingegneria Civile (L2)
134,Economics_,Management (LM)
135,Global Economic Scenarios_,Innovation Management - Management dell'innovazione (LM)
136,Metodi di indagine in psicologia clinica,Psicologia (LM)
137,Thermodynamics of materials,Materials Engineering (LM)
138,Geometria e algebra lineare,Informatica (L2)
139,Organizzazione del cantiere,Ingegneria Civile (LM)
140,Lifestyles and consumption practices,Sociology and social research - Sociologia e ricerca sociale (LM)
141,Privacy-Enhanced Technologies,INFORMATICA (LM)
142,Seminario: English for Academic Writing and Presentations,Sociologia (L2)
143,Epigenetics of Cancer,BIOTECNOLOGIE CELLULARI E MOLECOLARI (LM)
144,Evidence Based Management,Management (LM)
145,Comunicazione scientifica,Psicologia (LM)
146,Administrative Law,"Comparative, European and International Legal Studies (L2)"
147,Physiological flow and transport in porous tissues,MATEMATICA (LM)
148,Statistics Laboratory,"Security, Intelligence and Strategic Studies (LM)"
149,Research Design,Cognitive Science - Scienze Cognitive (LM)
150,Stochastic processes (I modulo),Biologia Quantitativa e Computazionale (LM)
151,Philosophical Insights,Filosofia e linguaggi della modernità (LM)
152,Medioevo teologico,Filosofia (L2)
153,Seminario: Elementi di analisi dei sistemi energetici,Ingegneria per l'ambiente e il territorio (LM)
154,Mechatronic systems simulation,Mechatronics Engineering (LM)
155,Statistica per le ricerche di mercato,Gestione Aziendale (L2)
156,Bio-Medical Imaging,FISICA (LM)
157,Economia dei sistemi agro-alimentari,Gestione Aziendale (L2)
158,Geometry and Linear Algebra,Informatica (L2)
159,Physics of the Climate System,Environmental Meteorology (LM)
160,Current Topics in Brain Connectivity,Cognitive Science - Scienze Cognitive (LM)
161,Atmospheric boundary layer and turbulence,Environmental Meteorology (LM)
162,Progettazione di sistemi integrati per il recupero di materia da rifiuti urbani,Ingegneria per l'ambiente e il territorio (LM)
163,Ingegneria per lo sviluppo sostenibile internazionale. Metodi e progetto,Ingegneria per l'ambiente e il territorio (LM)
164,Filosofia della logica,Filosofia e linguaggi della modernità (LM)
165,Protection of materials and structures,Materials and production Engineering - Ingegneria dei materiali e della produzione (LM)
166,Human-Machine Dialogue,Artificial Intelligence Systems (LM)
167,Psicologia della formazione e dell'orientamento,Psicologia (LM)
168,Elementi di meccanica,Ingegneria Industriale (L2)
169,Understanding Megatrends,School of Innovation (CS)
170,Research Methods in History,Sociology and social research - Sociologia e ricerca sociale (LM)
171,Seminario: Lime Survey per la raccolta dei dati,Sociologia (L2)
172,Elementi psicologici e sociali del lavoro nei servizi sociali,"Metodologia, Organizzazione e Valutazione dei Servizi Sociali (LM)"
173,GPU computing,INFORMATICA (LM)
174,Economia dell'ambiente,Amministrazione Aziendale e Diritto (L2)
175,Distributed Robot Perception,Artificial Intelligence Systems (LM)
176,Ingegneria del Software,Informatica (L2)
177,Medicina narrativa,Medicina e Chirurgia (LM6)
178,Comparative Legal Systems,"Comparative, European and International Legal Studies (L2)"
179,Nuclear Astrophysics,FISICA (LM)
180,Impianti industriali,Ingegneria Industriale (L2)
181,Funzioni esecutive e apprendimenti: sistemi di misura e training,Psicologia (LM)
182,Decision and risk analysis,Management and Industrial Systems Engineering (LM)
183,Servizi sociali innovativi,"Metodologia, Organizzazione e Valutazione dei Servizi Sociali (LM)"
184,Statica,Ingegneria Edile-Architettura (LM5)
185,Statistical models,Data Science (LM)
186,Academic Freedom and Human Rights: European and International Perspectives (J. Monnet module),Giurisprudenza (LM5)
187,Stochastic differential equations,MATEMATICA (LM)
188,"Lavoro, diversità e benessere organizzativo",Gestione delle diversità: inclusione ed equità (GEDIE) (M1)
189,The role of international organizations in promoting peace and security,Studi Sulla Sicurezza Internazionale (LM)
190,Diritto dell'era digitale,Giurisprudenza (LM5)
191,Tecnica delle costruzioni meccaniche,Ingegneria Industriale (L2)
192,Evaluating public engagement with science and technology,Communication of Science and Innovation - SCICOMM (M1)
193,Biostatistics,Biologia Quantitativa e Computazionale (LM)
194,"Organizations, human resources and innovation",Management and Industrial Systems Engineering (LM)
195,Distributed systems 1,INFORMATICA (LM)
196,Struttura della materia,Fisica (L2)
197,Riabilitazione neurocognitiva,Psicologia (LM)
198,Politica comparata,Studi internazionali (L2)
199,Storia moderna II - LM,Filologia e critica letteraria (LM)
200,Casi ed esperienze di gestione delle imprese turistiche,Gestione Aziendale (L2)
201,Processi di trasporto nell'ambiente,Ingegneria per l'ambiente e il territorio (LM)
202,Diritto d'autore e arte,Giurisprudenza (LM5)
203,Storia della Cina moderna e contemporanea,"Mediazione linguistica, turismo e culture (LM)"
204,Psychological Humanities,Psicologia (LM)
205,Managing the new Product Development Process,School of Innovation (CS)
206,Laboratorio di interfacce linguistiche,Interfacce e Tecnologie della Comunicazione (L2)
207,Principles of biomaterials and medical device design,Materials and production Engineering - Ingegneria dei materiali e della produzione (LM)
208,Calculus 1,"Ingegneria Informatica, delle Comunicazioni ed Elettronica (L2)"
209,Economia finanziaria,Finanza (LM)
210,Quantum mechanics,Biologia Quantitativa e Computazionale (LM)
211,Laboratorio di fisica II (mod.B),Fisica (L2)
212,Advanced Formula SAE,Materials and production Engineering - Ingegneria dei materiali e della produzione (LM)
213,Geografia economica,Economia e Management (L2)
214,Archeologia classica,Filologia e critica letteraria (LM)
215,General Relativity and Cosmology,FISICA (LM)
216,Letteratura inglese I,Lingue moderne (L2)
217,Geografia e progettazione strategica degli spazi turistici,"Mediazione linguistica, turismo e culture (LM)"
218,Laboratory of Internet of Things,Management and Industrial Systems Engineering (LM)
219,Valutazione economica dei progetti,Ingegneria Civile (L2)
220,Data Analysis and Statistics,Economia e Management (L2)
221,Laboratori,Gestione delle diversità: inclusione ed equità (GEDIE) (M1)
222,Visual brain and design,INFORMATICA (LM)
223,Turbulence in environmental flows,Ingegneria per l'ambiente e il territorio (LM)
224,Gestione sostenibile delle risorse naturali,Management della sostenibilità e del turismo (LM)
225,Scientific computing,MATEMATICA (LM)
226,Teorie e tecniche delle comunicazioni di massa e digitali,Global and Local Studies (LM)
227,German Language Workshop,EUROPEAN AND INTERNATIONAL STUDIES - STUDI EUROPEI E INTERNAZIONALI (LM)
228,Storia greca I - LM,Scienze storiche (LM)
229,Machine Learning for NLP,Cognitive Science - Scienze Cognitive (LM)
230,Applied Immunology,BIOTECNOLOGIE CELLULARI E MOLECOLARI (LM)
231,Informatica,Matematica (L2)
232,Basi di dati,Matematica (L2)
233,Lab. appl.: Gli atti processuali nel diritto amministrativo,Giurisprudenza (LM5)
234,Politica dei servizi sociali,"Metodologia, Organizzazione e Valutazione dei Servizi Sociali (LM)"
235,Corso di tedesco B1b - I periodo (estensivo),Centro Linguistico d'Ateneo (CLA)
236,Industrial Economics,Economia e Management (L2)
237,Corso di tedesco A2a - I periodo (estensivo),Centro Linguistico d'Ateneo (CLA)
238,Machine learning,Biologia Quantitativa e Computazionale (LM)
239,Computer vision,Artificial Intelligence Systems (LM)
240,Go to market,School of Innovation (CS)
241,Corso di cinese A1a - I periodo (estensivo),Centro Linguistico d'Ateneo (CLA)
242,Storia della lingua italiana II,Filologia e critica letteraria (LM)
243,Mechanics and materials for engineering design,Materials Engineering (LM)
244,Storia contemporanea I,Beni culturali (L2)
245,Disegno industriale,Ingegneria Industriale (L2)
246,Diritto penale dell'economia,Economia e legislazione d'impresa (LM)
247,Pensiero ebraico I,Filosofia e linguaggi della modernità (LM)
248,Softwarized and Virtualized mobile networks,Informatica (L2)
249,Economia e gestione aziendale,Viticoltura ed Enologia (L2)
250,Inglese giuridico C1,Giurisprudenza (LM5)
251,Concurrency,INFORMATICA (LM)
252,Agiografia - LM,Filologia e critica letteraria (LM)
253,International accounting,Management (LM)
254,Introduction to Economics,Economia e Management (L2)
255,Sensing and Radar Technologies,Mechatronics Engineering (LM)
256,Intelligent distributed systems,Mechatronics Engineering (LM)
257,Corporate Finance,Innovation Management - Management dell'innovazione (LM)
258,Letteratura artistica,Storia dell'arte e studi museali (LM)
259,Logica e ragionamento,Interfacce e Tecnologie della Comunicazione (L2)
260,"People, Politics and the Planet",EUROPEAN AND INTERNATIONAL STUDIES - STUDI EUROPEI E INTERNAZIONALI (LM)
261,Marketing_,Economia e Management (L2)
262,Archivistica II,Beni culturali (L2)
263,Academic writing,Studi Sulla Sicurezza Internazionale (LM)
264,Storia romana II,Beni culturali (L2)
265,Archeologia medievale I,Beni culturali (L2)
266,Lingua e traduzione spagnola e letteratura spagnola II,"Letterature euroamericane, traduzione e critica letteraria (LM)"
267,Instabilità delle strutture,Ingegneria Civile (LM)
268,Behavioural Economics,Data Science (LM)
269,Ecologia applicata,Ingegneria per l'ambiente e il territorio (LM)
270,Ethics for computer science and engineering,INFORMATICA (LM)
271,Diritto delle reti di imprese,Management (LM)
272,Chimica con esercitazioni di laboratorio,Fisica (L2)
273,Fondamenti di elaborazione dei segnali,Informatica (L2)
274,Data analysis and exploration,MATEMATICA (LM)
275,"Seminario: La sociologia interpretativa: interazionismo simbolico, Erving Goffman e l'etnometodologia",Sociologia (L2)
276,Applied Stochastic Processes,MATEMATICA (LM)
277,Laboratory of biological data mining,Biologia Quantitativa e Computazionale (LM)
278,Advanced Programming,Informatica (L2)
279,Economia dei mercati e degli intermediari finanziari,Economia e Management (L2)
280,Numerical Modelling of Weather and Climate,"Ingegneria civile, ambientale e meccanica (D1)"
281,Recycling and sustainable materials,Materials Engineering (LM)
282,Etica delle professioni forensi,Giurisprudenza (LM5)
283,Databases,"Ingegneria Informatica, delle Comunicazioni ed Elettronica (L2)"
284,Matematica e statistica,Viticoltura ed Enologia (L2)
285,Quantum Chemistry,Biologia Quantitativa e Computazionale (LM)
286,Ingegneria alimentare ed impianti enologici,Viticoltura ed Enologia (L2)
287,Lingua e traduzione tedesca e letteratura tedesca I,"Letterature euroamericane, traduzione e critica letteraria (LM)"
288,Psicologia delle età della vita,Servizio Sociale (L2)
289,Architettura e tecniche per l'edilizia sostenibile,Ingegneria Edile-Architettura (LM5)
290,Steelmaking and foundry technologies,Materials Engineering (LM)
291,Storia medievale II,Filosofia (L2)
292,Piccoli modelli animali per lo studio delle patologie umane,Medicina e Chirurgia (LM6)
293,Academic and Practitioner Writing Skills for students with proficient Italian Language,"Security, Intelligence and Strategic Studies (LM)"
294,Geographies of Security,"Security, Intelligence and Strategic Studies (LM)"
295,Graphical models and network science,MATEMATICA (LM)
296,Deep learning,Mechatronics Engineering (LM)
297,Negotiation skills,School of Innovation (CS)
298,Digital Entrepreneurship for Societal Challenges TBC,School of Innovation (CS)
299,Organizzazione aziendale progredito,Management (LM)
300,Letterature angloamericane - LM,"Letterature euroamericane, traduzione e critica letteraria (LM)"
301,Geometric Analysis,MATEMATICA (LM)
302,Softwarized and Virtualized mobile networks,"Ingegneria Informatica, delle Comunicazioni ed Elettronica (L2)"
303,Civil Litigation in a Comparative Perspective,"Comparative, European and International Legal Studies (L2)"
304,Enologia 1,Viticoltura ed Enologia (L2)
305,Molecular Biology of the Cell,MATEMATICA (LM)
306,Algebraic geometry I,MATEMATICA (LM)
307,Sociologia dell'innovazione,"Organizzazione,società e tecnologia (LM)"
308,Master Mind,School of Innovation (CS)
309,Diritto comparato della proprietà intellettuale,Giurisprudenza (LM5)
310,Nuovi modelli sperimentali per lo studio delle patologie umane,Medicina e Chirurgia (LM6)
311,Diritto del turismo,Giurisprudenza (LM5)
312,Business models-Value Proposition Canvas VPC & Business Model Canvas BMC,School of Innovation (CS)
313,Chimica fisica e Bioanalitica,Scienze e Tecnologie Biomolecolari (L2)
314,Negotiation,Behavioural and Applied Economics - Economia Comportamentale e Applicata (LM)
315,Saturated control systems,"Materiali, meccatronica e ingegneria dei sistemi (D1)"
316,Storia della musica II,Beni culturali (L2)
317,Terrorism and insurgency in war and peace,Studi Sulla Sicurezza Internazionale (LM)
318,Corso di francese A2 - I periodo (estensivo),Centro Linguistico d'Ateneo (CLA)
319,Social Impact Investing,School of Innovation (CS)
320,Informatica,Ingegneria Industriale (L2)
321,Introduzione allo studio dei Futuri - online,Previsione Sociale (M2)
322,Introduction to International Law,Studi Sulla Sicurezza Internazionale (LM)
323,Computational Biophysics,Biologia Quantitativa e Computazionale (LM)
324,Sociologia dell'organizzazione,Studi internazionali (L2)
325,Metodi digitali di ricerca,"Organizzazione,società e tecnologia (LM)"
326,Conflict of Laws,"Comparative, European and International Legal Studies (L2)"
327,Financial Markets and Economic Activity,INFORMATICA (LM)
328,Programmazione scientifica,Fisica (L2)
329,Didattica delle lingue straniere,"Letterature euroamericane, traduzione e critica letteraria (LM)"
330,Glottologia - LM,Filologia e critica letteraria (LM)
331,Requirements engineering,INFORMATICA (LM)
332,Digital business models,Management (LM)
333,Financial Markets and Economic Activity,International Management - Management Internazionale (LM)
334,Ingegneria fluviale,Ingegneria per l'ambiente e il territorio (LM)
335,sis3 - introduzione alla revisione sistematica della letteratura scientifica,Scienze e Tecniche di Psicologia Cognitiva (L2)
336,Financial metrics for business and services,Innovation Management - Management dell'innovazione (LM)
337,Network Modeling and Simulation,Biologia Quantitativa e Computazionale (LM)
338,Data Mining,Biologia Quantitativa e Computazionale (LM)
339,"Seminario: Energia, idrogeno e decarbonizzazione",Ingegneria per l'ambiente e il territorio (LM)
340,Sociologia urbana e Diritto urbanistico,Ingegneria Edile-Architettura (LM5)
341,Economics of Innovation Processes,Innovation Management - Management dell'innovazione (LM)
342,Controllo di gestione progredito,Management (LM)
343,International Trade and Competitiveness,International Management - Management Internazionale (LM)
344,Analisi numerica I,Matematica (L2)
345,Chimica generale ed inorganica,Scienze e Tecnologie Biomolecolari (L2)
346,Fondamenti di robotica,Informatica (L2)
347,Mathematical Modeling in Biology,Biologia Quantitativa e Computazionale (LM)
348,Storia delle religioni,Filosofia (L2)
349,Stabilità dei pendii naturali e delle costruzioni in terra,Ingegneria per l'ambiente e il territorio (LM)
350,Design of digital production and assembly systems,INFORMATICA (LM)
351,Qualitative methods,Sociology and social research - Sociologia e ricerca sociale (LM)
352,Seminario: Conosciamo il Dipartimento,Sociologia (L2)
353,Archeologia e storia dell'arte greca,Beni culturali (L2)
354,Storia dei sistemi economici,Amministrazione Aziendale e Diritto (L2)
355,Filologia germanica II - LM,"Letterature euroamericane, traduzione e critica letteraria (LM)"
356,Gestione delle imprese,Lingue moderne (L2)
357,Letterature comparate - LT,Lingue moderne (L2)
358,Intelligenza artificiale e diritto,Giurisprudenza (LM5)
359,Letteratura del Rinascimento,Filologia e critica letteraria (LM)
360,Tensor Decomposition for Big Data Analysis,MATEMATICA (LM)
361,Scienza e tecnologia dei materiali,Ingegneria Industriale (L2)
