id_course,articulation,title
aa1bc23c21d3497db7f966a34bb7adfd,Corso di inglese C1a - I periodo (estensivo),Centro Linguistico d'Ateneo (CLA)
075c31d05d9a4a68b9a93bdec7738c3a,Strumentazione ed elettronica industriale,Ingegneria Industriale (L2)
1b2d2fc2b37a48afa50491f8029f9e70,"Biosphere, atmosphere and climate interactions",Environmental Meteorology (LM)
ec639e08dbff4f24b1adfcf123b25e1b,Ingegneria per lo sviluppo sostenibile internazionale. Metodi e progetto,Ingegneria per l'ambiente e il territorio (LM)
aec881d23ba049829560f9f1b1bcf87b,Effective Managerial Decision Making,International Management - Management Internazionale (LM)
699f31c1a0284cc6b7987bcb94d4f3fb,Finite elements modeling,Materials Engineering (LM)
7281dba1519d47d0b2b74af14fda87ca,Restauro architettonico con Laboratorio Progettuale,Ingegneria Edile-Architettura (LM5)
9dd5fcfbefcf4f4bb83341f843e2486a,Economic History,Economia e Management (L2)
514a1f5798e346539a47d614ccb31bcb,Storia medievale II,Lingue moderne (L2)
13f84db32d654ee09230b8f7785ed41e,Microbiologia generale,Scienze e Tecnologie Biomolecolari (L2)
94ce22027b57457a80fbcf3d7bb6fa39,"Signal, Image and Video",INFORMATICA (LM)
37e39771fd70411d9de73f1f6284d996,Corso di inglese preparazione esame IELTS - I periodo (estensivo),Centro Linguistico d'Ateneo (CLA)
a95f97a0b0774e889c73446f0c03ffb9,Clinical Neurology and Neuropsychology,Cognitive Science - Scienze Cognitive (LM)
7b46735b799d416c92f19ef75af50c90,Diritto commerciale,Gestione Aziendale (L2)
563c12109a9c4ff69cf0021c8c8c35bd,Lab. appl.: Moot Court secondo le regole del processo formulare romano,Giurisprudenza (LM5)
f66525c0f1814aaeb981c4df17dcebf2,Econometrics,Economia e Management (L2)
1e6803e2d7fb4552a5bbf5b5c0e988c7,Network security,Ingegneria dell'Informazione e delle Comunicazioni (LM)
0794af76c7dd473f880e4e9514797e2d,Data Visualization Lab,Data Science (LM)
e47bce1cef9449e58570e985c2d23d6b,Seminario: The Social Stratification of Gender Inequality,Sociology and social research - Sociologia e ricerca sociale (LM)
c323155af2a74ed5ae3aea657ccc9804,Fisica,Viticoltura ed Enologia (L2)
dc6688aa7efe4f6a9e3a2a32183ef993,Storia medievale II,Beni culturali (L2)
95047eabefa94640839d50a9b4f26935,Fondamenti biologici del comportamento,Educazione professionale (abilitante alla professione sanitaria di Educatore professionale) (L2)
c2c2fd8234c241c68064b1db0f86074a,Network-based Data Analysis,Data Science (LM)
978a02108af340be9ef469feeb6f613f,Introduction to Robotics,INFORMATICA (LM)
dac966e7fe514c3fa25e0645b1ec60a4,Macroeconomics,Economia e Management (L2)
f3ec545835064bd5898cb3c46772ed44,Business and Competition Law,Economia e Management (L2)
1c8decd592c3426aac9cd98c4e2a8fc4,Laboratorio di fisica II (mod.A),Fisica (L2)
bd8fa59bf65a4326b173d0cdbff15f01,Fisica,"Ingegneria Informatica, delle Comunicazioni ed Elettronica (L2)"
a0598b7fcbe94a5c84d34c86e019d8e9,Sustainable materials management,Management and Industrial Systems Engineering (LM)
8d1daf8ee9af48968afb173b2e64ace6,Negotiation,Innovation Management - Management dell'innovazione (LM)
5a6af361f9544f3e98e2b74f0f9a6fa2,Seminario cementi e calcestruzzi,Ingegneria Civile (L2)
12a82e977dee4167830384ee7ea63348,Questionnaire Design,Behavioural and Applied Economics - Economia Comportamentale e Applicata (LM)
c086071c2daf4ccb8999b7d09926883d,Antropologia,Beni culturali (L2)
ffa40eaf80234709bb9faabc94da1def,Optimisation Based Robot Control,Artificial Intelligence Systems (LM)
9dda0898b8e64f79a8bc4741a490bf3a,Trends and Applications of Computer Vision,Artificial Intelligence Systems (LM)
38a1f859df81464fb12715c8420f00c9,Storia globale in età moderna - LT,Studi storici e filologico-letterari (L2)
bd9909a0340a46028ed35e71a1cd6b8c,Quantitative Methods Lab,Data Science (LM)
28de83809be748b49e43bb892b7324c7,Fog and Cloud Computing,Ingegneria dell'Informazione e delle Comunicazioni (LM)
0f1c21f7e7f54fe78b18b853a289d8fb,Seminario: Storia e sociologia dell'Ucraina moderna,Sociologia (L2)
cca81a4451444d7a97b7c7c09ef8d991,Professional English for Data Science,Data Science (LM)
ff4ba62a2bcb49caad5c4e72a84536a4,Bibliografia e biblioteconomia II,Beni culturali (L2)
95df82fbe511483c8a7600d673a6be26,Mathematical basics for Cognitive Science,Cognitive Science - Scienze Cognitive (LM)
884f50636ac64fe3a9849f3b3020c561,Storia della matematica e della fisica,Filosofia e linguaggi della modernità (LM)
75fe30c9fc01496480fa629e678ca47e,Fisica,Informatica (L2)
b7b113ec41c344d39ce189cfe50c4fb3,Partial differential equations,MATEMATICA (LM)
d546ffbd96af4de38cee3a2846b1bc87,Sociological approaches to culture,Sociology and social research - Sociologia e ricerca sociale (LM)
a721d23c614b4b3b869e391781067f36,Neurogenesis and Brain Regeneration,BIOTECNOLOGIE CELLULARI E MOLECOLARI (LM)
ccd04696de324fe78ef63c34f80179b0,Introduction to security studies,Studi Sulla Sicurezza Internazionale (LM)
43cc301b391740af9199ff4602e9da60,Laboratorio qualità prodotti vitivinicoli,Viticoltura ed Enologia (L2)
c57b29cff60f45b89491395512992e83,Networking II,Ingegneria dell'Informazione e delle Comunicazioni (LM)
662a925bfef94f51896b17aa54e53d6e,Data mining,MATEMATICA (LM)
8094e42959264373805ff1acc1394c27,Real time operating systems and middleware,INFORMATICA (LM)
342ce1b0183e47d9bd86dee0b9b252a0,Prova di conoscenza linguistica L.M. - Inglese in ambito economico,Finanza (LM)
e79c82ff5f31477d9a9e4607c546983a,Economia,Amministrazione Aziendale e Diritto (L2)
81cf1e69cd414354837b0a8e2727d803,Circular economy for materials processing,Materials Engineering (LM)
b6d4d9a817714140993c859b1bb52f4e,Metodologie della ricerca archeologica II,Beni culturali (L2)
3f318d10ddec44ed9f99002342a495f8,Introduction to meteorology and climatology,Environmental Meteorology (LM)
92728cefc84f4a1bb83e405245b4531e,Matematica finanziaria progredito,Finanza (LM)
77be88a443394a8f88f0c880689decc1,Storia contemporanea II,Beni culturali (L2)
c1e7910b2a5b4fe1ab1a23949d346f9e,Scientific computing,MATEMATICA (LM)
276ae6d66b9a4cb58495c53badba45f0,Ambiti di intervento nella psicologia,Psicologia (LM)
e4d17239cedf4f27a2b065092c21f9db,Gender and Security,Studi Sulla Sicurezza Internazionale (LM)
6000026ed4f34c1eacc1b7c9769f21da,Management delle imprese di famiglia,Management (LM)
55cef5de3aab4779a3bb5cfff020e894,Analisi e annotazione linguistica,Interfacce e Tecnologie della Comunicazione (L2)
c118027c5360497ab0dbd4a8d1d45465,Chimica generale e inorganica,Viticoltura ed Enologia (L2)
1e8a0198704a45e6a797960ecdf097a7,Innovating Supply Chains,School of Innovation (CS)
42073e50c6614b39ba7f55474704ca47,Social inequalities: dynamics and policies,Data Science (LM)
f4648809ca5d4b109fe80b4cc4b04c43,Advanced Formula SAE,Materials Engineering (LM)
2812f2a3d7a547c2acec7d032cdfba36,Storia delle idee filosofiche e religiose,Filosofia e linguaggi della modernità (LM)
ab0af3e1dad447b68c0c0934340c2fc3,Filologia romanza I,Studi storici e filologico-letterari (L2)
ae445ce461fb40379d7ec4d9a02353ca,Lab. I: Market Analysis,Economia e Management (L2)
56341c8609704516a42e535a07cc929d,Analisi matematica 1,"Ingegneria Informatica, delle Comunicazioni ed Elettronica (L2)"
11fb32328c7a4a0c9adc8dd6871f5743,Diritto agroalimentare e globalizzazione,Giurisprudenza (LM5)
6e1d9ef2af924ec0aaa4d718b98ce1e3,Previsione tecnologica,Previsione Sociale (M2)
a7f4f27e08f44011a29125b3671cec62,Costruzioni in legno,Ingegneria Edile-Architettura (LM5)
fa98139357ac4e1680e8754676e537d6,Seminario: Introduzione all'analisi degli eventi di protesta - Protest event analysis (PEA),Sociologia (L2)
789ac8dec71842e0a5569f908f0b4de5,Lingua e traduzione inglese e letteratura inglese I,"Letterature euroamericane, traduzione e critica letteraria (LM)"
bbbf29ade83b42d9a57138858916c6f1,Storia moderna II,Lingue moderne (L2)
8ef7f046da1d4c0db3f78ef70fdc8861,Molecular Biology of the Cell,Biologia Quantitativa e Computazionale (LM)
a0af3762f2844cecaef60c56f884f94d,Psicologia delle organizzazioni,Psicologia (LM)
e91b66cfedfb4d3b9075815c27305542,Network Modeling and Simulation,Biologia Quantitativa e Computazionale (LM)
598a5b43a73f47598f46cb4d49ee27c5,Crash course - International Business,Innovation Management - Management dell'innovazione (LM)
2c84d4aefed848bea38c6beb31429d39,Deep learning,INFORMATICA (LM)
a5e22254da144bfcb5c5e28e4e907af8,Innovative and sustainable techniques for minor and speciality crops in the Alps,Agrifood Innovation Management (LM)
ae1682dcc90c4ae99d694150dea30509,Translational Control in Disease,BIOTECNOLOGIE CELLULARI E MOLECOLARI (LM)
3d96155d283a40e486f4e6750f3fa343,Metodi,Previsione Sociale (M2)
524f0db0fa6e46a490d726fd476401f6,Fondamenti di robotica,Informatica (L2)
42645cf35fd645d5beb5414ae67bd5b9,Tropical meteorology and climate,Environmental Meteorology (LM)
781b47cbd9ee420b85d0f1cd65b5457d,Computer vision,Ingegneria dell'Informazione e delle Comunicazioni (LM)
f7eb4194d88a4ca797f1474b24d30ad5,ICT Innovation - Product Design and Development,Innovation Management - Management dell'innovazione (LM)
1e5f0aa4adf64a81864476be0cdac86c,Imaging and diagnostic techniques,Artificial Intelligence Systems (LM)
f76a1c898fd4403da8240b30b81e5d74,Discrete Fourier analysis,MATEMATICA (LM)
2eb09c87e5484ab39d8eb6fe5d0dadb9,Design for social inclusion,Human-Computer Interaction - Interazione Persona-Macchina (LM)
08c1fc93af984b489478b7760b3889bc,Social interaction,Human-Computer Interaction - Interazione Persona-Macchina (LM)
74ea79cdbac04a78869194eaaeb11914,Sustainable and Responsible Management,Management (LM)
da3588a53f5648559f14209b8b70a36a,Teoria e tecnica del dibattito,Giurisprudenza (LM5)
22f85def0d394604a4df219e563fcb3b,Letterature comparate III - LM,"Letterature euroamericane, traduzione e critica letteraria (LM)"
553483fd058f41339170c942adb0e861,Lingua inglese B1 (obbligo formativo aggiuntivo),Lingue moderne (L2)
757ceec0bdac40c9bee997c855c7aede,Research Project,Ingegneria dell'Informazione e delle Comunicazioni (LM)
5879844b717c4c37b9d5a517697e3982,Workshop in Behavioral finance,Finanza (LM)
8644bb2c897f4250806d70df9547da94,Lab. appl.: I rapporti tra Stato e Regioni nella giurisprudenza costituzionale,Giurisprudenza (LM5)
4c003b555d674dd889bb4d3a3801f216,Anatomia umana II,Medicina e Chirurgia (LM6)
a8eea8713d77498bb77e5e4b7f3f460d,Softwarized and Virtualized mobile networks,INFORMATICA (LM)
d352861fb0cb4f5e9f28b0330465a885,Diritto processuale civile,Giurisprudenza (LM5)
aaf5cfae54e94d6698301acf79bbb345,Fisiologia umana,Medicina e Chirurgia (LM6)
dc9d39585b1c41528c834b538f65599f,Infrastrutture viarie,Ingegneria Civile (L2)
076cd09361f34b6eaf61bcf8487073a5,Quality and innovation engineering,Management and Industrial Systems Engineering (LM)
b386f17f310c45c5ac56407c0b625932,Electronic materials and technologies,Mechatronics Engineering (LM)
6666f147127e43899f7abc4dd43fe1ee,Advanced analysis,MATEMATICA (LM)
38c2cc41362f45f7950b3c893148dc65,Laboratory of Advanced Photonics,FISICA (LM)
11f9c160edd34ac68198d5d4aa7f315e,Fundamentals of Artificial Intelligence,Artificial Intelligence Systems (LM)
86d77217602c45daa3acc657d000ac2f,Radiation: detection and applications,FISICA (LM)
dfa0685d43b44f50b6776e3071df956f,Philosophy of Law,"Comparative, European and International Legal Studies (L2)"
da9177cfa6ce4c9f8e0190212b6c5a3b,Storia della scienza e delle tecniche,Filosofia (L2)
1a4788541a32442fbd035e81b2b6d4d0,Dottrina dello stato,Giurisprudenza (LM5)
b96b1802453f456f9c775fe8287bae29,Scientific Writing and Presentations in English (B2a),MATEMATICA (LM)
8d7b9564e27a4b2d8b280dd858c2af12,Introduction to programming,Behavioural and Applied Economics - Economia Comportamentale e Applicata (LM)
184acb0e26b447878ea3765bdf531d34,Introduzione all'economia,Economia e Management (L2)
8fa5eb94a6df40748c68d66d9d276217,Diritto pubblico,Sociologia (L2)
d1a55f9856e94396b893fb839a0d6a31,Organizational Behaviour,Innovation Management - Management dell'innovazione (LM)
65ad663089f742dbb70e3549c547c445,Ecologia applicata,Ingegneria per l'ambiente e il territorio (LM)
acc3aec20add4c59bcffeb3f14221a34,Paleografia II,Beni culturali (L2)
7ac81e5ff83c46dda201b0fdbf639538,High Performance Computing for Data Science,Artificial Intelligence Systems (LM)
457fe412ffb24c089e6d379eb6726410,Psicologia del lavoro e delle organizzazioni,"Organizzazione,società e tecnologia (LM)"
d67809fcd0bd4e5bb731c9f4f34dd2b3,Introduction to robotics,Mechatronics Engineering (LM)
8abeb883d1464dc185af5e841ff33932,Organic and Biological Chemistry,Biologia Quantitativa e Computazionale (LM)
8f4d5cb377c9438a9cb831d4cb290838,Criminologia,Giurisprudenza (LM5)
a3a5acf51dfc40b5822ce1fdd2657c3f,Sicurezza in laboratorio - UniTrento,FISICA (LM)
749db5c2f86c4e879be0b8c3d91cb308,Labour Rights in the Global Economy,EUROPEAN AND INTERNATIONAL STUDIES - STUDI EUROPEI E INTERNAZIONALI (LM)
e79752bfcb244b119af38c98207cff33,Macroeconomics,Behavioural and Applied Economics - Economia Comportamentale e Applicata (LM)
b642417b0b844220aa069d5873531d18,Statistical Methods for Experimental Sciences,BIOTECNOLOGIE CELLULARI E MOLECOLARI (LM)
c038ef3554ba4597a437c2de8ca77050,Advanced materials for Energy Engineering,Ingegneria Energetica (LM)
4a4ef129655d41d38d21603bb84e315f,Modeling and simulation of mechatronic systems,Artificial Intelligence Systems (LM)
84b9c918cc5d4c1b8b91f59f5f1bd078,Space and culture,Sociology and social research - Sociologia e ricerca sociale (LM)
a67577fe981d49618666984c9404b999,Corso di inglese B2a - I periodo (estensivo),Centro Linguistico d'Ateneo (CLA)
519213922ca84c4cb610ec58bb284f3c,Corso di italiano A1 falsi principianti - I periodo (intensivo),Centro Linguistico d'Ateneo (CLA)
dc1f211639e649bb9290f5294cc80fd5,Modelli di decisione per la gestione_,Economia e Management (L2)
9389de2382124f09a9b6babbe5af98da,Automated Planning: Theory and Practice,Artificial Intelligence Systems (LM)
8ddd983bab5a4f078c1bdd588f8e2c5a,Computational physics,Biologia Quantitativa e Computazionale (LM)
9befcea81c084b3382f00a513864b959,Storia del collezionismo,Storia dell'arte e studi museali (LM)
03b5d77d8f9b4e33ae86a314770b20ff,Istituzioni di diritto privato II,Giurisprudenza (LM5)
d3c9764b9e3d4fb1a29dedd3b558f350,Meccanica dei fluidi,Ingegneria per l'ambiente e il territorio (L2)
8e0422af549247878ad6b61dddf3ff56,Bio-signals and transducers,Mechatronics Engineering (LM)
5bc3b6f1df4041c9ad6aec7b92084211,Analisi matematica I,Fisica (L2)
aa5e67a247d841878d4575ed5a23ba49,Modeling and design with finite elements,Management and Industrial Systems Engineering (LM)
615af854dc73478c8063881f8a668d81,Metodi qualitativi e applicazione di teorie linguistiche,Scienze e Tecniche di Psicologia Cognitiva (L2)
5c0fb27d56e543768ac70447acb2d7f5,Polymeric materials engineering,Materials Engineering (LM)
7ad348cf1a9c4fcf8e600c94caaf677a,Seminario: Introduzione alla teoria politica,Sociologia (L2)
03c0078fbe5a48f6bbf9d61a8e456436,Algebra A,Matematica (L2)
ac8894c4d6ad40d69af61da867bf9f9a,Storia moderna II,Beni culturali (L2)
e35627c56bb74165aa61f1e9eb50dab3,Iconografia Teatrale,Beni culturali (L2)
74f6ea7c4d9a4a748fcf26cc29ec056a,Basi biologiche del comportamento,Scienze e Tecniche di Psicologia Cognitiva (L2)
8e0606cddae542148b524338f8aeb560,Climate change and Energy Law,Giurisprudenza (LM5)
bc67192c52d848788cbfcfe7799b6c3b,Sviluppo professionale e imprenditorialità,Interfacce e Tecnologie della Comunicazione (L2)
aabd29318e5c4e359b5e07d01c311cd0,Sociologia dell'organizzazione,Sociologia (L2)
11e2eee28f9f4db4a43374126d4c6565,European and International Politics (Basic),EUROPEAN AND INTERNATIONAL STUDIES - STUDI EUROPEI E INTERNAZIONALI (LM)
998ba8dd86304d369273f90dfde97176,Decision and risk analysis,Mechatronics Engineering (LM)
bafbd3915aa34e09ad57a709349012ea,Diritto di famiglia,Servizio Sociale (L2)
f2c9ce5172564df3a4e05d94fddf7e0f,Data mining,INFORMATICA (LM)
6a7463e4e89c4c4aaba2a75858bab248,Studi urbani,Sociologia (L2)
ed441064daf14b93a930603747029143,Law and Data,Data Science (LM)
7b23cc877de34f6dada6b7903eadf763,Foundations of Cognitive Psychology and Neuroscience I,Cognitive Science - Scienze Cognitive (LM)
97e926cccf8d46de86c63bc0eeff34dd,Calcolo delle probabilità,"Ingegneria Informatica, delle Comunicazioni ed Elettronica (L2)"
de08347f1f314f17b781032e756a6eeb,Bio-signals and transducers,Materials Engineering (LM)
fb7fa972776544e58382ff379fa4cb28,Design methods for unmanned vehicles,Mechatronics Engineering (LM)
1a6654a9511a4d8db1df404bd4754cac,Basics of optoelectronics,"Ingegneria Informatica, delle Comunicazioni ed Elettronica (L2)"
13f345745acb407c919af215e72f2cb2,Sociologia dei processi culturali e comunicativi I,"Mediazione linguistica, turismo e culture (LM)"
51d7c45e4427466bb53b9bad1b18f8ea,Energie rinnovabili,Ingegneria per l'ambiente e il territorio (LM)
7e59ca01aaa64b8580800072fb06e980,Antropologia culturale,Studi internazionali (L2)
63bfd55e1175426bbbd5cd56ccdc410a,Algebraic geometry II,MATEMATICA (LM)
b78e49961ba44418a3f360ce44b70af2,Economia e misurazione aziendale,Matematica (L2)
4b3b16dcf24243e3a4d7a5474efb9ee6,Genetica,Informatica (L2)
fb6b7b54221042fb86b3dc251aadb89d,Bio-Inspired Artificial Intelligence,Artificial Intelligence Systems (LM)
9eb2581fe4a94d7fb253cb2a5050f1b5,Networks and organizations,"Organizzazione,società e tecnologia (LM)"
dc46f4d9d46b41dd8aac95a12dfc8c00,Introduzione all'economia,Gestione Aziendale (L2)
77b6ce0c37984691a0ce24b8c1045f9d,Crash course - Legal Foundations,International Management - Management Internazionale (LM)
c9215a416bc542bcb590e2ba5a7cef50,Biodiritto e Bioetica,Scienze e Tecnologie Biomolecolari (L2)
cf861166e8784736a9bb331eef43b638,Interdisciplinary laboratory: Ceramic materials,Materials Engineering (LM)
2cb9a277df4843cbb2ac88548b749b78,Molecular Physics,Biologia Quantitativa e Computazionale (LM)
8e725a30c43a4eb1b7955f4524ff5405,Storia del pensiero economico,Economia e Management (L2)
6634eefdda1d491797a695b0b22765e0,Proteomics and Protein characterization,BIOTECNOLOGIE CELLULARI E MOLECOLARI (LM)
8cf66f6a95ba491c98d2dc0ed934d159,Economia e misurazione aziendale,Economia e Management (L2)
74bcb01049cf45c096f61b1b6277c99c,Lab. appl.: Dalla ricerca bibliografica alla stesura del testo: linee guida per la redazione di una tesi di laurea,Giurisprudenza (LM5)
fa1a3a0fdd5c4214b6a35d7aa95be247,Applied Cryptography,MATEMATICA (LM)
7cff630aeda6429b81a263ed48f371bb,Storia delle istituzioni politiche I,Scienze storiche (LM)
c619185244dd4c0a81e6bc0357b7846c,Sociologia della famiglia,Sociologia (L2)
bf58d2a1c2f74a4ba00ee8e0fb406fe0,Bridging HCI to Computer Science,Human-Computer Interaction - Interazione Persona-Macchina (LM)
4c6050dce6a141a89fceade92e500e93,Diritto internazionale,Giurisprudenza (LM5)
69e594932eee434eaa8d35ff54471d93,Mathematical Biology,MATEMATICA (LM)
ea847437e2f8437e8e31b047f5fc1785,Short cycle breeding and innovative techniques to improve product quality,Agrifood Innovation Management (LM)
6e5f3f9d7be34167938ab087a330e739,Design di software con gamification,Interfacce e Tecnologie della Comunicazione (L2)
a76bf7ba43684835aa5cd6ae7e218a6d,High Performance Computing for Data Science,Data Science (LM)
f20fffb3c4434b9b882258f345033e0c,Elementi di astrofisica e cosmologia gravitazionale,Fisica (L2)
cf9003ff586843d48321adde2f5c0f2e,Storia moderna II - LM,"Letterature euroamericane, traduzione e critica letteraria (LM)"
720ae1825d834d29902f70e4e75f4f50,Linguistica spagnola I,Lingue moderne (L2)
4c96103b70474fee93448f0353d8fcb5,Matematica e Statistica II,Scienze e Tecnologie Biomolecolari (L2)
40017c3fb6cb4cdeaf4b43a734e42293,Bioinks and 3D printing,Materials and production Engineering - Ingegneria dei materiali e della produzione (LM)
7010484303cd41838de98c5803cc7f12,Business and Consumer Transactions,Economia e Management (L2)
b69dcf5a4e45489ea743a7c0dce3ea75,"History and Politics of the Middle East: Conflicts, Ideologies and Democratisation","Security, Intelligence and Strategic Studies (LM)"
b9d494b7d53e4af8ad034c889d0774b7,Language and Social Cognition,Artificial Intelligence Systems (LM)
f9360219b6914975a89fd9bca804ce6b,Geospatial analysis and representation for data science,Data Science (LM)
515e70b853154fa88b79290537fd603d,Security testing,INFORMATICA (LM)
90b3f68e57c3464ab3463a863e9d6c94,Organizzazione e gestione aziendale,"Ingegneria Informatica, delle Comunicazioni ed Elettronica (L2)"
2e8a3631025e4fefb778e7182e645317,Reti logiche,"Ingegneria Informatica, delle Comunicazioni ed Elettronica (L2)"
427fccf7e9164002856cdb658f9f64c9,Applied Cryptography,INFORMATICA (LM)
52e1a6dd65344e96ad98f841c72a8981,Simulation and performance evaluation,INFORMATICA (LM)
c26ac7738ea449e3944f6e78a990e8b4,Finanza aziendale progredito,Management (LM)
93a554d818de48a3b1b9dd29aa3c2442,Sicurezza strutturale,Ingegneria Civile (LM)
f4fed73424cb49cc86554fd7381e8da1,Computational methods for transport phenomena,FISICA (LM)
51aacc4b598449bc84e1a53155c272e6,Istologia ed embriologia,Medicina e Chirurgia (LM6)
b95ec8a3bc5740e297d2b4d1d4cd42ad,Innovative plants and automation for the agri-food production and transformation,Agrifood Innovation Management (LM)
c9190ff4e8414b8ab75487e92448c638,Viticoltura 2: Tecnica viticola con esercitazioni,Viticoltura ed Enologia (L2)
d7aeeffc62ca40b0b920153875084d07,Digital signal processing,MATEMATICA (LM)
3f4381c0e6fd4f6e9ebc02665717216a,Scienze Umane in medicina,Medicina e Chirurgia (LM6)
9a9fdd1db3de45ef864eaea96676877e,Economia del lavoro e della famiglia_,Economia e Management (L2)
96383957655a4955b09acbdb4609a88b,Business Development Laboratory,INFORMATICA (LM)
cd262a6542ad47829e1ee3eb74805aca,Filologia romanza,Studi storici e filologico-letterari (L2)
7220775bd30142c38b73abf55f9f4972,Epidemiologia e prevenzione,Medicina e Chirurgia (LM6)
0b8c6e1e872845d2ab718f818273d0e1,Fisica generale II,Fisica (L2)
a329580d416c4ab58660dbce85219356,Progettazione di impianti di trattamento delle acque,Ingegneria per l'ambiente e il territorio (LM)
0412d3e9c4064c0884c1b9a250ef24da,History and International Relations of the Middle East,EUROPEAN AND INTERNATIONAL STUDIES - STUDI EUROPEI E INTERNAZIONALI (LM)
5350fac015c6484aa2b2f28f82c09bb0,Judgment and Decision Making Laboratory,Economia e Management (L2)
b7fecdb09bd54d1ea5ce203b0b1ab205,Progettazione e valutazione educativa,Percorso 24 CFU (CS24)
42227f4fa20644d0b0e5c32439201c52,Mathematical aspects of bioelectromagnetism and imaging,MATEMATICA (LM)
a90297e1663c4369b2f1f8aabe5bb54e,Linguistica inglese II,Lingue moderne (L2)
e9c0c4ea418a438e908fd3612719c399,Economia dei sistemi agro-alimentari,Amministrazione Aziendale e Diritto (L2)
c6b97e5206894e5581a21e3ce599836c,Enterprise information system,Management and Industrial Systems Engineering (LM)
c28690acde614da1a42994024f4d343c,Costruzioni idrauliche con nozioni di Idraulica,Ingegneria Edile-Architettura (LM5)
fcba8fd4d7494bbcaa0d71202e1c434f,Corso di italiano B1a - I periodo (estensivo),Centro Linguistico d'Ateneo (CLA)
3520c4891dae4d05a57220ac49affad9,Storia del teatro e dello spettacolo II,Filosofia (L2)
392bff774df543b194bbe0a6b5d81594,Marketing game,Amministrazione Aziendale e Diritto (L2)
5fe1788ae8fe42eb8f3120ab66d3fa1a,Cultura e letteratura russa,Lingue moderne (L2)
9ed81d0c1a684c669c696e86a3ac9909,Tedesco giuridico B1,Giurisprudenza (LM5)
74c29d6120804e6a9e04272f3ea2e517,Scienza delle costruzioni,Ingegneria Edile-Architettura (LM5)
058560b9d2204cbeb2ea5dc810710295,Business plan,School of Innovation (CS)
9b01915adbab40f88356a3d2934bedbf,Network modelling and design,Ingegneria dell'Informazione e delle Comunicazioni (LM)
73ad0d264eb44f53b5a0a59b6120cac3,Storia contemporanea extraeuropea,Scienze storiche (LM)
3dc1d8bb71434e30a8e1dcd262a1587d,Ecoidraulica,Ingegneria per l'ambiente e il territorio (LM)
d6ee03154b2d4c85bb0f4324eae3dbfc,Processi partecipativi di governance,"Organizzazione,società e tecnologia (LM)"
870eefba5ef44cbbb648b1163dae9982,Polymeric and composite materials engineering,Materials Engineering (LM)
0e9f820f048a4fa58e8357df59312a64,Environmental Sustainability,"Ingegneria civile, ambientale e meccanica (D1)"
d8d9f8126456448d8effc6c938a87e68,Optimization techniques,Artificial Intelligence Systems (LM)
67cb7cdf381b4ae3bb1529d6242f0d7a,Storia dell'architettura contemporanea,Ingegneria Edile-Architettura (LM5)
3f9a7482b91741fca660d023601422b3,Pedagogia della socialità digitale,Filosofia (L2)
ee91cf0a0b1e4b8b96a852483979a77d,Laboratorio di fisica I,Fisica (L2)
7d206baac2fa46069f775a975354a1e4,Formal Techniques for Cryptographic Protocol Analysis,INFORMATICA (LM)
834a592902a24874baf5409f709b0416,Scientific programming,MATEMATICA (LM)
bd61de0213324a82bb4353ed93643e55,International Sustainable Development: Methods and Projects,Global and Local Studies (LM)
e4bf25e2aeaa452bb7eebfe68aff9365,Analisi dei dati e Statistica,Gestione Aziendale (L2)
8f408c8e825c46be9bcfbad7e7ed975e,Geometria e algebra lineare,Ingegneria Industriale (L2)
74832d9d887147cab8f7fa460b23f0b4,Macchine ed elementi delle macchine,Ingegneria per l'ambiente e il territorio (L2)
cf643107cc7b45d885aeaf9df61e6daf,Diritto del lavoro,Amministrazione Aziendale e Diritto (L2)
7a983e8247f84f1f945a8ec3a4754332,Scientific Writing and Presentations in English (B2a),FISICA (LM)
1f4e708c571f47a494403a856822fa9a,Dynamics in systems and networks,Management and Industrial Systems Engineering (LM)
a2b0986b99ad40bb840033c0f6215a8c,Seminario: Diritto dell'edilizia,Ingegneria Civile (L2)
9b19884106d741599811c697b897eaa7,Tecnologia dei materiali con Laboratorio di chimica per l'ambiente,Ingegneria per l'ambiente e il territorio (L2)
d7800542128e4bfbb3d4ff20060f49b3,Inquinanti emergenti e strategie di risanamento,Ingegneria per l'ambiente e il territorio (LM)
58224a775e4a48faa3a966f585fbe358,Linguaggi formali e compilatori,Informatica (L2)
5e8186c3dad441beaf7ffbbbdbd4376d,Introduzione alla pedagogia,Filosofia (L2)
