id_course,articulation,title
284d58ae84044d39845287867cb0a482,Inquinanti emergenti e strategie di risanamento,Ingegneria per l'ambiente e il territorio (LM)
9842c6b459e0412e9d3352face222c8e,Elementi di pensiero teologico,Filosofia e linguaggi della modernità (LM)
f816fc6c8b664d47b78e0429467effae,Economia e misurazione aziendale,Amministrazione Aziendale e Diritto (L2)
15ff421efb7c4b268785cc782acdaa37,Chimica agraria e biochimica con esercitazioni,Viticoltura ed Enologia (L2)
93e38d2ebfc0462f932c4ae7bd6adfa4,Data hiding,MATEMATICA (LM)
ade335c97711438a92365c01cc902cce,Project course,Ingegneria dell'Informazione e delle Comunicazioni (LM)
6dfb45c48b754840b91e399755e08fe9,Storia contemporanea IV,Studi storici e filologico-letterari (L2)
f21e860a7f2d44288751ae77cbeec9f3,Science storytelling and its discontents: a critical view,Communication of Science and Innovation - SCICOMM (M1)
ded02e0d6fef4bb08fa37aa570b00df5,Filologia italiana I,Studi storici e filologico-letterari (L2)
68867537e6434806b143d0b94b151303,Fisica nucleare e subnucleare,Fisica (L2)
8cb77831a0254ae281cf5956b8983e55,International Economic Policy,Economia e Management (L2)
4850f51987034e56a33ec073375a4296,Cognitive Neuroscience and Neurotechnology,Human-Computer Interaction - Interazione Persona-Macchina (LM)
45c4cc75fc304698bdf0706c2fbc8ed6,Understanding and Communicating Law and the Life Sciences,Communication of Science and Innovation - SCICOMM (M1)
5eebdb2920a14a6299dd33ab2f6fcffc,Psicologia del lavoro,Scienze e Tecniche di Psicologia Cognitiva (L2)
351bfaf696ca48a5ad5f1c0506675a18,Quantum Computing,INFORMATICA (LM)
0388a03914b14da39114c278d8670ea2,Modeling and simulation of mechatronic systems,Mechatronics Engineering (LM)
83c60948daf04bf1b3a9e3662391bae5,"Flexicurity, tutele e mercato del lavoro",Giurisprudenza (LM5)
bf10c1f2f50646709811bb017a039d92,Automatic control,Mechatronics Engineering (LM)
afe4823dde804408bd0aa57b53067b28,Diritto amministrativo avanzato,Giurisprudenza (LM5)
3901444ed4304992b731de85d6a41175,BioLaw: Teaching European Law and Life Sciences (BioTell),Giurisprudenza (LM5)
6e0cea0f09714f258e0e6908b6a47978,Finanza aziendale,Gestione Aziendale (L2)
759246cb4ad84562b0d65b065086239c,"Science, Technology and Global Affairs",EUROPEAN AND INTERNATIONAL STUDIES - STUDI EUROPEI E INTERNAZIONALI (LM)
5130ecf054fc4187b1f40d1007e10ede,Quantum Chemistry,Biologia Quantitativa e Computazionale (LM)
de05f06b779848678831b687d92df952,Economia e diritto del lavoro,Gestione Aziendale (L2)
e30d55b3db6a41fa9603943eb43b6c68,Economic and labour sociology,Sociology and social research - Sociologia e ricerca sociale (LM)
1967e6f903454fab877d2c7ad2296e54,Steelmaking and foundry technologies,Materials and production Engineering - Ingegneria dei materiali e della produzione (LM)
7af49d271a2f4c00bc1a11dd6ef1eeab,Immunologia,Scienze e Tecnologie Biomolecolari (L2)
5c55f3f732894a92909cf6a97e31c520,Basi biologiche del comportamento sociale,Psicologia (LM)
7ef302fe62f8414b8648c57a82b818d6,Fisica 1,Ingegneria per l'ambiente e il territorio (L2)
bd690d2e0ffb427db1c9fac1d1e7ba44,Innovation and Business in ICT,INFORMATICA (LM)
31ae699281a14ec493e9e1bdb35d1834,"Methods for traceability, protection and authenticity detection of agri-food products",Agrifood Innovation Management (LM)
9fedd1c802354e6494a13bd272a2ee91,Storia della Fisica e della Matematica,Fisica (L2)
430f31ccdbbc418596b79022743fab99,Storia del diritto medievale e moderno II,Giurisprudenza (LM5)
ccda29c705dd4847870fa7704da34b8b,Criminologia digitale,Giurisprudenza (LM5)
ab9b9733cc1a42af96b6175a1f541fab,Linguistica tedesca I,Lingue moderne (L2)
f3307b07df1e4957bf6ae4fa42c3db8a,Fourier Analysis,MATEMATICA (LM)
ec1f566f273945528c915503b755daae,Crash course - Legal Foundations,Behavioural and Applied Economics - Economia Comportamentale e Applicata (LM)
28972cc371f240d5b2406915a3cc3cd0,Comunicazione delle Scienze,Fisica (L2)
6a40e77bb0ae47308940ab5519d3e369,Teams and Team Working in Organizations,School of Innovation (CS)
33e4a90c4cf04ec3b15891fe70ec65a8,Optoelectronics and quantum devices for sensing and automation,Materials Engineering (LM)
2f7a336826c04b00a0272776ef649cff,Economia,Gestione Aziendale (L2)
fc5f706043af416cb893a07b7b04dc1a,"Il diritto della sicurezza nazionale, internazionale e dell'Unione Europea",Giurisprudenza (LM5)
f8f82879b95b49cda2ab5ef1fe959eb7,Competenze trasversali per la carriera lavorativa,Sociologia (L2)
f0b4e1fc61b04db9acf003bc480cd7bd,Physics and thermodynamics of materials,Materials Engineering (LM)
5f5524c9fa2e42cc84487e6c741f3355,"Course works, project works",Communication of Science and Innovation - SCICOMM (M1)
b0a58e9571ab407dab54e75bfaa938d3,Ingegneria fluviale,Ingegneria per l'ambiente e il territorio (LM)
6d45b084534444caba70450e04076a10,"Experimental design and sampling plans, statistical tests and programming for the analysis of agri-food and environmental data",Agrifood Innovation Management (LM)
d0e5cbdd77d44c7e85aa282ccb4cd46d,Chimica organica,Fisica (L2)
95be6d0716b542a19971adca8899463c,Sostenibilità in cammino,Giurisprudenza (LM5)
42b7381fd11547c7833192ef985ae7aa,Comparative Constitutional Law of groups and minorities,Giurisprudenza (LM5)
6f451b9a721d419a89879fc52e3f0f7f,Microeconomics,Behavioural and Applied Economics - Economia Comportamentale e Applicata (LM)
cbe04cb7c3214b06b099dec638058e04,Laboratorio di programmazione per sistemi mobili e tablet,Informatica (L2)
07f2e847d9124d9a8a41750b6094bf6e,Oleodinamica e pneumatica,Ingegneria Industriale (L2)
59609f4928c346a3bd29bf2a1473c880,Advanced Coding Theory,MATEMATICA (LM)
b04aa25f16b54ecf83d4c87bdbdb0ac3,Radar and radiolocalization,Ingegneria dell'Informazione e delle Comunicazioni (LM)
b8ea6f391f924a7580944abb1f6a7363,Diritto e letteratura,Giurisprudenza (LM5)
676356334ca54a3da561153bcb38bcec,Crash course - Economics,Innovation Management - Management dell'innovazione (LM)
16c7ae8d16504bc8911f3b73559fe028,Data Science in Action,School of Innovation (CS)
9217d792d92d471fb68bce866ce7173c,IE: From Idea to business idea,School of Innovation (CS)
ccea082872794c40bfcf5d498c441ec4,Laboratorio di analisi della cultura e del turismo e sistemi informativi per il turismo,"Mediazione linguistica, turismo e culture (LM)"
118342191c964c2e854387213bb189cf,Storia della pedagogia,Filosofia (L2)
ee423468611a4b1aaa7112374f52fa38,Nuclear and subnuclear physics,FISICA (LM)
4a8d096233ba4810b3b8dd8b5627aaaa,Analisi matematica 2,Ingegneria Industriale (L2)
8023f8a9bf6f45449da3e09cbfeb176e,Strumenti quantitativi per la gestione,Management (LM)
004fac34021c4e4bb5bf21f9c38e11c3,Medicinal Chemistry,BIOTECNOLOGIE CELLULARI E MOLECOLARI (LM)
db79d9644d7440bbb9ef7dde69017f58,Deep learning,Mechatronics Engineering (LM)
4e05e00f689f4dc78d11095473be88b4,Digital social data,Sociology and social research - Sociologia e ricerca sociale (LM)
cc03bc5116af4f7bb7f417c3425b21cb,Mathematical Physics - Differential Geometric Methods,MATEMATICA (LM)
2cccac5baeeb4e639327d949e8059b71,Fondamenti di meccanica,Ingegneria Industriale (L2)
e2679c1967b04227aac36384c6ea2bef,Gravitational Wave Astronomy and Multimessenger observations,FISICA (LM)
c54e9de7b148427cb7f522005b580ba1,Filologia italiana II,Beni culturali (L2)
416a8a3d02f342e19d042de8e23cc890,Linguistica francese II,Lingue moderne (L2)
2370946ba79e4feebcadf958f58f5f45,Evidence Based Management,Management (LM)
7d1dac81c3304fa8bb1e513f5530ecfe,Comunicazione scientifica,Psicologia (LM)
4a90130ac6cf40cbbd5a3eb7b93c9a86,Administrative Law,"Comparative, European and International Legal Studies (L2)"
9beec9e7c2c74f348a7299be00d28c35,International Security and Strategic Studies,"Security, Intelligence and Strategic Studies (LM)"
d6798aae84c24dd99bc0151801998829,Physiological flow and transport in porous tissues,MATEMATICA (LM)
f40a11516d764d2093ac11a3a5adfc66,Scientific Programming,Biologia Quantitativa e Computazionale (LM)
a221ba6b9e974d9d9a76eb74e7600758,Statistics Laboratory,"Security, Intelligence and Strategic Studies (LM)"
fa97e042937c43aa9a21137fb538e37f,Progettazione di infrastrutture idrauliche urbane,Ingegneria per l'ambiente e il territorio (LM)
72f037bdd3b949b19fb0d756ad7e2db7,Philosophical Insights,Filosofia e linguaggi della modernità (LM)
d798d612b1304f2a8fec19c1a7d620e6,Statistica per le ricerche di mercato,Gestione Aziendale (L2)
539cbdb1939b4c4c9ced0e01ef76ef2e,Physics of the Climate System,Environmental Meteorology (LM)
81a576827987495c9babc3f8194ba5a4,Atmospheric boundary layer and turbulence,Environmental Meteorology (LM)
7650ff02738f4007823f3c4535b91737,Party Politics and Democracy in Europe,EUROPEAN AND INTERNATIONAL STUDIES - STUDI EUROPEI E INTERNAZIONALI (LM)
f1d65f6ff0d5488a8b32cd50fd6aa421,Psicologia della formazione e dell'orientamento,Psicologia (LM)
16a3a27c3c7545f6845e1559eb4edfd9,GPU computing,INFORMATICA (LM)
ffe1dea59d0840908102bd9aa4ae0c76,Economia dell'ambiente,Amministrazione Aziendale e Diritto (L2)
c858e099a2ad43df88a58ad20f7f6869,Distributed Robot Perception,Artificial Intelligence Systems (LM)
02d6323fd437497489668212bdde1e2a,Ingegneria del Software,Informatica (L2)
99aaa7aa84464873aeb1cc0a1a4bae55,New topics in social cognition and intergroup relations,Psicologia (LM)
389fb01212c243f0b742b883c7b51134,Modern Physics,MATEMATICA (LM)
4f7d306c46e7420799b857ea6c596a00,Medicina narrativa,Medicina e Chirurgia (LM6)
8110bb7c193041c6a2a236859b238706,Data mining,INFORMATICA (LM)
dae0703c089440f7b05cc905bf072a30,Aspetti criminologici e giuridici del fenomeno mafioso (corso libero),Giurisprudenza (LM5)
b5093712d0e64933ae4117d7d43ca319,Nuclear Astrophysics,FISICA (LM)
9aff0a35a204467785734389bca759a5,Servizi sociali innovativi,"Metodologia, Organizzazione e Valutazione dei Servizi Sociali (LM)"
ce840fcd43d24961bfcd4ae68d204bce,Statica,Ingegneria Edile-Architettura (LM5)
f6b1a3bfc6f34115994757f0a7cd2e32,Statistical models,Data Science (LM)
09f5e795e7294ed3a59228627bdf91ff,Academic Freedom and Human Rights: European and International Perspectives (J. Monnet module),Giurisprudenza (LM5)
9eb05ccaec104d288701fbdb9a55a18e,Geometria e algebra lineare,"Ingegneria Informatica, delle Comunicazioni ed Elettronica (L2)"
6158c8d942694918a1f2f8d4be178483,Stochastic differential equations,MATEMATICA (LM)
ea8c773d35d643b4aba9bf20896cb172,Tecnica delle costruzioni meccaniche,Ingegneria Industriale (L2)
ccac108eee084e369857f06bc46ad51a,Storia moderna II - LM,Filologia e critica letteraria (LM)
8e0d39cb13c04ef4b99b7055c51a786c,Psicologia del pensiero,Interfacce e Tecnologie della Comunicazione (L2)
b9a9df909a7b43818a510aa6d4badead,Processi di trasporto nell'ambiente,Ingegneria per l'ambiente e il territorio (LM)
c7bd45daa1a347bf903fd3f92484ff7a,Diritto d'autore e arte,Giurisprudenza (LM5)
505cd4c9cd7343fb9345ce4788c5389d,Storia della Cina moderna e contemporanea,"Mediazione linguistica, turismo e culture (LM)"
9cf6c2e923034a4d9fc6b1fb416bdf1f,Psychological Humanities,Psicologia (LM)
e6f4dd506ed642ae8d068353e09bfd7c,Geomatica e telerilevamento,Ingegneria per l'ambiente e il territorio (LM)
093f5ae241704f80ad5884460941d1cb,Lingua e cultura russa I,"Mediazione linguistica, turismo e culture (LM)"
384fc72c18fb41a99b98ff83caf90a03,Tensor Decomposition for Big Data Analysis,Data Science (LM)
fc88ffbde0f94e28975cf042e83e35f1,Managing the new Product Development Process,School of Innovation (CS)
5d6c7f38a5a54cf286a0685074b53fa9,Calcolo stocastico progredito,Finanza (LM)
b657827bc9a740868dc4501ef7e7fb0e,Letteratura tedesca I,Lingue moderne (L2)
091f4006e1764538a532ed97959365f6,Fondamenti di automatica,Ingegneria Industriale (L2)
50aa26592090483ab284ada41bbd3906,Economic History,Gestione Aziendale (L2)
cbb6e90e6d444c85847ce7a8b5b52331,Calculus 1,"Ingegneria Informatica, delle Comunicazioni ed Elettronica (L2)"
8e80dd32ade74af9bcaa8fd3a961c4e2,Laboratorio di psicologia delle decisioni,Previsione Sociale (M2)
09830af403ac4151855f583401cad665,Economia finanziaria,Finanza (LM)
a09142af250249e6a0f4bad240fb8aa8,Introduction to Financial Accounting,Economia e Management (L2)
4e1d22ddac404d8286f8192fe9e5962f,Quantum mechanics,Biologia Quantitativa e Computazionale (LM)
f098baf5d1bf4384b0fcbfe19b774782,Geografia economica,Economia e Management (L2)
812afa0fba354b1bb5b66b230b022f1f,Set theory,MATEMATICA (LM)
62af4b09adbb48f6af310252ee55f9ad,Archeologia classica,Filologia e critica letteraria (LM)
e811f11ae539444e8a69dc24b06e757b,Letteratura inglese I,Lingue moderne (L2)
3e2c27587c8946a0aef9ea82df6b8b78,Filosofia della religione - LM,Filosofia e linguaggi della modernità (LM)
76b8cc759e294af39fec9afd68cd3f16,Laboratory of Internet of Things,Management and Industrial Systems Engineering (LM)
50efb96b7ab247dda8b76d9420856d28,Valutazione economica dei progetti,Ingegneria Civile (L2)
a71118d0bca349a7ae4f0cf1d016ea8e,Advanced optimization-based robot control,Mechatronics Engineering (LM)
cde0f59e282d4b7a861b109ea45d39f1,Data Analysis and Statistics,Economia e Management (L2)
92a2be8411bb4874a086abeebe1c740a,Laboratori,Gestione delle diversità: inclusione ed equità (GEDIE) (M1)
a82be1bbfba14622a19616586703fe85,Gestione sostenibile delle risorse naturali,Management della sostenibilità e del turismo (LM)
7f328de3f4fd4043b565582b3ce78360,Economia dell'ambiente e del territorio,Management della sostenibilità e del turismo (LM)
9c157b4188624773a77dc1021447d1d5,Modelli di organizzazione per il servizio sociale,Servizio Sociale (L2)
bbf13f1e0abe481f8ab1ecbad32f0f80,Teorie e tecniche delle comunicazioni di massa e digitali,Global and Local Studies (LM)
5124b1f4a484495092e09341ce973294,Statistica matematica,Matematica (L2)
67b7017c1e0546c5a6b02ca854a69161,Revisione aziendale 2,Economia e legislazione d'impresa (LM)
4b698bac04ca4efe93eec0c07da7a68c,Environmental measurements,Environmental Meteorology (LM)
60a41a9fabb444d48cb9f337419e60b1,Applied Immunology,BIOTECNOLOGIE CELLULARI E MOLECOLARI (LM)
4fca061ee62f4866aef389d71d0e4d12,Informatica,Matematica (L2)
59474c2daedf44f3a64059de27921597,Storia del pensiero medievale e premoderno,Filosofia e linguaggi della modernità (LM)
70051d4522ae4ad3b89989807db5aed2,Basi di dati,Matematica (L2)
04bfa5af66f44e3b8ff68d7c00e31c3a,Visual Communication of Science,Communication of Science and Innovation - SCICOMM (M1)
86ecbc8d710045beaa81db49e946eaf0,Lab. appl.: Gli atti processuali nel diritto amministrativo,Giurisprudenza (LM5)
885d7cbfbca047aabcda967272403a1b,Industrial Economics,Economia e Management (L2)
8bf4b0e027564147b45379ff7120a04d,Natural Language Understanding,INFORMATICA (LM)
af2875b04ab24f6c91e1f2bc4145c55c,Corso di tedesco A2a - I periodo (estensivo),Centro Linguistico d'Ateneo (CLA)
30ad76a70af94b849eda3d5c07813905,Go to market,School of Innovation (CS)
f28eaba1b0fe44b6bd769fd309eb7935,Architettura del legno,Ingegneria Edile-Architettura (LM5)
ba5fe3f765da4f24968af52e44e935e9,Costruzione di strade,Ingegneria Civile (LM)
5095a37f82a348deacfb9f2314f8337a,Corso di cinese A1a - I periodo (estensivo),Centro Linguistico d'Ateneo (CLA)
f71c12494ace41458845e8c7c96084d8,Bibliografia e biblioteconomia,Studi storici e filologico-letterari (L2)
c62ce382530341d4b4107ec60f8bc76d,Storia della lingua italiana II,Filologia e critica letteraria (LM)
2a297c43d3f8438d89feff995c27f0df,Costruzioni in legno,Ingegneria Civile (LM)
b8dba8fd9f764b8b8c65dc59f5ee6e9d,Diritto penale dell'economia,Economia e legislazione d'impresa (LM)
e9f1db46ba394c3fbc3ebc0f1172e809,Soluzioni basate sulla natura per la sostenibilità urbana,Ingegneria per l'ambiente e il territorio (LM)
02ff61feb47f43318d90367e6bd4d030,Softwarized and Virtualized mobile networks,Informatica (L2)
89df8261c50a4bc1b19a5a118aacf6d6,Business Development Laboratory,Artificial Intelligence Systems (LM)
13ca5f2ee7df44c48ad0def8d3a08f62,"Contabilità, bilancio e principi contabili",Amministrazione Aziendale e Diritto (L2)
4a7986a1efff48ecaf7bf99396203d4e,Inglese giuridico C1,Giurisprudenza (LM5)
e0ff94624f10466cbc56f253907b134f,Concurrency,INFORMATICA (LM)
88a183889ee744a1a24509ffc3ed9831,Ultrasound Technologies for Medical Applications,Artificial Intelligence Systems (LM)
4cc8eaeeb562463a94f271d061eb3ff7,Intelligent distributed systems,Mechatronics Engineering (LM)
7fcc69243c4247c2a42265e06b371a25,Economia e misurazione aziendale,Amministrazione Aziendale e Diritto (L2)
4e87a183ffe448c0b3a4c2863275e7cb,Letteratura artistica,Storia dell'arte e studi museali (LM)
a98c7aa7b1c147628a574302f1bb326c,Archivistica II,Beni culturali (L2)
c629aef359db48d4b827618676a1c462,Academic writing,Studi Sulla Sicurezza Internazionale (LM)
fbdb462a4fd64c5ab56fa65b02cb93d9,Programmazione avanzata,Informatica (L2)
a4134d3bcd514ffc9ea5683f5b0b0993,Instabilità delle strutture,Ingegneria Civile (LM)
8d02bc0848db4fefbc5eddc5e6803080,Cellular and Molecular Neurobiology,BIOTECNOLOGIE CELLULARI E MOLECOLARI (LM)
9d71b5b62bb1407f8195e6c75f13fb58,Ecologia applicata,Ingegneria per l'ambiente e il territorio (LM)
0dd437fef9bc43eeb00521db9c195a0d,Network-based Data Analysis,Biologia Quantitativa e Computazionale (LM)
f11fad55168645ac933ad0124e06f8de,Fondamenti di elaborazione dei segnali,Informatica (L2)
ba156b3a074b42a4b529d6e2a0ce9374,"Seminario: La sociologia interpretativa: interazionismo simbolico, Erving Goffman e l'etnometodologia",Sociologia (L2)
20b20ae365c34437a77c06017b535c1e,Laboratory of biological data mining,Biologia Quantitativa e Computazionale (LM)
b44c9a2241694c19ad07a5a5084a5517,Quantum Chemistry,Biologia Quantitativa e Computazionale (LM)
72233fcb22074f06b8681c6e9dc0153c,International sustainable development,Ingegneria per l'ambiente e il territorio (LM)
0bce60449f964faa9740101aeb6f7cc6,Distributed systems 1,Ingegneria dell'Informazione e delle Comunicazioni (LM)
8dc859ab4a074aa88c0fec08b5ffc7b6,Ingegneria alimentare ed impianti enologici,Viticoltura ed Enologia (L2)
b27feb3760164b299fa80a23dda68322,District heating systems design,Ingegneria Energetica (LM)
4c546d404e7a4fbfbd51a531cf4b1310,Lingua e traduzione tedesca e letteratura tedesca I,"Letterature euroamericane, traduzione e critica letteraria (LM)"
15fead97466d4cc38bc6522df9538162,Advanced geometry,MATEMATICA (LM)
942db8cbaab54e3aae1951a082a9d638,Storia medievale II,Filosofia (L2)
2188c839c19241cfb03cc4b2d3c3bb55,International Economics,Economia e Management (L2)
9246308f327c486ab38c3047d2832926,Project course,Data Science (LM)
6d6dd917a2e14e9a8038b4a2ad460469,Single Cell and Spatial Omics,BIOTECNOLOGIE CELLULARI E MOLECOLARI (LM)
373ed11bb6184776adaa282f1f302b31,Analisi numerica II,Matematica (L2)
75bb4c4aa3074f10aacae6341b99e108,Gestione delle acque e dei sedimenti per lo sviluppo sostenibile,Ingegneria per l'ambiente e il territorio (LM)
0b18f12589654ece8ebb016a3185fc62,Statistical Models,INFORMATICA (LM)
3d37a9fcd9554de9824ba643102193bc,Academic and Practitioner Writing Skills for students with proficient Italian Language,"Security, Intelligence and Strategic Studies (LM)"
6b2e6650de2c49e188f82989567f41ed,Geographies of Security,"Security, Intelligence and Strategic Studies (LM)"
003a73f0b1d844b4b77b5631f682c46b,Lab. appl.: Il fenomeno successorio nell'esperienza giuridica romana,Giurisprudenza (LM5)
fb6db08e0cd94699a74b4786895c0022,Corso di francese B2 - I periodo (estensivo),Centro Linguistico d'Ateneo (CLA)
306c987a3d584724aba3660e8315c12c,Graphical models and network science,MATEMATICA (LM)
ed83e025475041faad4fc7a418e996ea,Deep learning,Mechatronics Engineering (LM)
0063ab7d5b2141189215688fc8e45af4,"Diversità, inclusione, equità: prospettive culturali e storiche",Gestione delle diversità: inclusione ed equità (GEDIE) (M1)
fcfaeca9784a417da8e868b1c2171998,Negotiation skills,School of Innovation (CS)
52766f38cb1a4d11b5410cb8ec597849,Letterature angloamericane - LM,"Letterature euroamericane, traduzione e critica letteraria (LM)"
c4c628fb99fd4c298764f8afd852ec8c,Geostoria,Studi storici e filologico-letterari (L2)
0c83f1456473414d8fb99de278ea9f88,Softwarized and Virtualized mobile networks,"Ingegneria Informatica, delle Comunicazioni ed Elettronica (L2)"
5b43fd9f532b494680a1fb2b9ecfc006,Clinical Neurology and Neuropsychology,Cognitive Science - Scienze Cognitive (LM)
270ea655d6a14d6a9440f1201d3ee650,Composizione architettonica 2 - Laboratorio progettuale,Ingegneria Edile-Architettura (LM5)
76449060d28a419d844580639b2d0854,Programmazione 2,Informatica (L2)
bd6ff734dbf745d1b76b94489d7bce7f,Diritto del commercio e dell'arbitrato internazionale,Giurisprudenza (LM5)
d1e9f4ab028e4a12b2adb5fcb3e7c59b,Civil Litigation in a Comparative Perspective,"Comparative, European and International Legal Studies (L2)"
0f8462eafbbd416a8ec7bfb858574ef5,Enologia 1,Viticoltura ed Enologia (L2)
a10cb8d13b524822ab99a77b476a8538,Microbiologia generale con esercitazioni di laboratorio,Viticoltura ed Enologia (L2)
7da44195396644408624815e16bbb376,Molecular Biology of the Cell,MATEMATICA (LM)
4a4988ba87ac4240ba56b5f2490b2e48,Sociologia dell'innovazione,"Organizzazione,società e tecnologia (LM)"
6965290b351345f291105118d024563f,Master Mind,School of Innovation (CS)
b7aab98a37dc43d6964df47a4dbac08e,Diritto comparato della proprietà intellettuale,Giurisprudenza (LM5)
b407c561fae64ac49a6ee92a12c0bdb9,Lab. appl.: Comunicazione efficace e competenze trasversali (didattica innovativa),Giurisprudenza (LM5)
cea4a5917cb141ffabd6f83ef2c7c486,"Cure palliative, Sociologia e Servizio sociale",Sociologia (L2)
a40f6fab910641d2bc9256f732d4c935,Diritto del turismo,Giurisprudenza (LM5)
487277a25c844586bd951d9e7f4481c6,Business models-Value Proposition Canvas VPC & Business Model Canvas BMC,School of Innovation (CS)
2fce93f465d1462cb89f61e8bd784d22,Marketing progredito,Management (LM)
a6d84b53b79c475a8605a07e00babb76,Test di matematica,Gestione Aziendale (L2)
b4fde5838d6f4a56895c1a3af941b4dc,Chimica fisica e Bioanalitica,Scienze e Tecnologie Biomolecolari (L2)
b4ef5a6f0c90472f9e40eb49e92be248,Terrorism and insurgency in war and peace,Studi Sulla Sicurezza Internazionale (LM)
2ff70db9cbb546c18ecdfe181d25a160,Conflict of Laws,"Comparative, European and International Legal Studies (L2)"
8ad8b1b9b86f47b592ca2cf87c661516,Financial Markets and Economic Activity,INFORMATICA (LM)
90f02a164d2f47fca1756de1995db505,Programmazione scientifica,Fisica (L2)
2c3f4506ae104a689b07d5c9395efaf1,Calcolo numerico e programmazione,Ingegneria Civile (L2)
4450489acf7d401aaa27f56c4343cf76,Didattica delle lingue straniere,"Letterature euroamericane, traduzione e critica letteraria (LM)"
95de1b3f068347e7800cf17f633a95b8,Glottologia - LM,Filologia e critica letteraria (LM)
054faf8b38b9476d885f5878ded2ced5,Digital business models,Management (LM)
33e927cf6f774219a80949a3d0e31e0f,Diritto privato,Amministrazione Aziendale e Diritto (L2)
1b9d1a3379974d5ea8e42a8cc1efc29b,Teorie e tecniche di riconoscimento,Interfacce e Tecnologie della Comunicazione (L2)
cac1057ff849466fa2d730cd95c03ca1,Storia del pensiero economico,Gestione Aziendale (L2)
64038b6190704c34ae8b3d63b3d535b4,Architetture digitali avanzate,"Ingegneria Informatica, delle Comunicazioni ed Elettronica (L2)"
ce5f95acf9bf4009b56ef1007450ed80,sis3 - introduzione alla revisione sistematica della letteratura scientifica,Scienze e Tecniche di Psicologia Cognitiva (L2)
274fc827865449268a61af076878b532,Recycling and sustainable materials,Management and Industrial Systems Engineering (LM)
66795a332e67420ea158e74c97f481f2,"Seminario: Energia, idrogeno e decarbonizzazione",Ingegneria per l'ambiente e il territorio (LM)
0eed1166040844c8a8774a4db1b821db,Calcolo delle probabilità II,Matematica (L2)
eda097a53a0e4a6fa72b3ffa0ec0a940,Sociologia urbana e Diritto urbanistico,Ingegneria Edile-Architettura (LM5)
7445be1734e347b286612f8b48711eae,Cultura classica,Beni culturali (L2)
ac270299644f4d41a150a2167cfd9833,Neurodegenerative Diseases,BIOTECNOLOGIE CELLULARI E MOLECOLARI (LM)
ec519cdb1d3148debfe648ee6c2a4b44,Controllo di gestione progredito,Management (LM)
612c0271e1c940d5b345f213b92702f6,Chimica generale ed inorganica,Scienze e Tecnologie Biomolecolari (L2)
d4d486c862b349d9b0b4034dc6966623,Fondamenti di robotica,Informatica (L2)
6a9e8d44c5054bebbe357570b56d7bf5,Mathematical Modeling in Biology,Biologia Quantitativa e Computazionale (LM)
01bfe0a6d7534257ba15d6441a9a644a,Stabilità dei pendii naturali e delle costruzioni in terra,Ingegneria per l'ambiente e il territorio (LM)
21d446f2aaa64c529de9d96e20ad2d2d,Sistemi informativi per i beni culturali,Beni culturali (L2)
832c130944504d338e5057a023940aa7,Qualitative methods,Sociology and social research - Sociologia e ricerca sociale (LM)
79bd71da52074612966eb34543616880,Seminario: Conosciamo il Dipartimento,Sociologia (L2)
7ff8ac4c59d94d53b5277203cbaaf7b1,Archeologia e storia dell'arte greca,Beni culturali (L2)
7c28b1e381c84b3bb2f5445d8969a5bb,Letteratura del Rinascimento,Filologia e critica letteraria (LM)
e415d4971bbc434bbd4b43e4015a862a,Tensor Decomposition for Big Data Analysis,MATEMATICA (LM)
c09d2dac1bac4b3c8a8aefb322dbe061,Diritto digitale,"Organizzazione,società e tecnologia (LM)"
88f870d58bdc4067b7db13dfb2ea1070,Scienza e tecnologia dei materiali,Ingegneria Industriale (L2)
7d00b69099b04fb183a13a5b28261b8e,Tecnica delle costruzioni con Laboratorio Progettuale,Ingegneria Edile-Architettura (LM5)
bf88d9f51f9c4f5d95c466a998f33879,Laboratorio di sistemi informativi geografici e cartografia tematica,Lingue moderne (L2)
c42e07c6234a405fa08ad2858f854f47,Equazioni differenziali ordinarie,Matematica (L2)
abcb090da0154a338203b8765656b692,Precision engineering,Mechatronics Engineering (LM)
abb3054cb0794c3b9f42a5fdf0148ddd,Calcolo delle probabilità,"Ingegneria Informatica, delle Comunicazioni ed Elettronica (L2)"
148321690496456f8ed1574551927f44,Advanced Topics in Machine Learning and Optimization,Artificial Intelligence Systems (LM)
