id_course,course_name,degree_program
729,Corso di italiano B2a - I periodo (estensivo),Centro Linguistico d'Ateneo (CLA)
730,Machine learning,Mechatronics Engineering (LM)
731,Advanced Academic Writing,International Management - Management Internazionale (LM)
732,Sociologia della conoscenza,"Organizzazione,società e tecnologia (LM)"
733,Physics,"Ingegneria Informatica, delle Comunicazioni ed Elettronica (L2)"
734,Elementi di fisica moderna e intelligenza artificiale,Filosofia (L2)
735,Fisiologia della cellula e degli organismi,Matematica (L2)
736,Archeologia medievale III,Beni culturali (L2)
737,Individuo e ambiente: strumenti di lettura,Educazione professionale (abilitante alla professione sanitaria di Educatore professionale) (L2)
738,Gestione integrata delle risorse idriche,Ingegneria per l'ambiente e il territorio (LM)
739,Statistica per le decisioni economiche e il management,Management della sostenibilità e del turismo (LM)
740,Laboratorio di analisi dei mercati,Economia e Management (L2)
741,"Segnali, visione e riconoscimento","Ingegneria Informatica, delle Comunicazioni ed Elettronica (L2)"
742,Laboratorio di progettazione sulle metodologie didattiche attive,Scienze e Tecniche di Psicologia Cognitiva (L2)
743,Laboratorio di systems on chip,"Ingegneria Informatica, delle Comunicazioni ed Elettronica (L2)"
744,Filosofia del linguaggio,Filosofia (L2)
745,Progettazione di impianti per il recupero di energia dai rifiuti,Ingegneria per l'ambiente e il territorio (LM)
746,Archivistica III,Beni culturali (L2)
747,Seminario: Armi nucleari e disarmo,Sociologia (L2)
748,Knowledge and Data Integration,Biologia Quantitativa e Computazionale (LM)
749,Foundations of Social and Psychological Science,Data Science (LM)
750,"Seminario: Terre Alte, crisi climatica e sostenibilità. Valorizzare l'ambiente e i prodotti locali con uno sguardo antropologico ecologico",Sociologia (L2)
751,Minimal surfaces,MATEMATICA (LM)
752,Climate change and Energy Law,Giurisprudenza (LM5)
753,Decision and risk analysis,Mechatronics Engineering (LM)
754,Diritto di famiglia,Servizio Sociale (L2)
755,Tecnologie igienico-sanitarie e energia quasi-zero,Ingegneria per l'ambiente e il territorio (LM)
756,Multisensory interactive systems,Human-Computer Interaction - Interazione Persona-Macchina (LM)
757,Ergonomia cognitiva,Scienze e Tecniche di Psicologia Cognitiva (L2)
758,Economia dell'impresa e responsabilità sociale,Management (LM)
759,Genomics,Biologia Quantitativa e Computazionale (LM)
760,Network security,INFORMATICA (LM)
761,Data Mining,Data Science (LM)
762,Cultura e letteratura inglese,Beni culturali (L2)
763,Fourier Analysis,MATEMATICA (LM)
764,Tecnica delle costruzioni in c.a. e acciaio,Ingegneria Civile (LM)
765,China and the World from the Cold War Years to the Global Era (1949-2020),EUROPEAN AND INTERNATIONAL STUDIES - STUDI EUROPEI E INTERNAZIONALI (LM)
766,Diritto comparato della privacy,Giurisprudenza (LM5)
767,Seminario: Specialist English for International Studies,Studi internazionali (L2)
768,Filologia musicale,Beni culturali (L2)
769,Relatività,Fisica (L2)
770,Corso di italiano A2b - I periodo (estensivo),Centro Linguistico d'Ateneo (CLA)
771,Automatic Control,Artificial Intelligence Systems (LM)
772,Enologia 2 con esercitazioni,Viticoltura ed Enologia (L2)
773,Business plan/analisi di progetti,Management (LM)
774,"Law, economics and digital policy",Behavioural and Applied Economics - Economia Comportamentale e Applicata (LM)
775,Ecoidraulica,Ingegneria per l'ambiente e il territorio (LM)
776,Chimica e microbiologia enologica,Viticoltura ed Enologia (L2)
777,Seminar: Advanced English for Global and Local Studies,Global and Local Studies (LM)
778,Sociology of collective action,Sociology and social research - Sociologia e ricerca sociale (LM)
779,Gestione integrata delle risorse idriche,Ingegneria per l'ambiente e il territorio (LM)
780,Matematica finanziaria,Matematica (L2)
781,Neurologia clinica,Psicologia (LM)
782,Economia sociale e organizzazioni del terzo settore,Management (LM)
783,Storia medievale II,Studi storici e filologico-letterari (L2)
784,Analisi matematica 2,Ingegneria Civile (L2)
785,Laboratory of biological data mining,Data Science (LM)
786,Sociologia della religione,Studi internazionali (L2)
787,Sociologia dello sviluppo internazionale,Sociologia (L2)
788,Lingua e cultura cinese II,"Mediazione linguistica, turismo e culture (LM)"
789,GPU computing,Artificial Intelligence Systems (LM)
790,Analisi matematica 2,"Ingegneria Informatica, delle Comunicazioni ed Elettronica (L2)"
791,Sociologia delle relazioni internazionali,Studi internazionali (L2)
792,Economics and management of energy systems,Ingegneria Energetica (LM)
793,Neuroscienze cognitive,Psicologia (LM)
794,Advanced European Studies,EUROPEAN AND INTERNATIONAL STUDIES - STUDI EUROPEI E INTERNAZIONALI (LM)
795,Etnicity and diversity,Global and Local Studies (LM)
796,Introduction to Computer Programming (Matlab),Cognitive Science - Scienze Cognitive (LM)
797,Research methodology - qualitative,Human-Computer Interaction - Interazione Persona-Macchina (LM)
798,Invertebrate Neuroscience,Cognitive Science - Scienze Cognitive (LM)
799,Interdisciplinary laboratory: Ceramic materials,Materials and production Engineering - Ingegneria dei materiali e della produzione (LM)
800,Processi di trasporto nell'ambiente,Ingegneria per l'ambiente e il territorio (LM)
801,Breathe and innovate,School of Innovation (CS)
802,Valutazione delle politiche contro la criminalità (corso libero),Giurisprudenza (LM5)
803,Storia del cristianesimo e delle chiese,Studi storici e filologico-letterari (L2)
804,Process engineering for environmental protection,Ingegneria Energetica (LM)
805,Stochastic differential equations,MATEMATICA (LM)
806,Crash course - Introduction to Quantitative Methods,Behavioural and Applied Economics - Economia Comportamentale e Applicata (LM)
807,Laboratorio di futuro,Previsione Sociale (M2)
808,Storia del diritto internazionale e delle dottrine internazionalistiche,Giurisprudenza (LM5)
809,Diritto amministrativo dell'Unione Europea,Giurisprudenza (LM5)
810,Improvement in Crop Production,Agrifood Innovation Management (LM)
811,Competenze informatiche,Sociologia (L2)
812,Numerical methods for PDEs,MATEMATICA (LM)
813,Gestione delle risorse umane,Filosofia e linguaggi della modernità (LM)
814,Psicologia del pensiero,Scienze e Tecniche di Psicologia Cognitiva (L2)
815,Knowledge and Data Integration,Data Science (LM)
816,Biologia degli organismi,Scienze e Tecnologie Biomolecolari (L2)
817,Storia della filosofia antica,Studi storici e filologico-letterari (L2)
818,Advanced Hands on M/EEG Analysis,Cognitive Science - Scienze Cognitive (LM)
819,Psicologia clinica,Scienze e Tecniche di Psicologia Cognitiva (L2)
820,Diritto penale internazionale,Giurisprudenza (LM5)
821,Distributed robot perception,Management and Industrial Systems Engineering (LM)
822,Introduction to Chinese Law,"Comparative, European and International Legal Studies (L2)"
823,Storia contemporanea I,Studi storici e filologico-letterari (L2)
824,Neurolinguistics,Cognitive Science - Scienze Cognitive (LM)
825,Filologia italiana II,Studi storici e filologico-letterari (L2)
826,Lifestyles and consumption practices,Global and Local Studies (LM)
827,Storia d'Europa,Studi storici e filologico-letterari (L2)
828,Laboratory of Advanced Electronics,FISICA (LM)
829,Tecnica urbanistica con Laboratorio Progettuale,Ingegneria Edile-Architettura (LM5)
830,Fundamental Hands on Functional Neuroimaging Analysis,Data Science (LM)
831,Letteratura greca,Filologia e critica letteraria (LM)
832,Personal branding,School of Innovation (CS)
833,Low-power wireless networking for the Internet of Things,Ingegneria dell'Informazione e delle Comunicazioni (LM)
834,Mechanical design for mechatronics,Mechatronics Engineering (LM)
835,Experimental Physics Laboratory at High School Level I,MATEMATICA (LM)
836,Electrochemical energy storage and Conversion,Ingegneria Energetica (LM)
837,Computability and computational complexity,INFORMATICA (LM)
838,Sistemi cyber-fisici wireless per radar e comunicazioni mobili,"Ingegneria Informatica, delle Comunicazioni ed Elettronica (L2)"
839,Web architectures,INFORMATICA (LM)
840,Multisensory interactive systems,INFORMATICA (LM)
841,Tecnologia e chimica applicata con elementi di chimica,Ingegneria Edile-Architettura (LM5)
842,Metodologia della valutazione per i servizi sociali,"Metodologia, Organizzazione e Valutazione dei Servizi Sociali (LM)"
843,Diritto amministrativo dell'Unione Europea,Economia e Management (L2)
844,Laboratorio di ricerca su sistemi informativi,"Organizzazione,società e tecnologia (LM)"
845,Laboratorio di pianificazione finanziaria,Gestione Aziendale (L2)
846,Automated Reasoning,Artificial Intelligence Systems (LM)
847,Corso di italiano A1a - I periodo (intensivo),Centro Linguistico d'Ateneo (CLA)
848,Progettazione e prototipazione di sistemi elettronici,"Ingegneria Informatica, delle Comunicazioni ed Elettronica (L2)"
849,Project management,Materials Engineering (LM)
850,Consumer Behavior and Analytics,Innovation Management - Management dell'innovazione (LM)
851,Storia romana I - LM,Filologia e critica letteraria (LM)
852,Francese giuridico B2,Giurisprudenza (LM5)
853,Intelligent vehicles and autonomous driving,Mechatronics Engineering (LM)
854,Psicologia della memoria e dell'apprendimento,Interfacce e Tecnologie della Comunicazione (L2)
855,Economia politica e aziendale,Lingue moderne (L2)
856,Fisica,Informatica (L2)
857,Storia del teatro greco,"Letterature euroamericane, traduzione e critica letteraria (LM)"
858,Controllo di gestione progredito,Management (LM)
859,Finite elements modeling,Materials and production Engineering - Ingegneria dei materiali e della produzione (LM)
860,Storia del diritto romano,Giurisprudenza (LM5)
861,Introduction to Robotics,Artificial Intelligence Systems (LM)
862,Procedura penale,Giurisprudenza (LM5)
863,Interdisciplinary laboratory: Advanced metals,Materials Engineering (LM)
864,English for International Communication,EUROPEAN AND INTERNATIONAL STUDIES - STUDI EUROPEI E INTERNAZIONALI (LM)
865,Algoritmi e strutture dati,Informatica (L2)
866,Filosofia dell'educazione,Filosofia e linguaggi della modernità (LM)
867,Geologia,Matematica (L2)
868,Structural reliability and uncertainty quantification methods,Ingegneria Civile (LM)
869,Diritto penale dell'informatica,Giurisprudenza (LM5)
870,Metodologia della scienza giuridica,Giurisprudenza (LM5)
871,Servizio sociale in pratica,Servizio Sociale (L2)
872,Economia delle amministrazioni pubbliche (Management pubblico),Amministrazione Aziendale e Diritto (L2)
873,Innovation and Entrepreneurship Studies in ICT,INFORMATICA (LM)
874,Stabilità dei pendii naturali e delle costruzioni in terra,Ingegneria per l'ambiente e il territorio (LM)
875,Research Project,Ingegneria dell'Informazione e delle Comunicazioni (LM)
876,Politica economica (internazionale),Studi internazionali (L2)
877,Sociologia economica e del lavoro,Sociologia (L2)
878,Letteratura italiana contemporanea I,Filologia e critica letteraria (LM)
879,Storia della filosofia moderna e contemporanea,Filosofia e linguaggi della modernità (LM)
880,Didattica dell'italiano L2/LS,"Letterature euroamericane, traduzione e critica letteraria (LM)"
881,Reti,Informatica (L2)
882,Project course,Mechatronics Engineering (LM)
883,Tecniche della rappresentazione ambientale,Ingegneria per l'ambiente e il territorio (L2)
884,Regression and Classification Models,Biologia Quantitativa e Computazionale (LM)
885,"Produttività, innovazione e dinamiche d'impresa",Management (LM)
886,Letteratura latina medievale I,Filologia e critica letteraria (LM)
887,International and European Union Law (Basic),EUROPEAN AND INTERNATIONAL STUDIES - STUDI EUROPEI E INTERNAZIONALI (LM)
888,Global Economic Scenarios_,International Management - Management Internazionale (LM)
889,Experimental Techniques in Nuclear and Subnuclear Physics,FISICA (LM)
890,Security and the Environment,Studi Sulla Sicurezza Internazionale (LM)
891,Lingua e traduzione tedesca e letteratura tedesca II,"Letterature euroamericane, traduzione e critica letteraria (LM)"
892,Elementi di archivistica II,Studi storici e filologico-letterari (L2)
893,Bacterial Pathogenesis,BIOTECNOLOGIE CELLULARI E MOLECOLARI (LM)
894,Psicologia del linguaggio e della comunicazione,Scienze e Tecniche di Psicologia Cognitiva (L2)
895,Microeconomia,Informatica (L2)
896,Analisi matematica 1,Informatica (L2)
897,"Diversità, inclusione, equità: prospettive socio-psicologiche",Gestione delle diversità: inclusione ed equità (GEDIE) (M1)
898,Bioinformatics,Biologia Quantitativa e Computazionale (LM)
899,Functions of the Peripheral Nervous System,BIOTECNOLOGIE CELLULARI E MOLECOLARI (LM)
900,Advanced Data Analysis,Biologia Quantitativa e Computazionale (LM)
901,Geomatica e telerilevamento,Ingegneria per l'ambiente e il territorio (LM)
902,Advanced social network analysis,Sociology and social research - Sociologia e ricerca sociale (LM)
903,Letteratura italiana,Lingue moderne (L2)
904,Mathematical Logic,MATEMATICA (LM)
905,Design methods for industrial engineering,Mechatronics Engineering (LM)
906,Algebraic geometry I,MATEMATICA (LM)
907,Fisica,"Ingegneria Informatica, delle Comunicazioni ed Elettronica (L2)"
908,Storia dell'architettura moderna con Laboratorio,Ingegneria Edile-Architettura (LM5)
909,Produzione e logistica progredito,Management (LM)
910,Formal Techniques for Cryptographic Protocol Analysis,MATEMATICA (LM)
911,Elettrofisiologia cardiaca,Medicina e Chirurgia (LM6)
912,Topics in History of Mathematics,MATEMATICA (LM)
913,Diritto ecclesiastico comparato,Giurisprudenza (LM5)
914,Letteratura portoghese II,"Letterature euroamericane, traduzione e critica letteraria (LM)"
915,Crash course - Legal Foundations,Innovation Management - Management dell'innovazione (LM)
916,Economia dell'ambiente,Gestione Aziendale (L2)
917,Filologia romanza I,Lingue moderne (L2)
918,Innovation and Entrepreneurship Basic,Ingegneria dell'Informazione e delle Comunicazioni (LM)
919,Letterature comparate II - LM,Filologia e critica letteraria (LM)
920,Trasmissione e codifica di segnali digitali,"Ingegneria Informatica, delle Comunicazioni ed Elettronica (L2)"
921,Informatica ed elementi di programmazione II,Interfacce e Tecnologie della Comunicazione (L2)
922,Disegno Civile + CAD,Ingegneria Civile (L2)
923,Cognizione e comunicazione sociale,Interfacce e Tecnologie della Comunicazione (L2)
924,Economics and Management,Biologia Quantitativa e Computazionale (LM)
925,Storia della scienza e delle tecniche II,Filosofia (L2)
926,Storia contemporanea,Sociologia (L2)
927,Genomics Technologies,BIOTECNOLOGIE CELLULARI E MOLECOLARI (LM)
928,Applicazioni informatiche agli archivi,Beni culturali (L2)
929,Creativity and Collective Creativity in Organizations,School of Innovation (CS)
930,Corso di arabo A1a - I periodo (estensivo),Centro Linguistico d'Ateneo (CLA)
931,Programming,Biologia Quantitativa e Computazionale (LM)
932,Storia del pensiero sociologico,Sociologia (L2)
933,Solid state physics I,FISICA (LM)
934,"Sistemi di gestione integrati per la qualità, la sicurezza e l'ambiente",Ingegneria per l'ambiente e il territorio (L2)
935,Protezione idraulica dei territori montani,Ingegneria per l'ambiente e il territorio (LM)
936,Sociologia della comunicazione,Interfacce e Tecnologie della Comunicazione (L2)
937,Previsione Sociale,Previsione Sociale (M2)
938,Strumenti quantitativi per la gestione,Management (LM)
939,Laboratorio di tecnologie delle materie plastiche,Ingegneria Industriale (L2)
940,Letterature comparate LM,Filologia e critica letteraria (LM)
941,Geografia,Studi storici e filologico-letterari (L2)
942,"Signal, Image and Video",Ingegneria dell'Informazione e delle Comunicazioni (LM)
943,Cultura e letteratura francese,Lingue moderne (L2)
944,Crash course - Economics,Behavioural and Applied Economics - Economia Comportamentale e Applicata (LM)
945,Computer Architectures,"Ingegneria Informatica, delle Comunicazioni ed Elettronica (L2)"
946,Sistemi Operativi,Informatica (L2)
947,Controllo e monitoraggio delle strutture civili,Ingegneria Edile-Architettura (LM5)
948,Cultura e letteratura spagnola,Lingue moderne (L2)
949,Seminario: Economic Sociology of Inequality,Sociology and social research - Sociologia e ricerca sociale (LM)
950,Progettazione di sistemi integrati per il recupero di materia da rifiuti urbani,Ingegneria per l'ambiente e il territorio (LM)
951,Storia del pensiero sociologico,Filosofia (L2)
952,Principles of biomaterials and medical device design,Materials Engineering (LM)
953,Idrodinamica,Ingegneria per l'ambiente e il territorio (LM)
954,English B2,Ingegneria Civile (L2)
955,Letteratura greca - LT,Beni culturali (L2)
956,Diritto commerciale progredito,Management (LM)
957,Strategic Studies,EUROPEAN AND INTERNATIONAL STUDIES - STUDI EUROPEI E INTERNAZIONALI (LM)
958,Diritto delle migrazioni,Giurisprudenza (LM5)
959,Diritto delle istituzioni internazionali,Giurisprudenza (LM5)
960,Fisica 2,Ingegneria per l'ambiente e il territorio (L2)
961,Secondo Tirocinio,Servizio Sociale (L2)
962,Sensors and micro electro-mechanical systems,Mechatronics Engineering (LM)
963,Sicurezza formazione generale,Economia e Management (L2)
964,Imaging and diagnostic techniques,Ingegneria dell'Informazione e delle Comunicazioni (LM)
965,Ingegneria per lo sviluppo sostenibile internazionale. Metodi e progetto,Ingegneria per l'ambiente e il territorio (LM)
966,Quality and innovation engineering,Materials Engineering (LM)
967,Electronic materials and technologies,Materials and production Engineering - Ingegneria dei materiali e della produzione (LM)
968,Automatic control,INFORMATICA (LM)
969,"Contabilità, bilancio e principi contabili",Economia e Management (L2)
970,Storia medievale II - LM,Scienze storiche (LM)
971,Special Issues of Building Physics,Ingegneria Energetica (LM)
972,Winter School part II - Advanced numerical methods for hyperbolic conservation laws,"Ingegneria civile, ambientale e meccanica (D1)"
973,Cellular and Molecular Neurobiology,BIOTECNOLOGIE CELLULARI E MOLECOLARI (LM)
974,Marketing turistico e territoriale,Management della sostenibilità e del turismo (LM)
975,Analisi dei dati e Statistica,Amministrazione Aziendale e Diritto (L2)
976,Lingua e traduzione inglese e lingue e letterature angloamericane I,"Letterature euroamericane, traduzione e critica letteraria (LM)"
977,Cancer Biology,BIOTECNOLOGIE CELLULARI E MOLECOLARI (LM)
978,Computational linguistics,Cognitive Science - Scienze Cognitive (LM)
979,Teoria di Galois,Matematica (L2)
980,Diritto delle reti di imprese,Management (LM)
981,Numerical methods for environmental processes,Environmental Meteorology (LM)
982,Applied Mechanics and Technologies for Energy Efficiency,Ingegneria Energetica (LM)
983,Design of precision systems,Management and Industrial Systems Engineering (LM)
984,"Power Production, CHP and District Heating Systems",Ingegneria Energetica (LM)
985,Laboratori per la professione,Economia e legislazione d'impresa (LM)
986,Atmospheric radiation and remote sensing,Environmental Meteorology (LM)
987,Distributed estimation for robots and vehicles,Mechatronics Engineering (LM)
988,Corso di italiano A1a - I periodo (estensivo),Centro Linguistico d'Ateneo (CLA)
989,Storia della medicina,Filosofia e linguaggi della modernità (LM)
990,Embedded systems,Mechatronics Engineering (LM)
991,Corso di inglese B2 blended specialistico tipo A - I periodo (estensivo),Centro Linguistico d'Ateneo (CLA)
992,Analisi matematica 2,"Ingegneria Informatica, delle Comunicazioni ed Elettronica (L2)"
993,Medicina del servizio sociale,Servizio Sociale (L2)
994,Networking I,Ingegneria dell'Informazione e delle Comunicazioni (LM)
995,High Performance Computing for Data Science,Ingegneria dell'Informazione e delle Comunicazioni (LM)
996,Corso di francese B1 - I periodo (estensivo),Centro Linguistico d'Ateneo (CLA)
997,Seminario: Theories of Meaning in the Social and the Natural World,Sociology and social research - Sociologia e ricerca sociale (LM)
998,Fisica generale I (primo modulo),Matematica (L2)
999,Seminario: L'argomentazione scientifica,Sociologia (L2)
1000,Algebraic Cryptography,MATEMATICA (LM)
1001,Calcolo delle probabilità e statistica matematica,Matematica (L2)
1002,"Arboricoltura generale, principi di fisiologia e genetica delle piante da frutto",Viticoltura ed Enologia (L2)
1003,Computer simulation for Economics,Behavioural and Applied Economics - Economia Comportamentale e Applicata (LM)
1004,Mathematics,Economia e Management (L2)
1005,Statistica per le ricerche di mercato,Gestione Aziendale (L2)
1006,Organizational behaviour and human resources management,Management (LM)
1007,Crash course - Introduction to Quantitative Methods,International Management - Management Internazionale (LM)
1008,Calcolatori,"Ingegneria Informatica, delle Comunicazioni ed Elettronica (L2)"
1009,Mechanical vibrations,Mechatronics Engineering (LM)
1010,Finanza aziendale progredito,Management (LM)
1011,Glass engineering,Materials Engineering (LM)
1012,Ermeneutica filosofica,Filosofia (L2)
1013,Architettura del paesaggio,Ingegneria Edile-Architettura (LM5)
1014,Fisica tecnica,Ingegneria per l'ambiente e il territorio (L2)
1015,Introduzione alla Programmazione per il web,Informatica (L2)
1016,"Strategia, sostenibilità e impatto",Gestione di imprese sociali (G.I.S.) (M1)
1017,Reti,"Ingegneria Informatica, delle Comunicazioni ed Elettronica (L2)"
1018,Bayesian statistics,INFORMATICA (LM)
1019,Diritto comune,Giurisprudenza (LM5)
1020,Computer Programming 2,"Ingegneria Informatica, delle Comunicazioni ed Elettronica (L2)"
1021,Algoritmi e strutture dati,Informatica (L2)
1022,Metodi di valutazione e progettazione per gli interventi di servizio sociale,Servizio Sociale (L2)
1023,Research methods in political science,Sociology and social research - Sociologia e ricerca sociale (LM)
1024,Archeometria,Beni culturali (L2)
1025,Psicologia del consumatore e delle decisioni economiche,Management della sostenibilità e del turismo (LM)
1026,Automated Reasoning,Artificial Intelligence Systems (LM)
1027,Seminari,Previsione Sociale (M2)
1028,Language and society,Sociology and social research - Sociologia e ricerca sociale (LM)
1029,Bayesian Statistics,Data Science (LM)
1030,Introduzione all'analisi di dati comportamentali per lo studio dell'attenzione,Scienze e Tecniche di Psicologia Cognitiva (L2)
1031,Metodi di osservazione per la pratica clinica e la ricerca,Scienze e Tecniche di Psicologia Cognitiva (L2)
1032,Comunicazione delle Scienze,Matematica (L2)
1033,Neurogenesis and Brain Regeneration,BIOTECNOLOGIE CELLULARI E MOLECOLARI (LM)
1034,Seminario: ONU e prevenzione familiare - il progetto Family UNited in Italia,Sociologia (L2)
1035,Teoria algebrica dei numeri,Matematica (L2)
1036,Economia dei mercati e degli intermediari finanziari,Gestione Aziendale (L2)
1037,Optoelectronics,FISICA (LM)
1038,Studying the Soil-Plant-Atmosphere Continuum with process based model,Ingegneria per l'ambiente e il territorio (LM)
1039,Linguaggi formali e compilatori,Informatica (L2)
1040,Diritto del lavoro pubblico,Giurisprudenza (LM5)
1041,Blockchain,INFORMATICA (LM)
1042,Tecnica delle costruzioni,Ingegneria per l'ambiente e il territorio (LM)
1043,Open Science,Communication of Science and Innovation - SCICOMM (M1)
1044,Organizzazione dei servizi sociali e gestione delle risorse umane,"Metodologia, Organizzazione e Valutazione dei Servizi Sociali (LM)"
1045,Analisi matematica 1,"Ingegneria Informatica, delle Comunicazioni ed Elettronica (L2)"
1046,Meccanica delle costruzioni con elementi in vetro delle tensostrutture e delle strutture murarie,Ingegneria Edile-Architettura (LM5)
1047,Antropologia culturale per l'insegnamento,Percorso 24 CFU (CS24)
1048,Foundations of Geometry,MATEMATICA (LM)
1049,Diritto e amministrazione per il servizio sociale,Servizio Sociale (L2)
1050,Atomic Physics,FISICA (LM)
1051,Introduction to Robotics,Artificial Intelligence Systems (LM)
1052,Optimization models and algorithms,Management and Industrial Systems Engineering (LM)
1053,Diritto delle crisi d'impresa,Giurisprudenza (LM5)
1054,Preistoria e protostoria I,Beni culturali (L2)
1055,Letteratura e cultura portoghese II,Lingue moderne (L2)
1056,Simulazione sociale,Previsione Sociale (M2)
1057,Autonomous Software Agents,INFORMATICA (LM)
1058,Organization,Economia e Management (L2)
1059,Psicologia per la gestione delle risorse umane,Psicologia (LM)
1060,Lingua e traduzione francese e letteratura francese I,"Letterature euroamericane, traduzione e critica letteraria (LM)"
1061,Macroeconomia,Economia e Management (L2)
1062,Scienza e tecnologia dei materiali,Ingegneria Industriale (L2)
1063,Environmental Fluid Mechanics/Hydropower Plants,Ingegneria Energetica (LM)
1064,Organizational Behavior,International Management - Management Internazionale (LM)
1065,Percorso orientativo: Lauree magistrali e mondo del lavoro,Sociologia (L2)
1066,Archeologia e storia dell'arte greca,Studi storici e filologico-letterari (L2)
1067,Challenge Action Plan,School of Innovation (CS)
1068,Gestione delle risorse umane,Gestione Aziendale (L2)
1069,Metodi di ricerca per il welfare locale,"Metodologia, Organizzazione e Valutazione dei Servizi Sociali (LM)"
1070,Quantum field theory I,FISICA (LM)
1071,Mathematical Methods for Engineering,"Ingegneria civile, ambientale e meccanica (D1)"
1072,National Security from an International and European Law Perspective,"Security, Intelligence and Strategic Studies (LM)"
1073,Studi urbani,Studi internazionali (L2)
