id_course,course_name,degree_program
2143,Innovating Supply Chains,School of Innovation (CS)
2144,Social inequalities: dynamics and policies,Data Science (LM)
2145,Advanced Formula SAE,Materials Engineering (LM)
2146,Storia delle idee filosofiche e religiose,Filosofia e linguaggi della modernità (LM)
2147,Filologia romanza I,Studi storici e filologico-letterari (L2)
2148,Lab. I: Market Analysis,Economia e Management (L2)
2149,Analisi matematica 1,"Ingegneria Informatica, delle Comunicazioni ed Elettronica (L2)"
2150,Diritto agroalimentare e globalizzazione,Giurisprudenza (LM5)
2151,Previsione tecnologica,Previsione Sociale (M2)
2152,Costruzioni in legno,Ingegneria Edile-Architettura (LM5)
2153,Seminario: Introduzione all'analisi degli eventi di protesta - Protest event analysis (PEA),Sociologia (L2)
2154,Lingua e traduzione inglese e letteratura inglese I,"Letterature euroamericane, traduzione e critica letteraria (LM)"
2155,Storia moderna II,Lingue moderne (L2)
2156,Molecular Biology of the Cell,Biologia Quantitativa e Computazionale (LM)
2157,Psicologia delle organizzazioni,Psicologia (LM)
2158,Network Modeling and Simulation,Biologia Quantitativa e Computazionale (LM)
2159,Crash course - International Business,Innovation Management - Management dell'innovazione (LM)
2160,Deep learning,INFORMATICA (LM)
2161,Innovative and sustainable techniques for minor and speciality crops in the Alps,Agrifood Innovation Management (LM)
2162,Translational Control in Disease,BIOTECNOLOGIE CELLULARI E MOLECOLARI (LM)
2163,Metodi,Previsione Sociale (M2)
2164,Fondamenti di robotica,Informatica (L2)
2165,Tropical meteorology and climate,Environmental Meteorology (LM)
2166,Computer vision,Ingegneria dell'Informazione e delle Comunicazioni (LM)
2167,ICT Innovation - Product Design and Development,Innovation Management - Management dell'innovazione (LM)
2168,Imaging and diagnostic techniques,Artificial Intelligence Systems (LM)
2169,Discrete Fourier analysis,MATEMATICA (LM)
2170,Design for social inclusion,Human-Computer Interaction - Interazione Persona-Macchina (LM)
2171,Social interaction,Human-Computer Interaction - Interazione Persona-Macchina (LM)
2172,Sustainable and Responsible Management,Management (LM)
2173,Teoria e tecnica del dibattito,Giurisprudenza (LM5)
2174,Letterature comparate III - LM,"Letterature euroamericane, traduzione e critica letteraria (LM)"
2175,Lingua inglese B1 (obbligo formativo aggiuntivo),Lingue moderne (L2)
2176,Research Project,Ingegneria dell'Informazione e delle Comunicazioni (LM)
2177,Workshop in Behavioral finance,Finanza (LM)
2178,Lab. appl.: I rapporti tra Stato e Regioni nella giurisprudenza costituzionale,Giurisprudenza (LM5)
2179,Anatomia umana II,Medicina e Chirurgia (LM6)
2180,Softwarized and Virtualized mobile networks,INFORMATICA (LM)
2181,Diritto processuale civile,Giurisprudenza (LM5)
2182,Fisiologia umana,Medicina e Chirurgia (LM6)
2183,Infrastrutture viarie,Ingegneria Civile (L2)
2184,Quality and innovation engineering,Management and Industrial Systems Engineering (LM)
2185,Electronic materials and technologies,Mechatronics Engineering (LM)
2186,Advanced analysis,MATEMATICA (LM)
2187,Laboratory of Advanced Photonics,FISICA (LM)
2188,Fundamentals of Artificial Intelligence,Artificial Intelligence Systems (LM)
2189,Radiation: detection and applications,FISICA (LM)
2190,Philosophy of Law,"Comparative, European and International Legal Studies (L2)"
2191,Storia della scienza e delle tecniche,Filosofia (L2)
2192,Dottrina dello stato,Giurisprudenza (LM5)
2193,Scientific Writing and Presentations in English (B2a),MATEMATICA (LM)
2194,Introduction to programming,Behavioural and Applied Economics - Economia Comportamentale e Applicata (LM)
2195,Introduzione all'economia,Economia e Management (L2)
2196,Diritto pubblico,Sociologia (L2)
2197,Organizational Behaviour,Innovation Management - Management dell'innovazione (LM)
2198,Ecologia applicata,Ingegneria per l'ambiente e il territorio (LM)
2199,Paleografia II,Beni culturali (L2)
2200,High Performance Computing for Data Science,Artificial Intelligence Systems (LM)
2201,Psicologia del lavoro e delle organizzazioni,"Organizzazione,società e tecnologia (LM)"
2202,Introduction to robotics,Mechatronics Engineering (LM)
2203,Organic and Biological Chemistry,Biologia Quantitativa e Computazionale (LM)
2204,Criminologia,Giurisprudenza (LM5)
2205,Sicurezza in laboratorio - UniTrento,FISICA (LM)
2206,Labour Rights in the Global Economy,EUROPEAN AND INTERNATIONAL STUDIES - STUDI EUROPEI E INTERNAZIONALI (LM)
2207,Macroeconomics,Behavioural and Applied Economics - Economia Comportamentale e Applicata (LM)
2208,Africa and the Middle East: transformations and challenges,Studi Sulla Sicurezza Internazionale (LM)
2209,Statistical Methods for Experimental Sciences,BIOTECNOLOGIE CELLULARI E MOLECOLARI (LM)
2210,Advanced materials for Energy Engineering,Ingegneria Energetica (LM)
2211,Modeling and simulation of mechatronic systems,Artificial Intelligence Systems (LM)
2212,Space and culture,Sociology and social research - Sociologia e ricerca sociale (LM)
2213,Corso di inglese B2a - I periodo (estensivo),Centro Linguistico d'Ateneo (CLA)
2214,Corso di italiano A1 falsi principianti - I periodo (intensivo),Centro Linguistico d'Ateneo (CLA)
2215,Modelli di decisione per la gestione_,Economia e Management (L2)
2216,Automated Planning: Theory and Practice,Artificial Intelligence Systems (LM)
2217,Computational physics,Biologia Quantitativa e Computazionale (LM)
2218,Storia del collezionismo,Storia dell'arte e studi museali (LM)
2219,Istituzioni di diritto privato II,Giurisprudenza (LM5)
2220,Meccanica dei fluidi,Ingegneria per l'ambiente e il territorio (L2)
2221,Bio-signals and transducers,Mechatronics Engineering (LM)
2222,Analisi matematica I,Fisica (L2)
2223,Modeling and design with finite elements,Management and Industrial Systems Engineering (LM)
2224,Metodi qualitativi e applicazione di teorie linguistiche,Scienze e Tecniche di Psicologia Cognitiva (L2)
2225,Polymeric materials engineering,Materials Engineering (LM)
2226,Seminario: Introduzione alla teoria politica,Sociologia (L2)
2227,Algebra A,Matematica (L2)
2228,Storia moderna II,Beni culturali (L2)
2229,Iconografia Teatrale,Beni culturali (L2)
2230,Optoelectronics and quantum devices for sensing and automation,Mechatronics Engineering (LM)
2231,Basi biologiche del comportamento,Scienze e Tecniche di Psicologia Cognitiva (L2)
2232,Diritto cinese - corso avanzato,Giurisprudenza (LM5)
2233,Sviluppo professionale e imprenditorialità,Interfacce e Tecnologie della Comunicazione (L2)
2234,Sociologia dell'organizzazione,Sociologia (L2)
2235,European and International Politics (Basic),EUROPEAN AND INTERNATIONAL STUDIES - STUDI EUROPEI E INTERNAZIONALI (LM)
2236,Advanced Hands on fMRI Analysis,Data Science (LM)
2237,Diritto internazionale dei conflitti armati,Studi internazionali (L2)
2238,Studi urbani,Sociologia (L2)
2239,Law and Data,Data Science (LM)
2240,Foundations of Cognitive Psychology and Neuroscience I,Cognitive Science - Scienze Cognitive (LM)
2241,Calcolo delle probabilità,"Ingegneria Informatica, delle Comunicazioni ed Elettronica (L2)"
2242,Bio-signals and transducers,Materials Engineering (LM)
2243,Design methods for unmanned vehicles,Mechatronics Engineering (LM)
2244,Basics of optoelectronics,"Ingegneria Informatica, delle Comunicazioni ed Elettronica (L2)"
2245,Sociologia dei processi culturali e comunicativi I,"Mediazione linguistica, turismo e culture (LM)"
2246,Energie rinnovabili,Ingegneria per l'ambiente e il territorio (LM)
2247,Antropologia culturale,Studi internazionali (L2)
2248,Algebraic geometry II,MATEMATICA (LM)
2249,Economia e misurazione aziendale,Matematica (L2)
2250,Genetica,Informatica (L2)
2251,Bio-Inspired Artificial Intelligence,Artificial Intelligence Systems (LM)
2252,Networks and organizations,"Organizzazione,società e tecnologia (LM)"
2253,Introduzione all'economia,Gestione Aziendale (L2)
2254,Crash course - Legal Foundations,International Management - Management Internazionale (LM)
2255,Biodiritto e Bioetica,Scienze e Tecnologie Biomolecolari (L2)
2256,Interdisciplinary laboratory: Ceramic materials,Materials Engineering (LM)
2257,Molecular Physics,Biologia Quantitativa e Computazionale (LM)
2258,Storia del pensiero economico,Economia e Management (L2)
2259,Proteomics and Protein characterization,BIOTECNOLOGIE CELLULARI E MOLECOLARI (LM)
2260,Economia e misurazione aziendale,Economia e Management (L2)
2261,Lab. appl.: Dalla ricerca bibliografica alla stesura del testo: linee guida per la redazione di una tesi di laurea,Giurisprudenza (LM5)
2262,Applied Cryptography,MATEMATICA (LM)
2263,Storia delle istituzioni politiche I,Scienze storiche (LM)
2264,Sociologia della famiglia,Sociologia (L2)
2265,Bridging HCI to Computer Science,Human-Computer Interaction - Interazione Persona-Macchina (LM)
2266,Diritto internazionale,Giurisprudenza (LM5)
2267,Mathematical Biology,MATEMATICA (LM)
2268,Short cycle breeding and innovative techniques to improve product quality,Agrifood Innovation Management (LM)
2269,Design di software con gamification,Interfacce e Tecnologie della Comunicazione (L2)
2270,High Performance Computing for Data Science,Data Science (LM)
2271,Elementi di astrofisica e cosmologia gravitazionale,Fisica (L2)
2272,Storia moderna II - LM,"Letterature euroamericane, traduzione e critica letteraria (LM)"
2273,Linguistica spagnola I,Lingue moderne (L2)
2274,Matematica e Statistica II,Scienze e Tecnologie Biomolecolari (L2)
2275,Bioinks and 3D printing,Materials and production Engineering - Ingegneria dei materiali e della produzione (LM)
2276,Business and Consumer Transactions,Economia e Management (L2)
2277,"History and Politics of the Middle East: Conflicts, Ideologies and Democratisation","Security, Intelligence and Strategic Studies (LM)"
2278,Language and Social Cognition,Artificial Intelligence Systems (LM)
2279,Geospatial analysis and representation for data science,Data Science (LM)
2280,Security testing,INFORMATICA (LM)
2281,Organizzazione e gestione aziendale,"Ingegneria Informatica, delle Comunicazioni ed Elettronica (L2)"
2282,Reti logiche,"Ingegneria Informatica, delle Comunicazioni ed Elettronica (L2)"
2283,Applied Cryptography,INFORMATICA (LM)
2284,Simulation and performance evaluation,INFORMATICA (LM)
2285,Finanza aziendale progredito,Management (LM)
2286,"Power Production, CHP and District Heating Systems",Ingegneria Energetica (LM)
2287,Sicurezza strutturale,Ingegneria Civile (LM)
2288,Computational methods for transport phenomena,FISICA (LM)
2289,Istologia ed embriologia,Medicina e Chirurgia (LM6)
2290,Innovative plants and automation for the agri-food production and transformation,Agrifood Innovation Management (LM)
2291,Viticoltura 2: Tecnica viticola con esercitazioni,Viticoltura ed Enologia (L2)
2292,Digital signal processing,MATEMATICA (LM)
2293,Scienze Umane in medicina,Medicina e Chirurgia (LM6)
2294,Economia del lavoro e della famiglia_,Economia e Management (L2)
2295,Business Development Laboratory,INFORMATICA (LM)
2296,Filologia romanza,Studi storici e filologico-letterari (L2)
2297,Epidemiologia e prevenzione,Medicina e Chirurgia (LM6)
2298,Fisica generale II,Fisica (L2)
2299,Progettazione di impianti di trattamento delle acque,Ingegneria per l'ambiente e il territorio (LM)
2300,History and International Relations of the Middle East,EUROPEAN AND INTERNATIONAL STUDIES - STUDI EUROPEI E INTERNAZIONALI (LM)
2301,Judgment and Decision Making Laboratory,Economia e Management (L2)
2302,Progettazione e valutazione educativa,Percorso 24 CFU (CS24)
2303,Mathematical aspects of bioelectromagnetism and imaging,MATEMATICA (LM)
2304,Linguistica inglese II,Lingue moderne (L2)
2305,Economia dei sistemi agro-alimentari,Amministrazione Aziendale e Diritto (L2)
2306,Enterprise information system,Management and Industrial Systems Engineering (LM)
2307,Costruzioni idrauliche con nozioni di Idraulica,Ingegneria Edile-Architettura (LM5)
2308,Corso di italiano B1a - I periodo (estensivo),Centro Linguistico d'Ateneo (CLA)
2309,Storia del teatro e dello spettacolo II,Filosofia (L2)
2310,Marketing game,Amministrazione Aziendale e Diritto (L2)
2311,Cultura e letteratura russa,Lingue moderne (L2)
2312,Tedesco giuridico B1,Giurisprudenza (LM5)
2313,Scienza delle costruzioni,Ingegneria Edile-Architettura (LM5)
2314,Business plan,School of Innovation (CS)
2315,Network modelling and design,Ingegneria dell'Informazione e delle Comunicazioni (LM)
2316,Storia contemporanea extraeuropea,Scienze storiche (LM)
2317,Ecoidraulica,Ingegneria per l'ambiente e il territorio (LM)
2318,Processi partecipativi di governance,"Organizzazione,società e tecnologia (LM)"
2319,Polymeric and composite materials engineering,Materials Engineering (LM)
2320,Environmental Sustainability,"Ingegneria civile, ambientale e meccanica (D1)"
2321,Optimization techniques,Artificial Intelligence Systems (LM)
2322,Storia dell'architettura contemporanea,Ingegneria Edile-Architettura (LM5)
2323,Pedagogia della socialità digitale,Filosofia (L2)
2324,Laboratorio di fisica I,Fisica (L2)
2325,Formal Techniques for Cryptographic Protocol Analysis,INFORMATICA (LM)
2326,Scientific programming,MATEMATICA (LM)
2327,International Sustainable Development: Methods and Projects,Global and Local Studies (LM)
2328,Analisi dei dati e Statistica,Gestione Aziendale (L2)
2329,Geometria e algebra lineare,Ingegneria Industriale (L2)
2330,Macchine ed elementi delle macchine,Ingegneria per l'ambiente e il territorio (L2)
2331,Diritto del lavoro,Amministrazione Aziendale e Diritto (L2)
2332,Scientific Writing and Presentations in English (B2a),FISICA (LM)
2333,Dynamics in systems and networks,Management and Industrial Systems Engineering (LM)
2334,Seminario: Diritto dell'edilizia,Ingegneria Civile (L2)
2335,Tecnologia dei materiali con Laboratorio di chimica per l'ambiente,Ingegneria per l'ambiente e il territorio (L2)
2336,Inquinanti emergenti e strategie di risanamento,Ingegneria per l'ambiente e il territorio (LM)
2337,Linguaggi formali e compilatori,Informatica (L2)
2338,Introduzione alla pedagogia,Filosofia (L2)
2339,Archeologia e storia della produzione nel mondo classico,Beni culturali (L2)
2340,Fisiologia della cellula e degli organismi,Informatica (L2)
2341,Diritto amministrativo,Giurisprudenza (LM5)
2342,Distributed robot perception,Mechatronics Engineering (LM)
2343,Organizzazione aziendale_,Gestione Aziendale (L2)
2344,Relazioni interpersonali e comunicazione sociale,Servizio Sociale (L2)
2345,Lab. appl.: Il problema storico della cittadinanza,Giurisprudenza (LM5)
2346,Geografia economica e politica,Studi internazionali (L2)
2347,Misure industriali,Ingegneria Industriale (L2)
2348,Sociologia,Studi internazionali (L2)
2349,Tecnologia dei cicli produttivi,Economia e Management (L2)
2350,Elementi di termofluidodinamica,Ingegneria Industriale (L2)
2351,Introduction to Computer and Network Security,Informatica (L2)
2352,Storia delle istituzioni politiche (progredito),"Organizzazione,società e tecnologia (LM)"
2353,International strategic management,Management (LM)
2354,Hydrology,Environmental Meteorology (LM)
2355,Biodiritto,Giurisprudenza (LM5)
2356,Advanced Group Theory,MATEMATICA (LM)
2357,Linguistica generale e glottologia,Lingue moderne (L2)
2358,Storia della Fisica e della Matematica,Matematica (L2)
2359,Leadership,International Management - Management Internazionale (LM)
2360,Metodi di Machine Learning in Neuroscienze Cliniche,Medicina e Chirurgia (LM6)
2361,HPC summerschool,"Ingegneria civile, ambientale e meccanica (D1)"
2362,Quantum field theory II,FISICA (LM)
2363,Storia contemporanea II,Lingue moderne (L2)
2364,Storia della critica d'arte III,Beni culturali (L2)
2365,Open Innovation Modelling and R&D_,Innovation Management - Management dell'innovazione (LM)
2366,Test di matematica,Economia e Management (L2)
2367,Mathematical Biology,Data Science (LM)
2368,Topografia antica,Studi storici e filologico-letterari (L2)
2369,Storia del diritto medievale e moderno I,Giurisprudenza (LM5)
2370,Financial Markets and Corporate Finance,Management (LM)
2371,Workshop on Financial simulation,Finanza (LM)
2372,Matematica finanziaria,Economia e Management (L2)
2373,Gestione delle acque e dei sedimenti per lo sviluppo sostenibile,Ingegneria per l'ambiente e il territorio (LM)
2374,Diritto assicurativo,Giurisprudenza (LM5)
2375,Comparative Private Law,"Comparative, European and International Legal Studies (L2)"
2376,Fisica generale,Ingegneria Edile-Architettura (LM5)
2377,Metodologie della ricerca archeologica I,Beni culturali (L2)
2378,Biochimica,Informatica (L2)
2379,Geotecnica,Ingegneria per l'ambiente e il territorio (L2)
2380,Services Marketing_,Innovation Management - Management dell'innovazione (LM)
2381,Business Development Laboratory,Ingegneria dell'Informazione e delle Comunicazioni (LM)
2382,Obbligo formativo aggiuntivo (OFA),Lingue moderne (L2)
2383,Storia della musica II - LM,"Letterature euroamericane, traduzione e critica letteraria (LM)"
2384,Meet the science communicators,Communication of Science and Innovation - SCICOMM (M1)
2385,Durabilità dei materiali da costruzione,Ingegneria Civile (L2)
2386,Portfolio management,Finanza (LM)
2387,Introduzione all'ingegneria ambientale,Ingegneria per l'ambiente e il territorio (L2)
2388,Design epistemology and ethics,Human-Computer Interaction - Interazione Persona-Macchina (LM)
2389,Economia e diritto del lavoro,Amministrazione Aziendale e Diritto (L2)
2390,Computer Programming 2,Informatica (L2)
2391,Computational algebra,MATEMATICA (LM)
2392,Studi di genere,Filosofia e linguaggi della modernità (LM)
2393,Laboratorio di analisi dei mercati,Gestione Aziendale (L2)
2394,Condensed Matter Theory,FISICA (LM)
2395,Strategie d'impresa_,Economia e Management (L2)
2396,Creativity development through bodily art performance based upon extended self,Interfacce e Tecnologie della Comunicazione (L2)
2397,Mathematical Modeling and Simulation,Biologia Quantitativa e Computazionale (LM)
2398,Pitch Yourself,School of Innovation (CS)
2399,Geometria I,Fisica (L2)
2400,Seminario: Elementi di storia LGBTQIA+,Sociologia (L2)
2401,Big Data Technologies,Management (LM)
2402,Storia moderna I,Beni culturali (L2)
2403,Botanica,Beni culturali (L2)
2404,Eco-sustainable methods for the prevention and management of invasive alien species,Agrifood Innovation Management (LM)
2405,Basic of Data Science,School of Innovation (CS)
2406,Storia della scienza e della tecnica,"Organizzazione,società e tecnologia (LM)"
2407,Human Computer Interaction,INFORMATICA (LM)
2408,"Information, Knowledge and Service Management",Data Science (LM)
2409,Lab. appl.: Interessi monetari ed usura,Giurisprudenza (LM5)
2410,Advanced topics in reasoning and decision making,Cognitive Science - Scienze Cognitive (LM)
2411,Fisica e modellistica dell'atmosfera,Ingegneria per l'ambiente e il territorio (LM)
2412,Multisensory interactive systems,Ingegneria dell'Informazione e delle Comunicazioni (LM)
2413,Corso di spagnolo A2 - I periodo (estensivo),Centro Linguistico d'Ateneo (CLA)
2414,Formal Verification,Artificial Intelligence Systems (LM)
2415,Computational Biophysics,Biologia Quantitativa e Computazionale (LM)
2416,Managing innovation Lab,Innovation Management - Management dell'innovazione (LM)
2417,Biologia cellulare,Informatica (L2)
2418,"Letteratura, pregiudizi e stereotipi",Interfacce e Tecnologie della Comunicazione (L2)
2419,Laboratory Life,Communication of Science and Innovation - SCICOMM (M1)
2420,Computer vision,INFORMATICA (LM)
2421,Geometria e algebra lineare,Ingegneria per l'ambiente e il territorio (L2)
2422,Chimica Organica,Viticoltura ed Enologia (L2)
2423,Progettazione di infrastrutture idrauliche urbane,Ingegneria per l'ambiente e il territorio (LM)
2424,Laboratorio didattico di fisica,Ingegneria Industriale (L2)
2425,Programmazione 2,"Ingegneria Informatica, delle Comunicazioni ed Elettronica (L2)"
2426,Sistema politico europeo,Studi internazionali (L2)
2427,High Throughput Sequencing Data Analysis,INFORMATICA (LM)
2428,Programmazione costi e contabilità dei lavori,Ingegneria Civile (L2)
2429,Machine Learning for NLP II,Cognitive Science - Scienze Cognitive (LM)
2430,Sociologia dell'ambiente,Sociologia (L2)
2431,AI and Innovation,Artificial Intelligence Systems (LM)
2432,Introduction to Computer Programming (Python),Cognitive Science - Scienze Cognitive (LM)
2433,Security testing,INFORMATICA (LM)
2434,Istituzioni di sociologia,Matematica (L2)
2435,Circuiti elettronici digitali,Informatica (L2)
2436,Cancer Therapy,BIOTECNOLOGIE CELLULARI E MOLECOLARI (LM)
2437,Matematica e Statistica I,Scienze e Tecnologie Biomolecolari (L2)
2438,Cellular and Molecular Neuroscience,Cognitive Science - Scienze Cognitive (LM)
2439,Atmospheric chemistry and biogeochemistry,Environmental Meteorology (LM)
2440,Filosofia della scienza,Filosofia (L2)
2441,Learning processes and technological innovation,School of Innovation (CS)
2442,Nanoscience,FISICA (LM)
2443,Business analytics,School of Innovation (CS)
2444,Autonomous Software Agents,Artificial Intelligence Systems (LM)
2445,Marketing game,Economia e Management (L2)
2446,Fundamentals of Marketing,Economia e Management (L2)
2447,Multimedia Data Security,INFORMATICA (LM)
2448,Applied Market Analysis,Management (LM)
2449,Introduction to Human Language,Cognitive Science - Scienze Cognitive (LM)
2450,Power relations for creativity and innovation,School of Innovation (CS)
2451,Storia contemporanea III,Studi storici e filologico-letterari (L2)
2452,Emotional Intelligence,School of Innovation (CS)
2453,Public Economics,Economia e Management (L2)
2454,Costruzione di ponti,Ingegneria Civile (LM)
2455,Filologia italiana II - LM,Filologia e critica letteraria (LM)
2456,Human-Machine Dialogue,INFORMATICA (LM)
2457,Fondamenti di meccanica razionale,Ingegneria per l'ambiente e il territorio (L2)
2458,Electrical Systems Engineering,Ingegneria Energetica (LM)
2459,Dynamics of vehicles,Mechatronics Engineering (LM)
2460,Viticoltura 1,Viticoltura ed Enologia (L2)
2461,Electrochemistry for energy and environment,Materials and production Engineering - Ingegneria dei materiali e della produzione (LM)
2462,Bioinspired and functional materials,Materials Engineering (LM)
2463,Web architectures,INFORMATICA (LM)
2464,Macroeconomia,Matematica (L2)
2465,Seminars: Science and Technology in Society,Communication of Science and Innovation - SCICOMM (M1)
2466,Psicologia dello sviluppo,Filosofia (L2)
2467,Psicopedagogia e tecniche di osservazione,Educazione professionale (abilitante alla professione sanitaria di Educatore professionale) (L2)
2468,Designing and programming the Internet of Things (IoT),Data Science (LM)
2469,Diritto del lavoro,Amministrazione Aziendale e Diritto (L2)
2470,An Introduction to Groundwater Flow and Transport Physics,"Ingegneria civile, ambientale e meccanica (D1)"
2471,Telerilevamento e radar,"Ingegneria Informatica, delle Comunicazioni ed Elettronica (L2)"
2472,Tecniche di selezione e valutazione del personale,Psicologia (LM)
2473,Social Dynamics Lab,Data Science (LM)
2474,PDE - Introduction to Academic Writing,Economia e Management (L2)
2475,Introduzione ai disturbi di ansia,Scienze e Tecniche di Psicologia Cognitiva (L2)
2476,Tecnologie multimediali,"Ingegneria Informatica, delle Comunicazioni ed Elettronica (L2)"
2477,Applications of fluid mechanics to energy engineering,Ingegneria Energetica (LM)
2478,Studi territoriali,Global and Local Studies (LM)
2479,Roman Foundations of European Law,"Comparative, European and International Legal Studies (L2)"
2480,Macchine ed elementi delle macchine,Ingegneria Civile (L2)
2481,Seminario: Storie di libertà mancate,Sociologia (L2)
2482,Ingegneria sismica e progettazione strutturale,Ingegneria Civile (LM)
2483,Fog and Cloud Computing,INFORMATICA (LM)
2484,Machine Learning for NLP II,Data Science (LM)
2485,Criminologia applicata,Giurisprudenza (LM5)
2486,Riabilitazione strutturale,Ingegneria Edile-Architettura (LM5)
2487,Applied Immunology,BIOTECNOLOGIE CELLULARI E MOLECOLARI (LM)
2488,Fundamentals of quality engineering,School of Innovation (CS)
2489,Letteratura italiana II - LM,Filologia e critica letteraria (LM)
2490,"Disturbi dello Spettro Autistico: definizione ed eziologia, metodologie di intervento nei diversi contesti",Metodologie di intervento educativo per soggetti con disturbi dello spettro autistico (M1)
2491,ICT Innovation,INFORMATICA (LM)
2492,Economia delle risorse umane,Management (LM)
2493,Fondamenti di robotica,"Ingegneria Informatica, delle Comunicazioni ed Elettronica (L2)"
2494,Data Analysis and Forecasting,Innovation Management - Management dell'innovazione (LM)
2495,Lineamenti di storia del teatro,Beni culturali (L2)
2496,Metodi matematici per la fisica,Fisica (L2)
2497,Pensiero islamico,Filosofia (L2)
2498,Data mining,Artificial Intelligence Systems (LM)
2499,Metallurgia,Ingegneria Industriale (L2)
2500,Global Migration and Security,Studi Sulla Sicurezza Internazionale (LM)
2501,International Trade and Globalisation,Gestione Aziendale (L2)
2502,Information system,Management (LM)
2503,Statistical models,MATEMATICA (LM)
2504,Intelligent vehicles and autonomous driving,Mechatronics Engineering (LM)
2505,Deep learning Lab,Data Science (LM)
2506,Computational Methods for Mechatronics,Artificial Intelligence Systems (LM)
2507,Principles of Law and Finance,"Comparative, European and International Legal Studies (L2)"
2508,Minority Rights,EUROPEAN AND INTERNATIONAL STUDIES - STUDI EUROPEI E INTERNAZIONALI (LM)
